,post_publish_time,title,source_url,content,file_path,code_name,text_type
0,2022-11-02 00:00:00+08:00,精达股份关于召开2022年第三季度业绩说明会的公告,http://www.sse.com.cn/disclosure/listedinfo/announcement/c/new/2022-11-02/600577_20221102_1_PkuzjcO8.pdf,"证券代码：600577             证券简称：精达股份             公告编号：2022-055 债券代码：110074             债券简称：精达转债铜陵精达特种电磁线股份有限公司关于召开2022年第三季度业绩说明会的公告本公司董事会及全体董事保证本公司公告内容不存在任何虚假记载、误导性陈述或者重大遗漏,并对其内容的真实性、准确性和完整性承担个别及连带责任。重要内容提示：会议召开时间：2022 年 11 月 11 日(星期五) 下午 14:00-15:00会 议 召 开 地 点 ： 上 海 证 券 交 易 所 上 证 路 演 中 心 （ 网 址 ：http://roadshow.sseinfo.com/）会议召开方式：上证路演中心网络互动投资者可于 2022 年 11 月 04 日(星期五) 至 11 月 10 日(星期四)16:00前登录上证路演中心网站首页点击“提问预征集”栏目或通过公司邮箱zqb@jingda.cn 进行提问。公司将在说明会上对投资者普遍关注的问题进行回答。铜陵精达特种电磁线股份有限公司（以下简称“公司”）已于 2022 年 10 月31 日发布公司 2022 年第三季度报告，为便于广大投资者更全面深入地了解公司2022 年第三季度经营成果、财务状况，公司计划于 2022 年 11 月 11 日 下午14:00-15:00 举行 2022 年第三季度业绩说明会，就投资者关心的问题进行交流。一、 说明会类型本次投资者说明会以网络互动形式召开，公司将针对 2022 年第三季度的经营成果及财务指标的具体情况与投资者进行互动交流和沟通，在信息披露允许的范围内就投资者普遍关注的问题进行回答。二、 说明会召开的时间、地点（一） 会议召开时间：2022 年 11 月 11 日 下午 14:00-15:00（二） 会议召开地点：上证路演中心（三） 会议召开方式：上证路演中心网络互动三、 参加人员董事长：李晓总经理：秦兵董事会秘书：周江财务总监：张军强独立董事：郭海兰四、 投资者参加方式（一）投资者可在 2022 年 11 月 11 日 下午 14:00-15:00，通过互联网登录上证路演中心（http://roadshow.sseinfo.com/），在线参与本次业绩说明会，公司将及时回答投资者的提问。（二）投资者可于 2022 年 11 月 04 日(星期五) 至 11 月 10 日(星期四)16:00前 登 录 上 证 路 演 中 心 网 站 首 页 ， 点 击 “ 提 问 预 征 集 ” 栏 目（http://roadshow.sseinfo.com/questionCollection.do），根据活动时间，选中本次活动或通过公司邮箱 zqb@jingda.cn 向公司提问，公司将在说明会上对投资者普遍关注的问题进行回答。五、联系人及咨询办法联系人：董秘办电话：0562-2809086邮箱：zqb@jingda.cn六、其他事项本 次 投 资 者 说 明 会 召 开 后 ， 投 资 者 可 以 通 过 上 证 路 演 中 心（http://roadshow.sseinfo.com/）查看本次投资者说明会的召开情况及主要内容。铜陵精达特种电磁线股份有限公司董事会2022 年 11 月 2 日",/iir/attachment/20221101/ed/ed19007fe7b8080adfb2e60cc9ecfcab.pdf,600577.sh,notice
1,2022-12-07 00:00:00+08:00,精达股份2022年第三次临时股东大会决议公告,http://www.sse.com.cn/disclosure/listedinfo/announcement/c/new/2022-12-07/600577_20221207_I4MJ.pdf,"证券代码：600577        证券简称：精达股份     公告编号：2022-080 债券代码：110074        债券简称：精达转债铜陵精达特种电磁线股份有限公司2022 年第三次临时股东大会决议公告本公司董事会及全体董事保证本公告内容不存在任何虚假记载、误导性陈述或者重大遗漏，并对其内容的真实性、准确性和完整性承担法律责任。重要内容提示：本次会议是否有否决议案：无一、会议召开和出席情况(一)股东大会召开的时间：2022 年 12 月 6 日(二)股东大会召开的地点：安徽省铜陵市经济技术开发区黄山大道北段988 号公司三楼会议室(三)出席会议的普通股股东和恢复表决权的优先股股东及其持有股份情况：1、出席会议的股东和代理人人数 192、出席会议的股东所持有表决权的股份总数（股） 523,773,6663、出席会议的股东所持有表决权股份数占公司有表决权股份总数的比例（%） 25.1919(四)表决方式是否符合《公司法》及《公司章程》的规定，大会主持情况等。本次会议由公司董事会召集，采取现场和网络投票相结合的方式召开，公司董事长李晓先生主持了本次会议。本次会议的召集、召开及表决方式均符合《中华人民共和国公司法》及《公司章程》的有关规定。本次会议所做的决议合法、有效。(五)公司董事、监事和董事会秘书的出席情况1、公司在任董事 8 人，出席 4 人，董事张震先生因工作原因未能参加本次会议，独立董事郑联盛先生、郭海兰女士、张菀洺女士因工作原因未能参加本次会议。2、公司在任监事 3 人，出席 3 人。3、董事会秘书周江先生出席了本次会议；其他高管 3 人列席了本次会议。二、议案审议情况(一)非累积投票议案1、议案名称：《关于修改公司章程的议案》审议结果：通过表决情况：股东类型 同意 反对 弃权票数 比例（%） 票数 比例（%） 票数 比例（%）A 股 511,767,642 97.7077 12,006,024 2.2923 0 0.00002、议案名称：《关于收购控股子公司少数股东股权并拟签署股权转让协议暨关联交易的议案》审议结果：通过表决情况：股东类型同意 反对 弃权票数 比例（%） 票数 比例（%） 票数 比例（%）A 股 523,731,966 99.9920 41,600 0.0079 100 0.0001(二)涉及重大事项，5%以下股东的表决情况议案序号议案名称同意反对弃权票数 比例（%） 票数比例（%）票数 比例（%）1 关于修改公司章程的议案 66,113,530 84.6312 12,006,024 15.3688 0 0.00002关于收购控股子公司少数股东股权并拟签署股权转让协议暨关联交易的议案78,077,85499.9466 41,600 0.0532 100 0.0002(三)关于议案表决的有关情况说明本次会议审议的议案 1 为特别决议事项，已获得出席会议股东或股东代表所持表决权的 2/3 以上表决通过；议案 2 为普通决议事项，已获得出席会议股东或股东代表所持表决权股份总数的 1/2 以上通过。三、律师见证情况1、本次股东大会见证的律师事务所：安徽安泰达律师事务所律师：潘平、刘彦锦2、律师见证结论意见：本次股东大会的召集、召开、表决程序符合有关法律法规和公司章程的规定，本次股东大会的出席会议人员资格合法有效，本次股东大会的表决结果合法有效。特此公告。铜陵精达特种电磁线股份有限公司董事会2022 年 12 月 7 日上网公告文件经鉴证的律师事务所主任签字并加盖公章的法律意见书报备文件经与会董事和记录人签字确认并加盖董事会印章的股东大会决议",/iir/attachment/20221207/bf/5b0f4d08f5c8d897527806654a733f6e.pdf,600577.sh,notice
2,2022-12-27 00:00:00+08:00,精达股份第八届董事会第十三次会议决议公告,http://www.cninfo.com.cn/new/disclosure/detail?stockCode=600577&announcementId=1215454507&orgId=gssh0600577&announcementTime=2022-12-27,"1 / 2证券代码：600577              证券简称：精达股份            公告编号：2022-083 债券代码：110074              债券简称：精达转债铜陵精达特种电磁线股份有限公司 第八届董事会第十三次会议决议公告本公司董事会及全体董事保证本公司公告内容不存在任何虚假记载、误导性陈述或者重大遗漏,并对其内容的真实性、准确性和完整性承担个别及连带责任。一、董事会会议召开情况1、铜陵精达特种电磁线股份有限公司第八届董事会第十三次会议于 2022 年12 月 23 日以通讯表决方式召开。2、本次会议通知于 2022 年 12 月 16 日以电子邮件发出，并以电话方式确认。3、本次会议应参加会议董事 8 人，实际参会董事 8 人。4、本次会议的召开符合《公司法》和《公司章程》的有关规定。二、董事会会议审议情况1、审议了《关于向控股子公司提供担保的议案》表决结果：同意 8 票，反对 0 票，弃权 0 票。本议案尚需提交股东大会审议。具体详见公司于 2022 年 12 月 27 日披露于上海证券交易所《精达股份关于向控股子公司提供担保的公告》。2、审议通过《关于召开公司 2023 年第一次临时股东大会的议案》根据有关法律、法规及《公司章程》的有关规定，本次董事会相关议案尚需提交公司股东大会进行审议，现决定于 2023 年 1 月 12 日召开公司 2023 年第一次临时股东大会。该议案以 8 票同意，0 票反对，0 票弃权，审议通过。具体详见公司于 2022 年 12 月 27 日披露于上海证券交易所《精达股份关于召开 2023 年第一次临时股东大会的通知》。2 / 2三、备查文件1、公司第八届董事会第十三次会议决议；2、公司独立董事关于第八届董事会第十三次会议相关事项的独立意见。特此公告。铜陵精达特种电磁线股份有限公司董事会2022 年 12 月 27 日",/iir/attachment/20230105/fa/facce2410cc34c7e74d131415c1d2ff3.pdf,600577.sh,notice
3,2022-03-08 00:00:00+08:00,精达股份第八届董事会第一次会议决议公告,http://www.sse.com.cn/disclosure/listedinfo/announcement/c/new/2022-03-08/600577_20220308_3_b4KB7Rn8.pdf,"1 / 5证券代码：600577              证券简称：精达股份            公告编号：2022-014 债券代码：110074              债券简称：精达转债铜陵精达特种电磁线股份有限公司  第八届董事会第一次会议决议公告本公司董事会及全体董事保证本公司公告内容不存在任何虚假记载、误导性陈述或者重大遗漏,并对其内容的真实性、准确性和完整性承担个别及连带责任。一、董事会会议召开情况1、铜陵精达特种电磁线股份有限公司第八届董事会第一次会议于 2022 年 2月 28 日以通讯表决方式召开。2、本次会议通知及会议材料于 2022 年 2 月 28 日发出，并以电话方式确认。3、应参加会议董事 9 人，实际参加会议董事 9 人。4、会议的召开符合相关法律、法规的规定。二、董事会会议审议情况1、审议公司《关于选举公司董事长、副董事长的议案》；公司新一届董事会已经过公司股东大会选举产生。根据公司章程，经过董事会审议，选举李晓先生担任公司第八届董事会董事长，陈彬先生担任副董事长。同意 9 票，反对 0 票，弃权 0 票，审议通过。2、审议《关于聘任公司总经理、董事会秘书、证券事务代表的议案》；根据公司董事长李晓先生提名，聘任秦兵先生为公司总经理、聘任周江先生为公司董事会秘书、聘任张倩女士为公司证券事务代表。同意 9 票，反对 0 票，弃权 0 票，审议通过。3、审议《关于聘任公司高级管理人员的议案》；根据公司总经理秦兵先生提名，聘任张军强先生为公司财务总监、聘任李松女士为公司人事总监、聘任张永忠先生为公司行政总监、聘任赵俊先生为公司技术总监。2 / 5同意 9 票，反对 0 票，弃权 0 票，审议通过，审议通过。4、审议《关于成立新一届董事会专门委员会的议案》。根据《公司法》、《上市公司治理准则》和《董事会专门委员会实施细则》等有关法律、法规的规定，成立第八届董事会专门委员会，包括董事会战略委员会、提名委员会、审计委员会、薪酬与考核委员会。委员会名称 组成人员要求 组成人员 召集人(主任委员)战略委员会至少包括一名独立董事，召集人由董事长担任李  晓徐晓芳郑联盛李  晓提名委员会独立董事占多数，召集人由独立董事担任郑联盛郭海兰秦  兵郑联盛审计委员会独立董事占多数，至少有一名独立董事为专业会计人士，召集人由独立董事担任郭海兰郑联盛张  震郭海兰薪酬与考核委员会独立董事占多数，召集人由独立董事担任张菀洺郭海兰李  晓张菀洺该议案以 9 票同意，0 票反对，0 票弃权，审议通过。三、备查文件1、精达股份第八届董事会第一次会议决议；2、精达股份独立董事关于第八届董事会第一次会议相关事项的独立意见。特此公告。铜陵精达特种电磁线股份有限公司董事会2022 年 3 月 8 日3 / 5附：董事长、副董事长、公司高管及证券事务代表简历1、董事长李晓先生简历李晓先生，1973 年 4 月出生，中共党员，硕士。现任铜陵精达特种电磁线股份有限公司董事长、华安财产保险股份有限公司执行董事，华安财保资产管理有限责任公司董事等职务，并荣获安徽省科学技术进步奖等荣誉。曾任特华投资控股有限公司执行总裁、辽宁成大股份有限公司董事等职务。2、副董事长陈彬先生简历陈彬先生，1969 年 5 月出生，中共党员，研究生。现任铜陵精达特种电磁线股份有限公司董事、副董事长、总经理等职务，先后荣获安徽省战略性新兴产业技术领军人才、安徽省科学技术进步奖等荣誉；当选中国电器工业协会电线电缆分会副理事长、铜陵市政协委员等社会职务。曾任广东精达里亚特种漆包线有限公司总经理、江苏精达里亚阿尔冈琴工程线有限公司总经理等职务。3、总经理秦兵先生简历秦兵先生，1969 年 5 月出生，中共党员。现任铜陵精达里亚特种漆包线有限公司总经理等职务，曾任铜陵精迅特种漆包线有限责任公司市场部经理、总监等职务。在其任职铜陵精达里亚特种漆包线有限公司总经理以来，积极推动新技术、新工艺的研发，实现公司产品结构、客户结构的转型升级，积极推进新能源汽车小扁线项目的研发、生产和全球汽车网络体系的覆盖。主持并参与多项发明专利的研发和申报，累计获得授权专利 13 项。期间“高性能异型铜电磁线关键制造技术及应用”荣获安徽省科学技术二等奖；2018 年高性能电机用特种扁平电磁线的研究及产业化项目获得省科技厅重大专项；所属公司荣获“省级数字化车间”、“安徽省劳动保障诚信示范单位”、“国家级绿色工厂”等荣誉称号。4 / 54、董事会秘书周江先生简历周江先生,1979 年 7 月出生,硕士。现任铜陵精达特种电磁线股份有限公司证券事务代表等职务，曾任铜陵精达特种电磁线股份有限公司信息披露专员等职务 。5、财务总监张军强先生简历张军强先生，1976 年 3 月出生，中共党员，研究生。现任铜陵精达特种电磁线股份有限公司董事、财务总监等职务。曾任铜陵精工特种漆包线有限公司财务部经理、铜陵顶科镀锡铜线有限公司财务部经理、铜陵精达特种电磁线股份有限公司监事、监事会主席等职务。6、人事总监李松女士简历李松女士，1968 年 8 月出生，中共党员，本科学历，工程师。现任铜陵精达特种电磁线股份有限公司人事总监等职务，曾任铜陵家用电器铜材厂技术科科员、铜陵精达铜材（集团）有限责任公司工程师、铜陵顶科镀锡铜线有限公司总经理、铜陵精达特种电磁线股份有限公司企管部经理等职务。7、行政总监张永忠先生简历张永忠先生，1968 年 7 月出生，中共党员，本科学历，高级工程师。现任铜陵精达特种电磁线股份行政总监等职务。先后多次荣获省、市科技进步奖，并被推荐选拔为铜陵市第五、六批拔尖人才。曾任铜陵精达特种电磁线股份技术总监等职务。8、技术总监赵俊先生简历赵俊先生，1972 年 10 月出生，中共党员，本科学历。现任铜陵精达特种电磁线股份技术总监等职务。曾任铜陵精达模具分公司制造部经理、经理；江5 / 5苏精达里亚阿尔岗琴工程线有限公司制造部经理、市场总监；江苏顶科线材有限公司品质部经理。9、证券事务代表张倩女士简历张倩女士，1991 年 8 月出生，研究生学历。现任铜陵精达特种电磁线股份有限公司信息披露专员，曾任铜陵精达里亚特种漆包线有限公司出纳会计。",/iir/attachment/20220601/c/53032561c4aef5395a04eb7eff3b914a.pdf,600577.sh,notice
4,2022-03-08 00:00:00+08:00,精达股份关于选举职工代表监事的公告,http://www.sse.com.cn/disclosure/listedinfo/announcement/c/new/2022-03-08/600577_20220308_2_U8Kh89cp.pdf,"1 / 2证券代码：600577              证券简称：精达股份            公告编号：2022-013 债券代码：110074              债券简称：精达转债铜陵精达特种电磁线股份有限公司关于选举职工代表监事的公告本公司监事会及全体监事保证本公司公告内容不存在任何虚假记载、误导性陈述或者重大遗漏,并对其内容的真实性、准确性和完整性承担个别及连带责任。公司第七届监事会任期即将届满，根据《公司法》、《公司章程》等有关规定，公司于 2022 年 3 月 7 日召开职工代表大会。经公司职工代表大会审议，选举苏保信先生为公司第八届监事会职工代表监事（个人简历附后）。苏保信先生将与公司 2022 年第二次临时股东大会选举产生的两名非职工监事共同组成公司第八届监事会，任期与第八届监事会其他监事一致。特此公告。铜陵精达特种电磁线股份有限公司监事会2022 年 3 月 8 日2 / 2附件：职工代表监事简历苏保信先生，1980 年 4 月出生，本科学历。2000 年 6 月进入铜陵精达特种电磁线股份有限公司工作，一直从事质量检测和研发等工作，现任精达股份国家级企业技术中心实验室主任、中国质量检验协会质量检验经理、机械行业职业技能竞赛裁判员，曾荣获 2020 年获得全国劳动模范称号。",/iir/attachment/20220601/b/07b76450bb3d99dfba55393c8ed71435.pdf,600577.sh,notice
5,2022-03-08 00:00:00+08:00,精达股份关于股东集中竞价减持股份数量过半暨减持进展公告,http://www.sse.com.cn/disclosure/listedinfo/announcement/c/new/2022-03-08/600577_20220308_1_sdQsuv0T.pdf,"1证券代码：600577        证券简称：精达股份        公告编号：2022-011债券代码：110074        债券简称：精达转债铜陵精达特种电磁线股份有限公司股东集中竞价减持股份数量过半暨减持进展公告本公司董事会、全体董事及相关股东保证本公告内容不存在任何虚假记载、误导性陈述或者重大遗漏，并对其内容的真实性、准确性和完整性承担个别及连带责任。重要内容提示：大股东持股的基本情况本次股份减持计划实施前，南京瑞椿投资管理合伙企业（有限合伙）（以下简称“南京瑞椿”）持有铜陵精达特种电磁线股份有限公司（以下简称“公司”）104,000,000 股无限售流通股，占公司总股本的 5.21%。集中竞价减持计划的进展情况公司股东南京瑞椿计划自 2022 年 2 月 18 日至 2022 年 5 月 18 日通过集中竞价交易方式减持公司股份合计不超过 19,957,049 股（即合计不超过公司总股本的 1%）。具体详见公司于 2022 年 1 月 21 日披露的《精达股份股东集中竞价减持股份计划公告》（公告编号：2022-005）。2022 年 3 月 7 日，公司收到南京瑞椿发来的《告知函》，告知南京瑞椿已通过集中竞价交易方式累计减持其持有的本公司股份 14,956,993 股，累计减持数量已超过其减持股份计划公告数量的一半，减持计划尚未实施完毕。一、集中竞价减持主体减持前基本情况股东名称 股东身份持股数量（股）持股比例 当前持股股份来源南京瑞椿投资管理合伙企业（有限合伙）5%以上非第一大股东104,000,000 5.21%协议转让取得：104,000,000 股2上述减持主体无一致行动人。二、集中竞价减持计划的实施进展（一）大股东及董监高因以下原因披露集中竞价减持计划实施进展：集中竞价交易减持数量过半（二）本次减持事项与大股东或董监高此前已披露的计划、承诺是否一致√是 □否（三）在减持时间区间内，上市公司是否披露高送转或筹划并购重组等重大事项□是 √否（四）本次减持对公司的影响本次减持计划系股东南京瑞椿根据自身资金需求自主决定，不会对公司治理结构、股权结构及未来持续经营产生重大影响，亦不会导致控股股东、实际控制人发生变化。（五）本所要求的其他事项无股东名称减持数量（股）减持比例减持期间 减持方式减持价格区间（元/股）减持总金额（元）当前持股数量（股）当前持股比例南京瑞椿投资管理合伙企业（有限合伙）14,956,9930.75%2022/2/18～2022/3/7集中竞价交易5.93 -6.7994,961,375.9389,043,0074.46%3三、集中竞价减持计划相关风险提示（一）减持计划实施的不确定性风险，本次减持股份计划系南京瑞椿自身资金需求自主决定，在减持期间内，南京瑞椿将根据市场情况、公司股价等因素选择如何实施减持计划，存在不确定性。（二）减持计划实施是否会导致上市公司控制权发生变更的风险□是√否（三）其他风险1.本次减持计划符合《中华人民共和国证券法》、《上市公司股东、董监高减持股份的若干规定》、《上海证券交易所科创板股票上市规则》及《上海证券交易所上市公司股东及董事、监事、高级管理人员减持股份实施细则》等有关法律法规的规定。2.本次减持计划实施期间，前述股东将严格按照有关法律法规及相关监管要求实施减持，并按照相关规定履行信息披露义务。特此公告。铜陵精达特种电磁线股份有限公司董事会2022 年 3 月 8 日",/iir/attachment/20220601/f/f495381e35dd7cdea9d426a67c1bd866.pdf,600577.sh,notice
