read amount,comments,title,content link,author,create time
15042,0,百利电气：2014年半年度主要财务指标,"/news,600468,117951708.html",百利电气资讯,08-11 02:48
6886,0,百利电气：董事会五届三十次会议决议公告,"/news,600468,117950108.html",百利电气资讯,08-11 02:42
9388,2,百利电气实控人百利机电将公司股份转让给鑫皓投资,"/news,600468,109363048.html",百利电气资讯,04-30 05:11
10318,5,百利电气控股子公司土地被政府收储,"/news,600468,107481145.html",百利电气资讯,04-14 06:29
11741,19,百利电气2013年净利3378万 同比增16%,"/news,600468,104919542.html",百利电气资讯,03-17 07:59
15727,19,百利电气实际控制人与天汽集团重组,"/news,600468,96762289.html",百利电气资讯,01-02 08:11
11953,11,百利集团天汽集团整合重组 天津国资改革提速,"/news,600468,96760003.html",百利电气资讯,01-02 07:52
11083,15,百利电气非公开发行A股股票方案获天津市国资委批复,"/news,600468,96186111.html",百利电气资讯,12-26 07:41
7762,5,百利电气非公开发行股票获天津市国资委批复,"/news,600468,96185561.html",百利电气资讯,12-26 07:35
8102,0,两度折戟后 百利电气第三版定增案出炉,"/news,600468,93547804.html",百利电气资讯,12-02 04:11
15576,0,百利电气控股子公司拟不超2702万购买土地,"/news,600468,93522080.html",百利电气资讯,12-01 07:02
8266,2,百利电气两全资子公司吸收合并,"/news,600468,86690751.html",百利电气资讯,09-06 05:50
16392,1,百利电气：2013年半年度主要财务指标,"/news,600468,85444279.html",百利电气资讯,08-22 08:41
7669,1,百利电气拟转让赣州海创100%股权,"/news,600468,82548223.html",百利电气资讯,07-10 08:16
4980,0,百利电气控股子公司参与中央预算内投资建设项目,"/news,600468,72466719.html",百利电气资讯,04-15 06:44
6683,0,百利电气子公司拟2155.7万在新厂区进行设备投资,"/news,600468,60527975.html",百利电气资讯,01-07 09:25
