,title,post_publish_time,code_name,content
358,超频三：主力资金连续10天净流出累计1.1亿元（12-03）,2020-12-03 15:44:00,300647.sz,超频三2020年12月3日收报12.48元，涨跌幅0.81%，换手率5.00%。当日该股主力资金流入1550.48万元，流出1755.86万元，主力净流出205.37万元。其中，超大单流入309.02万元，流出118.56万元，净流入190.46万元。当日散户资金流入1.15亿元，流出1.13亿元，散户净流入205.37万元。资金流向分布情况如下图： 超频三近五日主力资金、超大单资金流向情况如下表： 超频三今日主力资金流向两市排名2182/4093，近五日内该股主力资金总体呈流出状态，五日共净流出4156.18万元。
359,超频三：主力资金连续9天净流出累计1.08亿元（12-02）,2020-12-02 15:43:47,300647.sz,超频三2020年12月2日收报12.38元，涨跌幅-0.80%，换手率5.04%。当日该股主力资金流入1105.07万元，流出2281.59万元，主力净流出1176.52万元。其中，超大单流入0元，流出175.22万元，净流出175.22万元。当日散户资金流入1.22亿元，流出1.1亿元，散户净流入1176.52万元。资金流向分布情况如下图： 超频三近五日主力资金、超大单资金流向情况如下表： 超频三今日主力资金流向两市排名3385/4091，近五日内该股主力资金总体呈流出状态，五日共净流出4546.53万元。
360,超频三今日热门盘点,2020-12-01 21:13:01,300647.sz,超频三今日股吧人气排名两市第1461/4217。          
361,超频三：主力资金连续8天净流出累计9599.95万元（12-01）,2020-12-01 15:44:28,300647.sz,超频三2020年12月1日收报12.48元，涨跌幅-0.32%，换手率5.62%。当日该股主力资金流入1564.55万元，流出2894.79万元，主力净流出1330.24万元。其中，超大单流入0元，流出333.52万元，净流出333.52万元。当日散户资金流入1.32亿元，流出1.19亿元，散户净流入1330.24万元。资金流向分布情况如下图： 超频三近五日主力资金、超大单资金流向情况如下表： 超频三今日主力资金流向两市排名3729/4087，近五日内该股主力资金总体呈流出状态，五日共净流出5806.88万元。
362,超频三：股东拟减持不超过1.84%公司股份,2020-11-30 21:06:57,300647.sz,【超频三：股东拟减持不超过1.84%公司股份】超频三(300647)11月30日晚公告，公司控股股东、实控人的一致行动人吉信泰富计划自本公告之日起十五个交易日后的六个月内以集中竞价或大宗交易方式减持本公司股份不超过656万股，即不超过公司目前总股本比例的1.84%。（e公司）
363,超频三：股东吉信泰富拟减持不超过656万股,2020-11-30 20:52:30,300647.sz,超频三(SZ300647，收盘价：12.52元)11月30日晚间发布公告称，公司于近日收到吉信泰富出具的《关于拟减持公司股份的告知函》。深圳市超频三科技股份有限公司控股股东、实际控制人的一致行动人云南吉信泰富企业管理中心(有限合伙)计划自本公告之日起十五个交易日后的六个月内以集中竞价或大宗交易方式减...
364,超频三：主力资金连续7天净流出累计8269.71万元（11-30）,2020-11-30 15:44:27,300647.sz,超频三2020年11月30日收报12.52元，涨跌幅-2.19%，换手率4.65%。当日该股主力资金流入974.44万元，流出1546.17万元，主力净流出571.73万元。其中，超大单流入0元，流出153.01万元，净流出153.01万元。当日散户资金流入1.15亿元，流出1.1亿元，散户净流入571.73万元。资金流向分布情况如下图： 超频三近五日主力资金、超大单资金流向情况如下表： 超频三今日主力资金流向两市排名3057/4086，近五日内该股主力资金总体呈流出状态，五日共净流出4500.3万元。
365,超频三主力资金连续14周净流出合计6.64亿元,2020-11-29 16:27:33,300647.sz,超频三本周(2020/11/23-2020/11/27)累计跌幅达9.73%，截至11月27日最新股价报收12.8元。本周主力资金流入7762.12万元，流出1.35亿元，主力净流出5694.14万元。其中，超大单流入651.73万元，流出1108.08万元，净流出456.35万元。本周散户资金流入7.78亿元，流出7.21亿元，散户净流入5694.14万元。本周详细资金流向数据如下表： 超频三本周主力资金延续流出态势，已连续14周净流出累计达6.64亿元。周度主力资金净流入值在所属东财二级行业板块（电子元件）中排名201/261，两市排名3416/4086。
366,超频三：主力资金连续6天净流出累计7697.99万元（11-27）,2020-11-27 15:44:43,300647.sz,超频三2020年11月27日收报12.8元，涨跌幅-3.10%，换手率6.05%。当日该股主力资金流入1546.54万元，流出2418.86万元，主力净流出872.32万元。其中，超大单流入79.31万元，流出101.83万元，净流出22.52万元。当日散户资金流入1.5亿元，流出1.41亿元，散户净流入872.32万元。资金流向分布情况如下图： 超频三近五日主力资金、超大单资金流向情况如下表： 超频三今日主力资金流向两市排名3218/4086，近五日内该股主力资金总体呈流出状态，五日共净流出5694.14万元。
367,超频三今日热门盘点,2020-11-26 21:11:12,300647.sz,超频三今日股吧人气排名两市第959/4215。       
368,超频三：主力资金连续5天净流出累计6825.67万元（11-26）,2020-11-26 15:44:00,300647.sz,超频三2020年11月26日收报13.21元，涨跌幅0.84%，换手率6.09%。当日该股主力资金流入1943.04万元，流出2538.77万元，主力净流出595.73万元。其中，超大单流入0元，流出117.64万元，净流出117.64万元。当日散户资金流入1.54亿元，流出1.48亿元，散户净流入595.73万元。资金流向分布情况如下图： 超频三近五日主力资金、超大单资金流向情况如下表： 超频三今日主力资金流向两市排名2773/4085，近五日内该股主力资金总体呈流出状态，五日共净流出6825.67万元。
369,超频三：主力资金连续4天净流出累计6229.94万元（11-25）,2020-11-25 15:44:34,300647.sz,超频三2020年11月25日收报13.1元，涨跌幅-5.48%，换手率7.41%。当日该股主力资金流入1769.6万元，流出4206.46万元，主力净流出2436.86万元。其中，超大单流入400.43万元，流出630.97万元，净流出230.54万元。当日散户资金流入1.94亿元，流出1.7亿元，散户净流入2436.86万元。资金流向分布情况如下图： 超频三近五日主力资金、超大单资金流向情况如下表： 超频三今日主力资金流向两市排名3505/4084，近五日内该股主力资金总体呈流出状态，五日共净流出6088.96万元。
370,超频三：主力资金连续3天净流出累计3793.08万元（11-24）,2020-11-24 15:44:07,300647.sz,超频三2020年11月24日收报13.86元，涨跌幅0.95%，换手率4.55%。当日该股主力资金流入1271.75万元，流出1295.42万元，主力净流出23.67万元。其中，超大单流入1395元，流出0元，净流入1395元。当日散户资金流入1.2亿元，流出1.2亿元，散户净流入23.67万元。资金流向分布情况如下图： 超频三近五日主力资金、超大单资金流向情况如下表： 超频三今日主力资金流向两市排名1369/4083，近五日内该股主力资金总体呈流出状态，五日共净流出3083.66万元。
371,超频三今日热门盘点,2020-11-23 21:16:24,300647.sz,超频三今日股吧人气排名两市第1081/4212。          
372,超频三：主力资金净流出1765.57万元，净占比-10.01%（11-23）,2020-11-23 15:43:55,300647.sz,超频三2020年11月23日收报13.73元，涨跌幅-3.17%，换手率5.87%。当日该股主力资金流入1231.19万元，流出2996.75万元，主力净流出1765.57万元。其中，超大单流入171.84万元，流出257.64万元，净流出85.8万元。当日散户资金流入1.6亿元，流出1.43亿元，散户净流入1765.57万元。资金流向分布情况如下图： 超频三近五日主力资金、超大单资金流向情况如下表： 超频三今日主力资金流向两市排名3630/4082，近五日内该股主力资金总体呈流出状态，五日共净流出4466.83万元。
373,超频三主力资金连续13周净流出合计6.07亿元,2020-11-22 16:16:00,300647.sz,超频三本周(2020/11/16-2020/11/20)累计跌幅达3.73%，截至11月20日最新股价报收14.18元。本周主力资金流入1.43亿元，流出1.99亿元，主力净流出5598.51万元。其中，超大单流入979.78万元，流出3307.3万元，净流出2327.52万元。本周散户资金流入10.45亿元，流出9.89亿元，散户净流入5598.51万元。本周详细资金流向数据如下表： 超频三本周主力资金延续流出态势，已连续13周净流出累计达6.07亿元。周度主力资金净流入值在所属东财二级行业板块（电子元件）中排名196/261，两市排名3604/4080。
388,超频三今日热门盘点,2020-11-09 21:12:22,300647.sz,超频三今日股吧人气排名两市第240/4201。           
389,超频三：主力资金净流出2500.39万元，净占比-2.98%（11-09）,2020-11-09 15:42:53,300647.sz,超频三2020年11月9日收报17.5元，涨跌幅3.24%，换手率22.32%。当日该股主力资金流入1.39亿元，流出1.64亿元，主力净流出2500.39万元。其中，超大单流入1165.51万元，流出1600.74万元，净流出435.22万元。当日散户资金流入6.85亿元，流出6.6亿元，散户净流入2500.39万元。资金流向分布情况如下图： 超频三近五日主力资金、超大单资金流向情况如下表： 超频三今日主力资金流向两市排名3874/4072，近五日内该股主力资金总体呈流出状态，五日共净流出1.15亿元。
390,超频三主力资金连续11周净流出合计4.51亿元,2020-11-08 16:53:47,300647.sz,超频三本周(2020/11/02-2020/11/06)累计涨幅达9.64%，截至11月6日最新股价报收16.95元。本周主力资金流入5.65亿元，流出6.32亿元，主力净流出6684.85万元。其中，超大单流入4655.79万元，流出4699.86万元，净流出44.07万元。本周散户资金流入26.88亿元，流出26.21亿元，散户净流入6684.85万元。本周详细资金流向数据如下表： 超频三本周主力资金延续流出态势，已连续11周净流出累计达4.51亿元。周度主力资金净流入值在所属东财二级行业板块（电子元件）中排名237/259，两市排名3718/4071。
391,超频三今日热门盘点,2020-11-06 20:57:18,300647.sz,       
392,超频三：聘任杜建军为公司总经理,2020-11-06 18:20:16,300647.sz,超频三11月6日发布公告称，公司董事会同意聘任杜建军先生为公司总经理，聘任张正华先生、刘卫红先生、王军先生、毛松先生为公司副总经理，同时聘任王军先生为公司董事会秘书，聘任毛松先生为公司财务总监，聘任罗丽云女士为公司证券事务代表。（文章来源：界面新闻）
393,超频三：杜建军出任公司总经理,2020-11-06 17:55:33,300647.sz,超频三(SZ300647，收盘价：16.95元)11月6日下午发布公告称，公司董事会同意聘任杜建军先生为公司总经理，聘任张正华先生、刘卫红先生、王军先生、毛松先生为公司副总经理，同时聘任王军先生为公司董事会秘书，聘任毛松先生为公司财务总监，聘任罗丽云女士为公司证券事务代表。2019年年报显示，超频三...
394,超频三：主力资金净流出4624.63万元，净占比-5.40%（11-06）,2020-11-06 15:43:57,300647.sz,超频三2020年11月6日收报16.95元，涨跌幅1.62%，换手率23.22%。当日该股主力资金流入1.43亿元，流出1.89亿元，主力净流出4624.63万元。其中，超大单流入570.52万元，流出2040.95万元，净流出1470.44万元。当日散户资金流入6.98亿元，流出6.52亿元，散户净流入4624.63万元。资金流向分布情况如下图： 超频三近五日主力资金、超大单资金流向情况如下表： 超频三今日主力资金流向两市排名3836/4071，近五日内该股主力资金总体呈流出状态，五日共净流出6684.85万元。
395,超频三：主力资金净流入132.51万元，净占比0.17%（11-05）,2020-11-05 15:44:05,300647.sz,超频三2020年11月5日收报16.68元，涨跌幅6.58%，换手率21.56%。当日该股主力资金流入1.48亿元，流出1.46亿元，主力净流入132.51万元。其中，超大单流入2248.89万元，流出869.07万元，净流入1379.82万元。当日散户资金流入6.01亿元，流出6.02亿元，散户净流出132.51万元。资金流向分布情况如下图： 超频三近五日主力资金、超大单资金流向情况如下表： 超频三今日主力资金流向两市排名1435/4070，近五日内该股主力资金总体呈流出状态，五日共净流出7398.82万元。
396,超频三今日热门盘点,2020-11-04 21:00:58,300647.sz,      
397,超频三：主力资金净流出965.31万元，净占比-2.21%（11-04）,2020-11-04 17:19:11,300647.sz,超频三2020年11月4日收报15.65元，涨跌幅-2.25%，换手率12.90%。当日该股主力资金流入6177.68万元，流出7142.98万元，主力净流出965.31万元。其中，超大单流入286.26万元，流出601.38万元，净流出315.11万元。当日散户资金流入3.65亿元，流出3.55亿元，散户净流入965.31万元。资金流向分布情况如下图： 超频三近五日主力资金、超大单资金流向情况如下表： 超频三今日主力资金流向两市排名3335/4067，近五日内该股主力资金总体呈流出状态，五日共净流出1.92亿元。
398,超频三今日热门盘点,2020-11-03 21:02:31,300647.sz,        
399,超频三：主力资金净流出3535.17万元，净占比-5.99%（11-03）,2020-11-03 15:46:32,300647.sz,超频三2020年11月3日收报16.01元，涨跌幅-0.99%，换手率17.17%。当日该股主力资金流入7976.59万元，流出1.15亿元，主力净流出3535.17万元。其中，超大单流入601.51万元，流出507.85万元，净流入93.67万元。当日散户资金流入4.96亿元，流出4.61亿元，散户净流入3535.17万元。资金流向分布情况如下图： 超频三近五日主力资金、超大单资金流向情况如下表： 超频三今日主力资金流向两市排名3944/4067，近五日内该股主力资金总体呈流出状态，五日共净流出3339.81万元。
400,超频三今日热门盘点,2020-11-02 20:52:57,300647.sz,      
401,超频三：主力资金净流入2307.75万元，净占比3.41%（11-02）,2020-11-02 15:44:02,300647.sz,超频三2020年11月2日收报16.17元，涨跌幅4.59%，换手率19.55%。当日该股主力资金流入1.33亿元，流出1.1亿元，主力净流入2307.75万元。其中，超大单流入948.61万元，流出680.61万元，净流入268万元。当日散户资金流入5.28亿元，流出5.51亿元，散户净流出2307.75万元。资金流向分布情况如下图： 超频三近五日主力资金、超大单资金流向情况如下表： 超频三今日主力资金流向两市排名196/4067，近五日内该股主力资金总体呈流入状态，五日共净流入1759.52万元。
402,超频三今日热门盘点,2020-10-30 20:57:55,300647.sz,               
403,超频三：主力资金净流出5338.59万，净占比-6.89%（10-30）,2020-10-30 18:55:22,300647.sz,超频三2020年10月30日收报15.46元，涨跌幅-9.33%，换手率22.32%。当日该股主力资金流入1.02亿元，流出1.55亿元，主力净流出5338.59万元。其中，超大单流入628.78万元，流出2202.93万元，净流出1574.15万元。当日散户资金流入6.47亿元，流出5.93亿元，散户净流入5338.59万元。资金流向分布情况如下图： 超频三近五日主力资金、超大单资金流向情况如下表： 超频三今日主力资金流向两市排名3820/4066，近五日内该股主力资金总体无进出，五日共净流出142.54万元。
413,超频三：主力资金连续4天净流入累计1.73亿元（10-28）,2020-10-28 16:02:08,300647.sz,超频三2020年10月28日收报16.7元，涨跌幅19.97%，换手率28.11%。当日该股主力资金流入4.18亿元，流出2.69亿元，主力净流入1.49亿元。其中，超大单流入2.41亿元，流出6784.59万元，净流入1.73亿元。当日散户资金流入5.3亿元，流出6.78亿元，散户净流出1.49亿元。资金流向分布情况如下图： 超频三近五日主力资金、超大单资金流向情况如下表： 超频三今日主力资金流向两市排名35/4061，近五日内该股主力资金总体呈流入状态，五日共净流入1.63亿元。
414,超频三盘中最高16.7元，股价创近一年新高,2020-10-28 15:28:16,300647.sz,10月28日，超频三盘中最高价16.7元，股价创近一年新高。截至收盘，超频三最新价为16.7元，上涨19.97%，全日成交金额达到9.59亿元，换手率28.11%。根据最新收盘价进行计算，超频三总市值为59.6亿元。 Choice数据显示，超频三近一年的前次股价高点出现在2020年9月8日，当日最高价为16元(前复权)，后市未能突破前次高点，股价最低于2020年9月11日下探10.34元(前复权)。以最低点为区间起点计算，2020年9月11日至2020年10月28日，超频三区间累计涨幅达到52.37%。 横向与市场指数和所属行业进行比较，2020年9月11日至2020年10月28日区间内，创业板指同期上涨5.28%，申万二级行业电子制造同期上涨8.19%。个股表现跑赢创业板指，强于所属申万行业指数。  从全市场来看，10月28日沪深两市共有湖南海利、英飞特、三角轮胎等47只股票价格创近一年新高。其中湖南海利股价已连续六日创下近一年盘中最高价。
415,超频三预计明日收盘后（周四晚）披露三季报,2020-10-27 18:33:44,300647.sz,超频三（300647）预计明日收盘后（周四晚）披露第三季度季报（报表公告日：2020年10月30日）。
416,超频三：主力资金连续3天净流入累计2402.06万元（10-27）,2020-10-27 15:44:55,300647.sz,超频三2020年10月27日收报13.92元，涨跌幅5.06%，换手率18.25%。当日该股主力资金流入1.15亿元，流出9905.5万元，主力净流入1564.16万元。其中，超大单流入2028.76万元，流出698.47万元，净流入1330.29万元。当日散户资金流入4.27亿元，流出4.43亿元，散户净流出1564.16万元。资金流向分布情况如下图： 超频三近五日主力资金、超大单资金流向情况如下表： 超频三今日主力资金流向两市排名217/4060，近五日内该股主力资金总体呈流出状态，五日共净流出2377.52万元。
417,超频三：主力资金净流入405.69万，净占比1.69%（10-26）,2020-10-26 15:47:53,300647.sz,超频三2020年10月26日收报13.25元，涨跌幅4.17%，换手率8.55%。当日该股主力资金流入3247.56万元，流出2841.88万元，主力净流入405.69万元。其中，超大单流入360.97万元，流出48.84万元，净流入312.12万元。当日散户资金流入1.96亿元，流出2亿元，散户净流出405.69万元。资金流向分布情况如下图： 超频三近五日主力资金、超大单资金流向情况如下表： 超频三今日主力资金流向两市排名511/4059，近五日内该股主力资金总体呈流出状态，五日共净流出2869.44万元。
418,超频三：主力资金净流入432.21万，净占比1.80%（10-23）,2020-10-23 16:08:08,300647.sz,超频三2020年10月23日收报12.72元，涨跌幅2.17%，换手率8.55%。当日该股主力资金流入3035.66万元，流出2603.45万元，主力净流入432.21万元。其中，超大单流入142.99万元，流出135.68万元，净流入7.31万元。当日散户资金流入2.05亿元，流出2.09亿元，散户净流出432.21万元。资金流向分布情况如下图： 超频三近五日主力资金、超大单资金流向情况如下表： 超频三今日主力资金流向两市排名309/4056，近五日内该股主力资金总体呈流出状态，五日共净流出6255.26万元。
419,超频三：李光耀辞去副总经理职务,2020-10-22 21:10:07,300647.sz,超频三(SZ300647，收盘价：12.45元)10月22日晚间发布公告称，深圳市超频三科技股份有限公司董事会于近日收到公司副总经理兼董事李光耀先生的辞职报告，为进一步完善公司治理结构，经多方面考虑，李光耀先生申请辞去公司副总经理职务，仍担任公司董事并作为公司新一届董事会董事候选人。截至本公告日，李...
420,超频三：主力资金净流出1007.61万，净占比-5.46%（10-22）,2020-10-22 15:53:15,300647.sz,超频三2020年10月22日收报12.45元，涨跌幅-1.97%，换手率6.82%。当日该股主力资金流入1637.27万元，流出2644.88万元，主力净流出1007.61万元。其中，超大单流入7.24万元，流出102.62万元，净流出95.38万元。当日散户资金流入1.63亿元，流出1.53亿元，散户净流入1007.61万元。资金流向分布情况如下图： 超频三近五日主力资金、超大单资金流向情况如下表： 超频三今日主力资金流向两市排名3378/4055，近五日内该股主力资金总体呈流出状态，五日共净流出1.02亿元。
421,超频三：主力资金净流出3771.96万，净占比-14.26%（10-21）,2020-10-21 15:44:24,300647.sz,超频三2020年10月21日收报12.7元，涨跌幅-5.08%，换手率9.44%。当日该股主力资金流入3129.72万元，流出6901.68万元，主力净流出3771.96万元。其中，超大单流入111.12万元，流出1069.17万元，净流出958.05万元。当日散户资金流入2.29亿元，流出1.91亿元，散户净流入3771.96万元。资金流向分布情况如下图： 超频三近五日主力资金、超大单资金流向情况如下表： 超频三今日主力资金流向两市排名3755/4053，近五日内该股主力资金总体呈流出状态，五日共净流出6091.04万元。
422,超频三：主力资金净流入1072.24万，净占比3.89%（10-20）,2020-10-20 15:49:03,300647.sz,超频三2020年10月20日收报13.38元，涨跌幅2.92%，换手率9.51%。当日该股主力资金流入5841.85万元，流出4769.61万元，主力净流入1072.24万元。其中，超大单流入800.96万元，流出926.59万元，净流出125.63万元。当日散户资金流入2.11亿元，流出2.22亿元，散户净流出1072.24万元。资金流向分布情况如下图： 超频三近五日主力资金、超大单资金流向情况如下表： 超频三今日主力资金流向两市排名332/4051，近五日内该股主力资金总体呈流出状态，五日共净流出4846.95万元。
423,超频三今日热门盘点,2020-10-19 20:53:26,300647.sz,           
424,超频三：主力资金净流出2980.13万，净占比-11.20%（10-19）,2020-10-19 15:58:45,300647.sz,超频三2020年10月19日收报13元，涨跌幅-4.62%，换手率9.34%。当日该股主力资金流入3407.13万元，流出6387.27万元，主力净流出2980.13万元。其中，超大单流入192.66万元，流出703.91万元，净流出511.25万元。当日散户资金流入2.24亿元，流出1.94亿元，散户净流入2980.13万元。资金流向分布情况如下图： 超频三近五日主力资金、超大单资金流向情况如下表： 超频三今日主力资金流向两市排名3705/4050，近五日内该股主力资金总体呈流出状态，五日共净流出5006.03万元。
425,超频三今日热门盘点,2020-10-16 20:55:41,300647.sz,        
426,超频三：非公开发行股票申请获证监会批准,2020-10-16 20:14:38,300647.sz,超频三(300647)10月16日公告，公司收到中国证监会批复，核准公司非公开发行不超1.07亿股。批复自核准发行之日起12个月内有效。
427,超频三：主力资金净流出3562.38万，净占比-9.37%（10-16）,2020-10-16 15:51:10,300647.sz,超频三2020年10月16日收报13.63元，涨跌幅-1.94%，换手率13.15%。当日该股主力资金流入5317.2万元，流出8879.59万元，主力净流出3562.38万元。其中，超大单流入433.11万元，流出1641.42万元，净流出1208.31万元。当日散户资金流入3.19亿元，流出2.83亿元，散户净流入3562.38万元。资金流向分布情况如下图： 超频三近五日主力资金、超大单资金流向情况如下表： 超频三今日主力资金流向两市排名3787/4048，近五日内该股主力资金总体呈流出状态，五日共净流出1844.92万元。
440,超频三：主力资金净流出30.85万，净占比-0.24%（09-28）,2020-09-28 15:41:33,300647.sz,超频三2020年9月28日收报11.28元，涨跌幅-2.25%，换手率5.22%。当日该股主力资金流入1239.89万元，流出1270.73万元，主力净流出30.85万元。其中，超大单流入194.34万元，流出131.88万元，净流入62.46万元。当日散户资金流入1.13亿元，流出1.13亿元，散户净流入30.85万元。资金流向分布情况如下图： 超频三近五日主力资金、超大单资金流向情况如下表： 超频三今日主力资金流向两市排名1262/4036，近五日内该股主力资金总体呈流出状态，五日共净流出5225.01万元。
