,title,post_publish_time,code_name,content
2,超频三：截至目前 公司募投项目“锂电池正极关键材料生产基地建设一期子项目”厂房建设已基本封顶,2023-07-31 17:15:36,300647.sz,有投资者在投资者互动平台提问：云南项目进展情况，到哪个阶段了，不应该给股东披露一下么，股东应该有知情权吧 超频三（300647.SZ）7月31日在投资者互动平台表示，截至目前，公司募投项目“锂电池正极关键材料生产基地建设一期子项目”厂房建设已基本封顶，公司设备招投标程序已基本完成，设备已开始陆续进场。
3,大宗交易：超频三成交326.34万元，折价15.03%（07-21）,2023-07-21 16:33:33,300647.sz,2023年7月21日，超频三发生了1笔大宗交易，总成交55.5万股，成交金额326.34万元，成交价5.88元。当日收盘报价6.92元，跌幅1.98%，成交金额6922.56万元；大宗交易成交金额占当日成交金额4.71%，折价15.03%。 7月21日，罗欣药业、浙江建投、嘉美包装、协鑫能科、潜能恒信等公司均发生大宗交易，具体情况如下表：
6,大宗交易：超频三成交347.76万元，折价13.03%（07-05）,2023-07-05 16:37:25,300647.sz,2023年7月5日，超频三发生1笔大宗交易，总成交56万股，成交金额347.76万元，成交价6.21元，折价13.03%。
7,超频三：公司锂电池正极关键材料生产基地建设一期项目正全力加快推进建设,2023-07-04 22:01:49,300647.sz,有投资者在投资者互动平台提问：你好，董秘，贵公司新建电池工厂何时能投产？超频三（300647.SZ）7月4日在投资者互动平台表示，公司锂电池正极关键材料生产基地建设一期项目正全力加快推进建设。
8,超频三股东户数增加1.63%，户均持股11.14万元,2023-06-14 20:07:32,300647.sz,超频三2023年6月14日在深交所互动易中披露，截至2023年6月9日公司股东户数为2.78万户，较上期（2023年5月31日）增加445户，增幅为1.63%。 超频三股东户数低于行业平均水平。根据Choice数据，截至2023年6月9日电子行业上市公司平均股东户数为4.4万户。其中，公司股东户数处于0.5万~1.5万区间占比最高，为33.79%。  自2022年12月31日以来，公司股东户数连续4期上涨，截至目前增幅为12.26%。2022年12月31日至2023年6月9日区间股价下降13.63%。  截至2023年6月9日，公司最新总股本为4.57亿股，其中流通股本为4.44亿股。户均持有流通股数量由上期的1.62万股下降至1.6万股，户均流通市值11.14万元。 超频三户均持有流通市值低于行业平均水平。根据Choice数据，截至2023年6月9日，电子行业A股上市公司平均户均持有流通股市值为36.29万元。其中，26.67%的公司户均持有流通股市值在12万~24.5万区间内。
9,超频三：拟终止5G散热工业园建设募投项目，将剩余募资永久补充流动资金,2023-06-14 16:36:50,300647.sz,超频三6月14日公告，公司原“5G散热工业园建设项目”旨在通过新建生产基地，购置行业领先的生产及检测设备，实现5G散热产品产能扩充。本次募投项目生产的散热产品包括超薄热管、均热板、5G基站类散热模组等，主要应用于5G手机及其他智能终端设备、5G基站，解决5G时代智能终端散热升级需求和通信厂商的5G基站大功率散热需求。
13,超频三股东户数增加265户，户均持股11.46万元,2023-06-01 20:11:10,300647.sz,超频三最新股东户数2.73万户，呈现连续3期上升，低于行业平均水平。公司户均持有流通股份1.62万股；户均流通市值11.46万元。
14,超频三：锂电池正极关键材料生产基地建设一期项目厂房建设现已基本封顶,2023-05-22 13:43:09,300647.sz,超频三近期接受投资者调研时称，公司锂电池正极关键材料生产基地建设一期项目厂房建设现已基本封顶，部分设备已开始陆续进场。
15,浙商证券维持超频三买入评级 预计2023年净利润同比增长385.59%,2023-05-12 10:09:30,300647.sz,浙商证券5月12日发布研报，维持超频三买入评级。浙商证券预测，超频三2023年归母净利润9400万元，同比增长385.59%。
16,超频三：公司锂电池正极关键材料生产基地建设一期项目正全力加快推进建设中,2023-05-05 16:49:27,300647.sz,超频三5月5日在互动平台回答投资者提问时表示，公司锂电池正极关键材料生产基地建设一期项目正全力加快推进建设中。
29,大宗交易：超频三成交395.28万元，折价13.37%（02-17）,2023-02-17 16:28:33,300647.sz,2023年2月17日，超频三发生了1笔大宗交易，总成交54万股，成交金额395.28万元，成交价7.32元。当日收盘报价8.45元，跌幅1.52%，成交金额7774.95万元；大宗交易成交金额占当日成交金额5.08%，折价13.37%。 2月17日，盐湖股份、华凯易佰、北京君正、宁德时代、一心堂等公司均发生大宗交易，具体情况如下表：
30,超频三：预计22年年度归母净利润为1554万元至2331万元,2023-02-01 00:11:05,300647.sz,2023年01月30日，超频三发布2022年年度业绩预告，预计年度归属于上市公司股东的净利润为1554万元至2331万元，同比扭亏为盈；扣除非经常性损益后的净利润为294万元至441万元，同比扭亏为盈。
31,大宗交易：超频三成交384.48万元，折价16.04%（01-30）,2023-01-30 18:00:53,300647.sz,2023年1月30日，超频三发生1笔大宗交易，总成交54万股，成交金额384.48万元，成交价7.12元，折价16.04%。
32,超频三：控股股东、实控人之一张魁拟减持不超1%公司股份,2023-01-20 16:19:52,300647.sz,超频三1月20日公告，控股股东、实际控制人之一张魁直接持有公司股份3537.8988万股(占公司总股本的7.74%)，计划自公告披露之日起15个交易日后的6个月内以集中竞价方式减持公司股份不超过457.32万股(占公司总股本的1%)。
33,大宗交易：超频三成交369.3万元，折价15.25%（01-16）,2023-01-16 18:00:29,300647.sz,2023年1月16日，超频三发生1笔大宗交易，总成交53.6万股，成交金额369.3万元，成交价6.89元，折价15.25%。
34,超频三股东户数增加2.59%，户均持股13.69万元,2022-12-27 18:08:55,300647.sz,超频三2022年12月27日在深交所互动易中披露，截至2022年12月20日公司股东户数为2.55万户，较上期（2022年10月31日）增加645户，增幅为2.59%。 超频三股东户数低于行业平均水平。根据Choice数据，截至2022年12月20日电子行业上市公司平均股东户数为4.62万户。其中，公司股东户数处于1万~2.5万区间占比最高，为36.27%。  自2022年9月30日以来，公司股东户数连续3期上涨，截至目前增幅为7.92%。2022年9月30日至2022年12月20日区间股价上涨2.82%。  截至2022年12月20日，公司最新总股本为4.57亿股，其中流通股本为4.17亿股。户均持有流通股数量由上期的1.67万股下降至1.63万股，户均流通市值13.69万元。 超频三户均持有流通市值低于行业平均水平。根据Choice数据，截至2022年12月20日，电子行业A股上市公司平均户均持有流通股市值为32.02万元。其中，23.77%的公司户均持有流通股市值在10.5万~20万区间内，超频三也处在该区间范围内。
35,超频三人气较昨日提升2983 现居飙升榜第七,2022-12-20 11:08:11,300647.sz,截至12月20日11时，超频三最新人气排名第580，环比昨日人气排名提升2983位次，当前人气提升位次居飙升榜第7位。 
36,大宗交易：超频三成交378.05万元，折价12.44%（12-19）,2022-12-19 18:00:22,300647.sz,2022年12月19日，超频三发生了1笔大宗交易，总成交53.7万股，成交金额378.05万元，成交价7.04元。当日收盘报价8.04元，跌幅1.83%，成交金额4741.82万元；大宗交易成交金额占当日成交金额7.97%，折价12.44%。 12月19日，拓普集团、宁德时代、东方盛虹、云南白药、帝尔激光等公司均发生大宗交易，具体情况如下表：
37,大宗交易：超频三成交387.86万元，折价14.25%（11-30）,2022-11-30 18:00:45,300647.sz,2022年11月30日，超频三发生了1笔大宗交易，总成交53.72万股，成交金额387.86万元，成交价7.22元。当日收盘报价8.42元，跌幅0.59%，成交金额4648.33万元；大宗交易成交金额占当日成交金额8.34%，折价14.25%。 11月30日，金科股份、复旦微电、东易日盛、康泰生物、杉杉股份等公司均发生大宗交易，具体情况如下表：
38,大宗交易：超频三成交401.29万元，折价14.43%（11-24）,2022-11-24 18:02:09,300647.sz,2022年11月24日，超频三发生了1笔大宗交易，总成交53.72万股，成交金额401.29万元，成交价7.47元。当日收盘报价8.73元，涨幅0.69%，成交金额5009.24万元；大宗交易成交金额占当日成交金额8.01%，折价14.43%。 11月24日，藏格矿业、奥特维、金发科技、广联达、博瑞医药等公司均发生大宗交易，具体情况如下表：
39,浙商证券首次给予超频三买入评级 目标价11.1元,2022-11-13 10:26:52,300647.sz,浙商证券11月13日发布研报，首次给予超频三买入评级，目标价位11.1元。截至报告日，公司最新收盘价为9.24元，较目标价有20.13%的上行空间。浙商证券预测，超频三2022年归母净利润6130万元，同比增长137.92%。 超频三近一个月获得3份券商研报关注。研报详细数据如下表所示：
40,超频三：锂电池正极关键材料生产基地建设项目二期计划于2023年1月开工 2023年12月建成投产,2022-11-11 22:00:45,300647.sz,超频三近期接受投资者调研时称，公司锂电池正极关键材料生产基地建设项目共分为三期建设，二期项目计划于2023年1月开工，2023年12月建成投产。
41,超频三股东户数增加3.69%，户均持股16.46万元,2022-11-04 19:39:30,300647.sz,超频三2022年11月4日在深交所互动易中披露，截至2022年10月31日公司股东户数为2.49万户，较上期（2022年10月20日）增加886户，增幅为3.69%。 超频三股东户数低于行业平均水平。根据Choice数据，截至2022年10月31日电子行业上市公司平均股东户数为4.6万户。其中，公司股东户数处于1万~2.5万区间占比最高，为36.86%，超频三也处在该区间范围内。  2022年7月29日至今，公司股东户数有所增长，区间涨幅为5.84%。2022年7月29日至2022年10月31日区间股价下降13.70%。  截至2022年10月31日，公司最新总股本为4.57亿股，其中流通股本为4.17亿股。户均持有流通股数量由上期的1.74万股下降至1.67万股，户均流通市值16.46万元。 超频三户均持有流通市值低于行业平均水平。根据Choice数据，截至2022年10月31日，电子行业A股上市公司平均户均持有流通股市值为32.18万元。其中，26.54%的公司户均持有流通股市值在10万~20万区间内，超频三也处在该区间范围内。
42,信达证券维持超频三买入评级 预计2022年净利润同比增长136.49%,2022-10-30 16:36:47,300647.sz,信达证券10月30日发布研报，维持超频三买入评级。信达证券预测，超频三2022年归母净利润5900万元，同比增长136.49%。 超频三近一个月获得2份券商研报关注。研报详细数据如下表所示：
43,东北证券首次给予超频三买入评级 预计2022年净利润同比增长134.64%,2022-10-28 17:31:23,300647.sz,东北证券10月28日发布研报，首次给予超频三买入评级。东北证券预测，超频三2022年归母净利润5600万元，同比增长134.64%。
44,【图解季报】超频三：2022年前三季度归母净利润3525万元，同比扭亏为盈,2022-10-28 10:18:11,300647.sz,超频三于2022年10月28日披露三季报，公司2022年前三季度实现营业总收入8.21亿元，同比增长126.7%；实现归母净利润3525万元，上年同期为-1753.6万元，同比扭亏为盈；每股收益为0.08元。  公司2022三季度营业成本6.3亿元，同比增长153.8%，高于营业收入126.7%的增速，导致毛利率下降8.2%。期间费用率为19.3%，较去年下降22.6%。
45,超频三股东户数增加1.45%，户均持股15.15万元,2022-10-27 21:37:18,300647.sz,超频三2022年10月28日在深交所互动易中披露，截至2022年10月20日公司股东户数为2.4万户，较上期（2022年9月30日）增加343户，增幅为1.45%。 超频三股东户数低于行业平均水平。根据Choice数据，截至2022年10月20日电子行业上市公司平均股东户数为4.64万户。其中，公司股东户数处于1万~3万区间占比最高，为43.86%，超频三也处在该区间范围内。  2022年7月8日至今，公司股东户数有所增长，区间涨幅为3.53%。2022年7月8日至2022年10月20日区间股价下降21.28%。  截至2022年10月20日，公司最新总股本为4.57亿股，其中流通股本为4.17亿股。户均持有流通股数量由上期的1.76万股下降至1.74万股，户均流通市值15.15万元。 超频三户均持有流通市值低于行业平均水平。根据Choice数据，截至2022年10月20日，电子行业A股上市公司平均户均持有流通股市值为32.94万元。其中，25.31%的公司户均持有流通股市值在10.5万~21万区间内，超频三也处在该区间范围内。
46,超频三：2022年前三季度净利润3525.41万元，同比扭亏为盈,2022-10-27 19:50:41,300647.sz,超频三（300647）发布三季报，2022年前三季度实现营业总收入8.21亿元，同比增长126.68%；归属母公司股东净利润3525.41万元，上年同期亏损1753.55万元；基本每股收益为0.0771元。
47,超频三：控股股东、实控人进行股票质押式回购交易,2022-09-13 23:14:30,300647.sz,超频三9月13日公告，公司于近日接到公司控股股东、实际控制人之一刘郁的通知，获悉刘郁将其持有的公司部分股份进行了股票质押式回购交易。本次质押884万股，占公司总股本比例1.93%。截至公告披露日，公司控股股东、实际控制人刘郁、张魁及其一致行动人云南吉信泰富企业管理中心(有限合伙)合计质押3123万股，占公司总股本比例6.83%。
48,【调研快报】超频三接待兴业全球基金等多家机构调研,2022-08-31 21:02:50,300647.sz,超频三8月31日发布消息，2022年8月28日-2022年8月29日，公司接待兴业全球基金等多家机构调研，接待人员副总经理、董事会秘书王军，通过电话会议进行。  一、公司概况介绍深圳市超频三科技股份有限公司(以下简称“公司”)2022年半年度实现营业总收入58，015.64万元，较上年同期上升144.50%;实现归属于上市公司股东的净利润3，029.42万元，较上年同期上升2，065.60%。随着新能源行业的持续快速发展，锂电池材料市场需求较去年同期大幅增长…  除当日外，超频三近一年共接待39家机构46次调研，历史回测情况如下表所示：  8月31日，容百科技、高测股份、传音控股、澳华内镜、生益科技、新宙邦等公司相继发布机构调研公告，具体情况如下表：
49,太平洋给予超频三买入评级 Q2单季受下游客户交付结构负面影响 下半年重归弹性增长常态,2022-08-31 14:36:51,300647.sz,太平洋08月31日发布研报称，给予超频三(300647.SZ，最新价：9.7元)买入评级。评级理由主要包括：1)二季度单季利润较低主要系下游客户交付结构影响；2)圣比和净利润率达到10.88%，充分彰显废旧电池回收模式盈利优势；3)云南未受高温天影响，公司不受限电冲击且受益于材料价格反弹。风险提示：(1)公司废旧锂电回收与正极材料扩产不及预期；(2)锂电池上下游材料价格大幅波动，导致公司成长假设出现变化；(3)传统LED照明领域业务拖累超预期，导致局部业务亏损持续；(4)散热行业下游关键客户开拓不顺，行业竞争加剧。 AI点评：超频三近一个月获得2份券商研报关注，买入2家，平均目标价为22.72元，与最新价9.7元相比，高13.02元，目标均价涨幅134.23%。
50,太平洋维持超频三买入评级 目标价22.72元,2022-08-31 14:27:55,300647.sz,太平洋8月31日发布研报，维持超频三买入评级，目标价位22.72元。截至报告日，公司最新收盘价为9.69元，较目标价有134.47%的上行空间。太平洋预测，超频三2022年归母净利润8500万元，同比增长152.58%。 超频三近一个月获得2份券商研报关注。研报详细数据如下表所示：
58,超频三：上半年净利润3029万元 同比增2065.6%,2022-08-26 20:04:31,300647.sz,e公司讯，超频三(300647)8月26日晚间披露半年度报告，公司2022年半年度实现营业收入为5.8亿元，同比增长144.50%；归母净利润3029.42万元，同比增长2065.60%；基本每股收益0.07元。
59,注意！超频三将于9月14日召开股东大会,2022-08-26 19:48:19,300647.sz,每经AI快讯，超频三(SZ300647，收盘价：10.48元)8月26日发布公告称，2022年9月14日(星期三)15:00，公司将在深圳市龙岗区天安数码城4栋B座7楼公司会议室召开2022年第三次临时股东大会。本次股东大会将审议《关于为控股子公司申请金融机构综合授信提供担保的议案》等议案，2022年9月5日收市后登记在册的股东可现场参会投票，或通过交易所投票系统行使表决权。 2021年1至12月份，超频三的营业收入构成为：工业占比93.8%，其他行业占比6.2%。 超频三的总经理、董事长均是杜建军，男，54岁，学历背景为硕士。 截至发稿，超频三市值为48亿元。
60,超频三：2022年半年度净利润约3029万元 同比增加2065.6%,2022-08-26 19:48:19,300647.sz,每经AI快讯，超频三(SZ300647，收盘价：10.48元)8月26日晚间发布半年度业绩报告称，2022年上半年营业收入约5.8亿元，同比增加144.5%；归属于上市公司股东的净利润约3029万元，同比增加2065.6%；基本每股收益0.0662元，同比增加2035.48%。拟不派现、不送红股、不转增。 2021年1至12月份，超频三的营业收入构成为：工业占比93.8%，其他行业占比6.2%。 超频三的总经理、董事长均是杜建军，男，54岁，学历背景为硕士。 截至发稿，超频三市值为48亿元。
61,超频三：2022上半年净利润同比增长2066%,2022-08-26 19:39:24,300647.sz,超频三（300647）发布中报，2022上半年实现营业总收入5.8亿元，同比增长144.5%；归属母公司股东净利润3029.42万元，同比增长2065.6%；基本每股收益为0.0662元。
62,信达证券首次给予超频三买入评级 预计2022年净利润同比增长135.88%,2022-08-20 15:00:41,300647.sz,信达证券8月20日发布研报，首次给予超频三买入评级。信达证券预测，超频三2022年归母净利润5800万元，同比增长135.88%。
63,超频三股东户数增加1.33%，户均持股20.35万元,2022-08-12 18:03:32,300647.sz,超频三2022年8月12日在深交所互动易中披露，截至2022年8月10日公司股东户数为2.38万户，较上期（2022年7月29日）增加314户，增幅为1.33%。 超频三股东户数低于行业平均水平。根据Choice数据，截至2022年8月10日电子行业上市公司平均股东户数为4.73万户。其中，公司股东户数处于0.5万~1.5万区间占比最高，为30.89%。  2022年5月31日至今，公司股东户数有所下降，区间跌幅为3.77%。2022年5月31日至2022年8月10日区间股价上涨21.38%。  截至2022年8月10日，公司最新总股本为4.57亿股，其中流通股本为4.17亿股。户均持有流通股数量由上期的1.77万股下降至1.75万股，户均流通市值20.35万元。 超频三户均持有流通市值低于行业平均水平。根据Choice数据，截至2022年8月10日，电子行业A股上市公司平均户均持有流通股市值为34.23万元。其中，25.47%的公司户均持有流通股市值在12万~22.5万区间内，超频三也处在该区间范围内。
64,超频三股东户数增加1.42%，户均持股20.18万元,2022-08-05 17:37:23,300647.sz,超频三2022年8月5日在深交所互动易中披露，截至2022年7月29日公司股东户数为2.35万户，较上期（2022年7月8日）增加329户，增幅为1.42%。 超频三股东户数低于行业平均水平。根据Choice数据，截至2022年7月29日电子行业上市公司平均股东户数为4.67万户。其中，公司股东户数处于0.5万~1.5万区间占比最高，为31.44%。  2022年4月29日至今，公司股东户数显著下降，区间跌幅为13.51%。2022年4月29日至2022年7月29日区间股价上涨52.89%。  截至2022年7月29日，公司最新总股本为4.57亿股，其中流通股本为4.17亿股。户均持有流通股数量由上期的1.8万股下降至1.77万股，户均流通市值20.18万元。 超频三户均持有流通市值低于行业平均水平。根据Choice数据，截至2022年7月29日，电子行业A股上市公司平均户均持有流通股市值为34.55万元。其中，24.93%的公司户均持有流通股市值在12万~22.5万区间内，超频三也处在该区间范围内。
65,超频三：公司5G散热工业园建设项目已经深圳市龙岗区发展和改革局备案,2022-08-05 17:18:17,300647.sz,每经AI快讯，有投资者在投资者互动平台提问：请问公司5g散热工业园在哪个城市？一说益阳，一说深圳，到底在哪个城市？ 超频三(300647.SZ)8月5日在投资者互动平台表示，公司5G散热工业园建设项目已经深圳市龙岗区发展和改革局备案。
66,超频三：公司5G散热工业园建设项目预计达到可使用状态日期为2023年9月30日,2022-08-05 17:18:16,300647.sz,每经AI快讯，有投资者在投资者互动平台提问：请问公司5G散热工业园何时可以投入使用？ 超频三(300647.SZ)8月5日在投资者互动平台表示，公司5G散热工业园建设项目预计达到可使用状态日期为2023年9月30日。
67,超频三锂电池回收和正极材料扩产项目将于今年12月投产,2022-07-26 20:09:27,300647.sz,上海证券报记者从深圳市超频三科技股份有限公司(以下简称“超频三”)了解到，目前公司的锂电池正极关键材料生产基地建设项目整体建设正在根据计划有序推进，一期预计投产时间为2022年12月。一期子项目实施后，将形成新增产能包括10000吨三元前驱体，3000吨碳酸锂以及5000吨三元正极材料。与其他厂商不同之处在于，超频三制备正极材料的原料主要来源于废旧电池回收。 超频三成立于2005年，主营业务为电子产品新型散热器件、LED照明灯具、锂电池正极材料的研发、生产和销售。去年，通过收购个旧圣比和实业有限公司(简称“个旧圣比和”)，超频三积极向锂电池回收与正极材料领域拓展延伸。 超频三有关人士表示，去年并表个旧圣比和后，目前公司在手订单充裕，客户结构也在进一步优化。随着国内外宏观经济环境变化和行业内新增产能的释放，预计行业洗牌重整格局将会逐渐形成，最终将利好于具备一定规模和资金实力且拥有核心技术的锂电池正极关键材料生产厂商。同时，公司制备正极材料的原料主要来源于废旧电池回收，产业链覆盖长度更长，盈利能力与抵御风险能力也更强。
68,【调研快报】超频三接待光大证券等多家机构调研,2022-07-26 19:47:23,300647.sz,超频三7月26日发布消息，2022年7月15日-2022年7月26日，公司接待光大证券等多家机构调研，接待人员副总经理、董事会秘书王军，接待地点公司会议室、电话会议。  一、公司概况介绍深圳市超频三科技股份有限公司(以下简称“公司”)主营业务为电子产品新型散热器件、锂电池正极材料、LED照明灯具的研发、生产和销售，在立足于专业散热领域的同时，公司积极拓展锂电池正极材料领域，锂电池正极材料业务逐渐成为公司的核心战略业务。公司控股子公司个旧圣比和实业有限公司(以下简称“…  除当日外，超频三近一年共接待29家机构31次调研，历史回测情况如下表所示：  7月26日，明月镜片、珀莱雅、苏州银行、苏州银行、伟星股份、杭萧钢构等公司相继发布机构调研公告，具体情况如下表：
69,超频三：锂电池正极关键材料生产基地一期预计投产时间为2022年12月,2022-07-21 18:20:18,300647.sz,超频三7月21日在互动平台回答投资者提问时表示，截至目前，锂电池正极关键材料生产基地建设一期项目整体建设正在根据计划有序推进，一期预计投产时间为2022年12月。
