read amount,comments,title,content link,author,create time
472,1,平安证券维持紫光国微推荐评级：业绩高增 特种IC平台优势显著,"/news,002049,1098524545.html",紫光国微资讯,10-26 10:36
456,1,国盛证券维持紫光国微买入评级：2021年前三季度归母净利润同比+112.90% 保持高增长,"/news,002049,1098524537.html",紫光国微资讯,10-26 10:36
390,0,国盛证券维持紫光国微买入评级 预计2021年净利润同比增长128.29%,"/news,002049,1098491899.html",紫光国微资讯,10-26 10:31
341,0,平安证券维持紫光国微推荐评级 预计2021年净利润同比增长116.51%,"/news,002049,1098487053.html",紫光国微资讯,10-26 10:26
318,0,紫光国微：融资净买入3895.02万元，融资余额18.16亿元（10-25）,"/news,002049,1098372995.html",紫光国微资讯,10-26 08:45
403,0,紫光国微10月25日获深股通增持15.17万股,"/news,002049,1098361136.html",紫光国微资讯,10-26 07:36
250,0,【图解季报】紫光国微：2021年前三季度归母净利润同比大增112.9%，约为14.6亿元,"/news,002049,1098386945.html",紫光国微资讯,10-25 11:11
293,0,紫光国微第三季度净利润翻倍 高毅减持1080万股,"/news,002049,1098368927.html",紫光国微资讯,10-25 10:45
792,0,财报快评：紫光国微2021年三季度实现归母净利润14.6亿，同比上升112.9%,"/news,002049,1098300115.html",机智柯基,10-25 09:04
534,0,读财报系列2——一文看懂紫光国微21年三季度资产负债表,"/news,002049,1098298983.html",股友5p203r0103,10-25 08:59
411,0,紫光国微：高增长如期兑现，高景气度延续,"/news,002049,1098298963.html",股友6120067R9V,10-25 08:59
1862,13,紫光国微第三季度净利同比增105.87% 高毅资产却在大幅减持,"/news,002049,1098298223.html",紫光国微资讯,10-25 08:48
1159,6,紫光国微：第三季度净利润同比增105.87% 高毅减持,"/news,002049,1098296217.html",紫光国微资讯,10-25 07:59
662,1,紫光国微：第三季度净利润5.8亿元 同比增长106%,"/news,002049,1098286512.html",紫光国微资讯,10-25 07:58
2549,20,紫光国微：前三季度净利润同比增长112.9%,"/news,002049,1098281694.html",紫光国微资讯,10-25 07:54
1131,5,紫光国微：2021年前三季度净利润同比增长112.9%,"/news,002049,1098280577.html",一句话财报,10-25 07:51
397,0,紫光国微：连续4日融资净偿还累计7789.8万元（10-22）,"/news,002049,1097891910.html",紫光国微资讯,10-25 08:46
473,1,融资融券周汇总：紫光国微本周融资净偿还1851.8万元,"/news,002049,1097812356.html",大眼看两融,10-24 03:05
470,0,紫光国微本周被深股通减持8.93万股 最新持股量1829.55万股,"/news,002049,1097806303.html",胖猫周周见,10-24 02:05
2694,13,中汽中心软件测评中心与紫光国微达成芯片认证合作,"/news,002049,1097694961.html",紫光国微资讯,10-23 09:08
905,1,紫光国微10月22日获深股通增持49.49万股,"/news,002049,1097683928.html",紫光国微资讯,10-23 07:32
959,4,紫光国微股东户数下降3.15%，户均持股204.41万元,"/news,002049,1097585922.html",紫光国微资讯,10-22 04:51
464,0,紫光国微：连续3日融资净偿还累计6744.55万元（10-21）,"/news,002049,1097222278.html",紫光国微资讯,10-22 08:44
668,2,紫光国微10月21日获深股通增持2.74万股,"/news,002049,1097210397.html",紫光国微资讯,10-22 07:31
1195,3,紫光国微预计明日收盘后（周一晚）披露三季报,"/news,002049,1097098890.html",股友1358g87h10,10-21 04:33
425,0,紫光国微：融资净偿还815.55万元，融资余额18.34亿元（10-20）,"/news,002049,1096754980.html",紫光国微资讯,10-21 08:45
529,0,紫光国微10月20日被深股通减持44.84万股,"/news,002049,1096744259.html",紫光国微资讯,10-21 07:42
402,0,紫光国微：融资净偿还1235.34万元，融资余额18.42亿元（10-19）,"/news,002049,1096275604.html",紫光国微资讯,10-20 08:48
528,0,紫光国微10月19日被深股通减持35.34万股,"/news,002049,1096262006.html",紫光国微资讯,10-20 07:30
518,0,紫光国微：连续4日融资净买入累计3.56亿元（10-18）,"/news,002049,1095830482.html",紫光国微资讯,10-19 08:44
471,0,紫光国微10月18日获深股通增持19.02万股,"/news,002049,1095818534.html",紫光国微资讯,10-19 07:31
498,0,紫光国微：连续3日融资净买入累计3.07亿元（10-15）,"/news,002049,1095351701.html",紫光国微资讯,10-18 08:46
425,0,紫光国微本周融资净买入2.32亿元，两市排名第13,"/news,002049,1095279580.html",大眼看两融,10-17 03:05
893,3,紫光国微10月15日获深股通增持153.74万股,"/news,002049,1095109486.html",紫光国微资讯,10-16 07:36
440,0,紫光国微：融资净买入1.39亿元，两市排名第八（10-14）,"/news,002049,1094628905.html",紫光国微资讯,10-15 08:44
997,9,太平洋维持紫光国微买入评级：下游需求旺盛 Q3业绩保持高速增长 目标价296元,"/news,002049,1094435000.html",紫光国微资讯,10-14 02:23
910,9,太平洋维持紫光国微买入评级 目标价296元,"/news,002049,1094418015.html",紫光国微资讯,10-14 02:08
376,0,紫光国微：融资净买入1.44亿元，融资余额16.43亿元（10-13）,"/news,002049,1094174212.html",紫光国微资讯,10-14 08:45
776,2,紫光国微股东户数增加6.91%，户均持股183.46万元,"/news,002049,1094097893.html",紫光国微资讯,10-13 08:39
1981,40,中信证券维持紫光国微买入评级 目标价250元,"/news,002049,1094070786.html",紫光国微资讯,10-13 06:41
578,1,长江证券维持紫光国微买入评级 预计2021年净利润同比增长118.25%,"/news,002049,1094039174.html",紫光国微资讯,10-13 04:21
907,3,华西证券维持紫光国微买入评级：Q3环比继续增长 特种和安全行业持续保持景气,"/news,002049,1094057649.html",紫光国微资讯,10-13 03:10
608,3,华西证券维持紫光国微买入评级 预计2021年净利润同比增长116.14%,"/news,002049,1094012483.html",紫光国微资讯,10-13 03:04
427,0,国盛证券维持紫光国微买入评级 预计2021年净利润同比增长128.29%,"/news,002049,1093916903.html",紫光国微资讯,10-13 01:20
572,0,紫光国微前三季度净利润或翻倍 布局汽车芯片有望打开成长空间,"/news,002049,1093902961.html",紫光国微资讯,10-13 12:06
682,4,信达证券维持紫光国微买入评级：Q3业绩大幅增长 特种芯片龙头再超预期,"/news,002049,1093878561.html",紫光国微资讯,10-13 11:33
507,2,信达证券维持紫光国微买入评级 预计2021年净利润同比增长125.68%,"/news,002049,1093859849.html",紫光国微资讯,10-13 11:13
793,14,紫光国微下跌5.44% 前三季净利润增长95.00%-125.00%,"/news,002049,1093798412.html",紫光国微资讯,10-13 10:04
367,0,紫光国微：连续8日融资净偿还累计5.26亿元（10-12）,"/news,002049,1093702996.html",紫光国微资讯,10-13 08:43
471,0,紫光国微10月12日获深股通增持66.79万股,"/news,002049,1093694421.html",紫光国微资讯,10-13 07:50
1539,11,紫光国微前三季度业绩预增95%-125%,"/news,002049,1093621819.html",紫光国微资讯,10-12 07:47
2098,23,紫光国微：预计2021年前三季度归母净利润为13.35亿至15.4亿元,"/news,002049,1093599209.html",紫光国微资讯,10-12 06:11
677,0,紫光国微：预计21年前三季度归母净利润同比增长95.00%至125.00%,"/news,002049,1093598758.html",股友O7252808R7,10-12 06:11
2774,12,紫光国微：前三季度净利预增95%~125% 下游需求旺盛,"/news,002049,1093598333.html",紫光国微资讯,10-12 06:02
536,0,预增！紫光国微：预计2021年前三季度净利润约13.35亿元~15.4亿元 同比增长95%~125%,"/news,002049,1093636301.html",紫光国微资讯,10-12 06:02
400,0,紫光国微：连续7日融资净偿还累计5.16亿元（10-11）,"/news,002049,1093238223.html",紫光国微资讯,10-12 08:46
602,4,紫光国微10月11日获深股通增持78.97万股,"/news,002049,1093226539.html",紫光国微资讯,10-12 07:31
388,0,紫光国微：连续6日融资净偿还累计4.75亿元（10-08）,"/news,002049,1092794831.html",紫光国微资讯,10-11 09:03
1118,3,紫光国微10月08日获深股通增持8.09万股,"/news,002049,1092530781.html",紫光国微资讯,10-09 07:42
1497,6,紫光国微股东户数下降5.82%，户均持股210.21万元,"/news,002049,1092482724.html",紫光国微资讯,10-08 09:05
467,0,紫光国微：连续5日融资净偿还累计2.96亿元（09-30）,"/news,002049,1092138164.html",紫光国微资讯,10-08 08:45
435,0,紫光国微本周融资净偿还2.06亿元，居电子元件板块第三,"/news,002049,1092033682.html",大眼看两融,10-07 03:05
532,0,紫光国微本周获深股通增持6.82万股 最新持股量1530.89万股,"/news,002049,1092025087.html",胖猫周周见,10-07 02:04
785,0,紫光国微09月30日获深股通增持4.7万股,"/news,002049,1091393932.html",紫光国微资讯,10-01 07:43
470,0,紫光国微：连续4日融资净偿还累计2.42亿元（09-29）,"/news,002049,1090967113.html",紫光国微资讯,09-30 08:51
414,0,紫光国微09月29日被深股通减持17.43万股,"/news,002049,1090952472.html",紫光国微资讯,09-30 07:38
338,0,紫光国微：连续3日融资净偿还累计1.8亿元（09-28）,"/news,002049,1090415110.html",紫光国微资讯,09-29 08:43
501,2,紫光国微09月28日获深股通增持15.54万股,"/news,002049,1090402615.html",紫光国微资讯,09-29 07:34
341,0,紫光国微：融资净偿还1.27亿元，融资余额18.61亿元（09-27）,"/news,002049,1089907997.html",紫光国微资讯,09-28 08:41
386,0,紫光国微09月27日获深股通增持4.01万股,"/news,002049,1089894955.html",紫光国微资讯,09-28 07:31
1270,1,紫光国微：无晶圆厂的芯片设计业务模式的预付款比例通常都不高 公司目前各业务回款状况良好 经营净现金流同比大幅改善,"/news,002049,1089611275.html",紫光国微资讯,09-27 12:06
416,1,紫光国微：融资净偿还3651.64万元，融资余额19.88亿元（09-24）,"/news,002049,1089298915.html",紫光国微资讯,09-27 08:53
620,0,紫光国微09月24日被深股通减持15.39万股,"/news,002049,1089055366.html",紫光国微资讯,09-25 07:41
402,0,紫光国微：融资净买入2715.38万元，融资余额20.24亿元（09-23）,"/news,002049,1088529651.html",紫光国微资讯,09-24 08:48
731,4,紫光国微09月23日被深股通减持70.43万股,"/news,002049,1088516703.html",紫光国微资讯,09-24 07:36
982,1,微网优联与紫光国微达成战略合作 双方将在移动通信、数字人民币等领域深化合作,"/news,002049,1088348140.html",紫光国微资讯,09-23 02:55
1549,6,微网优联与紫光国微达成战略合作,"/news,002049,1088330332.html",紫光国微资讯,09-23 02:39
1169,3,紫光国微股东户数下降1.06%，户均持股192.04万元,"/news,002049,1088012818.html",紫光国微资讯,09-23 08:53
403,0,紫光国微：融资净买入1462.38万元，融资余额19.97亿元（09-22）,"/news,002049,1088009738.html",紫光国微资讯,09-23 08:40
2706,9,紫光国微量子通信芯片项目亮相首届量子产业大会,"/news,002049,1087720469.html",紫光国微资讯,09-22 12:27
1159,6,紫光国微量子通信芯片项目亮相首届量子产业大会,"/news,002049,1087721572.html",紫光国微资讯,09-22 12:25
403,0,紫光国微：融资净偿还4165.07万元，融资余额19.83亿元（09-17）,"/news,002049,1087524355.html",紫光国微资讯,09-22 09:07
406,0,紫光国微本周融资净偿还1.94亿元，居电子元件板块第四,"/news,002049,1087443896.html",大眼看两融,09-21 03:07
416,0,紫光国微本周深股通持股市值减少1.2亿元，居电子元件板块第七,"/news,002049,1087435630.html",胖猫周周见,09-21 02:04
22912,42,电子股被扎堆调研 千亿芯片巨头周跌10%！18家百亿私募盯上了这些股,"/news,002049,1087415467.html",紫光国微资讯,09-21 10:10
1896,10,紫光国微接受19家机构调研！短期主力资金净流出 或存在资金分歧,"/news,002049,1086955763.html",紫光国微资讯,09-17 02:40
542,0,【调研快报】紫光国微接待长城财富保险等多家机构调研,"/news,002049,1087016967.html",紫光国微资讯,09-17 02:17
1151,7,紫光国微：公司推出的创新产品超级SIM卡正在市场推广阶段,"/news,002049,1086845150.html",紫光国微资讯,09-17 01:04
1839,11,紫光国微：公司正在积极供货 但目前受产能限制的影响 只能交付一部分,"/news,002049,1086769573.html",紫光国微资讯,09-17 11:14
470,0,紫光国微：融资净偿还1.91亿元，两市排名第13（09-16）,"/news,002049,1086565600.html",紫光国微资讯,09-17 08:43
475,0,紫光国微09月16日被深股通减持35.69万股,"/news,002049,1086551528.html",紫光国微资讯,09-17 07:30
1525,11,紫光国微股东户数增加9.87%，户均持股211.58万元,"/news,002049,1086002560.html",紫光国微资讯,09-16 09:36
440,0,紫光国微：融资净买入4560.34万元，融资余额22.16亿元（09-15）,"/news,002049,1085965655.html",紫光国微资讯,09-16 08:42
669,1,紫光国微09月15日获深股通增持27.44万股,"/news,002049,1085953716.html",紫光国微资讯,09-16 07:39
360,0,紫光国微：融资净偿还1.06亿元，融资余额21.7亿元（09-14）,"/news,002049,1085396506.html",紫光国微资讯,09-15 08:45
462,0,紫光国微09月14日被深股通减持6.37万股,"/news,002049,1085383023.html",紫光国微资讯,09-15 07:34
2971,14,机构抄底紫光国微 游资连续封板广晟有色,"/news,002049,1085085840.html",紫光国微资讯,09-14 11:55
390,0,紫光国微：融资净买入5740.81万元，融资余额22.76亿元（09-13）,"/news,002049,1084829947.html",紫光国微资讯,09-14 08:43
497,0,紫光国微09月13日被深股通减持44.61万股,"/news,002049,1084816999.html",紫光国微资讯,09-14 07:33
1178,3,紫光国微：与云启智慧达成战略合作 以芯片技术赋能智慧教育,"/news,002049,1084756912.html",紫光国微资讯,09-13 08:42
3411,57,紫光国微：尚不清楚股价跌停逻辑,"/news,002049,1084714288.html",紫光国微资讯,09-13 06:43
18064,110,闪崩跌停 5机构席位激战！千亿市值芯片股回应,"/news,002049,1084708694.html",紫光国微资讯,09-13 06:23
4142,63,龙虎榜：紫光国微放量跌停 3机构逆势合计买入超2亿元,"/news,002049,1084683518.html",紫光国微资讯,09-13 04:48
718,0,多主力现身龙虎榜，紫光国微跌停（09-13）,"/news,002049,1084680055.html",紫光国微资讯,09-13 04:38
4745,39,紫光国微(002049)龙虎榜数据(09-13),"/news,002049,1084693318.html",紫光国微资讯,09-13 04:33
881,3,紫光国微放量跌停 机构资金现分歧,"/news,002049,1084676777.html",一句话龙虎榜,09-13 04:27
3662,25,两年多涨7倍！1200亿芯片龙头突发闪崩 半日29亿资金出逃...网友：还好上周五卖了,"/news,002049,1084503097.html",紫光国微资讯,09-13 12:03
3248,58,紫光国微跌停 中信证券华安证券长江证券高点喊买,"/news,002049,1084518030.html",紫光国微资讯,09-13 11:32
472,0,紫光国微：融资净买入1426.86万元，融资余额22.19亿元（09-10）,"/news,002049,1084272380.html",紫光国微资讯,09-13 08:42
732,1,紫光国微本周融资净偿还5569.87万元，居电子元件板块第十,"/news,002049,1084186749.html",大眼看两融,09-12 03:06
751,0,深股通连续4周净买入紫光国微 累计净买入8.5亿元,"/news,002049,1084179472.html",胖猫周周见,09-12 02:05
1235,5,紫光国微09月10日被深股通减持46.16万股,"/news,002049,1084042356.html",紫光国微资讯,09-11 07:39
6086,7,2021年中报投资收益榜：半导体行业,"/news,002049,1083902483.html",港股研报提示,09-10 03:20
1547,11,云启智慧与紫光国微达成战略合作 以芯片技术赋能智慧教育,"/news,002049,1083795797.html",紫光国微资讯,09-10 10:27
496,0,紫光国微：融资净偿还1.11亿元，两市排名第13（09-09）,"/news,002049,1083500447.html",紫光国微资讯,09-10 08:48
691,2,紫光国微09月09日获深股通增持61.4万股,"/news,002049,1083486120.html",紫光国微资讯,09-10 07:32
552,0,紫光国微：连续3日融资净买入累计5499.12万元（09-08）,"/news,002049,1082925001.html",紫光国微资讯,09-09 08:47
596,0,紫光国微09月08日获深股通增持95.67万股,"/news,002049,1082910747.html",紫光国微资讯,09-09 07:32
2175,8,信达证券首次给予紫光国微买入评级 预计2021年净利润同比增长104.95%,"/news,002049,1082669982.html",紫光国微资讯,09-08 02:05
538,0,紫光国微：融资净买入2197.05万元，融资余额23.07亿元（09-07）,"/news,002049,1082366003.html",紫光国微资讯,09-08 08:46
503,0,紫光国微09月07日被深股通减持69.29万股,"/news,002049,1082351881.html",紫光国微资讯,09-08 07:31
458,0,紫光国微：融资净买入2489.02万元，融资余额22.85亿元（09-06）,"/news,002049,1081804393.html",紫光国微资讯,09-07 08:45
715,3,紫光国微09月06日被深股通减持32.87万股,"/news,002049,1081792276.html",紫光国微资讯,09-07 07:37
509,0,紫光国微：融资净偿还2353.66万元，融资余额22.6亿元（09-03）,"/news,002049,1081267647.html",紫光国微资讯,09-06 08:58
431,0,融资融券周汇总：紫光国微本周融资净偿还524.76万元,"/news,002049,1081177654.html",大眼看两融,09-05 03:04
769,0,紫光国微本周深股通持股市值增加2.72亿元，居电子元件板块第六,"/news,002049,1081171679.html",胖猫周周见,09-05 02:05
1401,2,紫光国微09月03日被深股通减持18.09万股,"/news,002049,1080852159.html",紫光国微资讯,09-04 07:33
1106,5,中银证券维持紫光国微增持评级：各业务线需求旺盛 H1业绩高速增长,"/news,002049,1080559899.html",紫光国微资讯,09-03 10:46
1109,3,中银证券维持紫光国微增持评级 预计2021年净利润同比增长112.17%,"/news,002049,1080462048.html",紫光国微资讯,09-03 10:42
645,0,紫光国微：融资净买入4439.76万元，融资余额22.84亿元（09-02）,"/news,002049,1080304919.html",紫光国微资讯,09-03 08:46
945,1,紫光国微09月02日获深股通增持4.85万股,"/news,002049,1080289145.html",紫光国微资讯,09-03 07:31
1338,5,紫光国微股东户数增加4.12%，户均持股232.8万元,"/news,002049,1079932092.html",紫光国微资讯,09-02 12:15
1166,3,华西证券首予紫光国微买入评级：特种与安全两翼齐飞 公司步入快速发展阶段,"/news,002049,1079986892.html",紫光国微资讯,09-02 09:51
640,0,紫光国微：融资净偿还7506.12万元，融资余额22.39亿元（09-01）,"/news,002049,1079706201.html",紫光国微资讯,09-02 08:44
770,0,紫光国微09月01日被深股通减持50.05万股,"/news,002049,1079692966.html",紫光国微资讯,09-02 07:34
18158,17,21年半年度集成电路行业盈利能力一览（09-01）,"/news,002049,1079536859.html",股友i6617h2866,09-01 04:04
3655,17,紫光国微：将在服贸会上正式发布“紫光数字支付应用新成果”,"/news,002049,1079422423.html",紫光国微资讯,09-01 01:44
1092,4,紫光国微08月31日获深股通增持69.4万股,"/news,002049,1079090844.html",紫光国微资讯,09-01 07:42
902,0,紫光国微08月30日获深股通增持111.2万股,"/news,002049,1078485914.html",紫光国微资讯,08-31 07:33
723,0,紫光国微：连续6日融资净买入累计9.49亿元（08-27）,"/news,002049,1077867434.html",紫光国微资讯,08-30 08:57
2058,7,紫光国微：本公司的集成电路业务主要为芯片设计 制造环节以代工方式进行,"/news,002049,1077798325.html",紫光国微资讯,08-29 06:40
2461,12,紫光国微：公司车载控制芯片的开发工作按照计划顺利推进中 已经获得相关项目资金的支持,"/news,002049,1077773195.html",紫光国微资讯,08-29 04:10
831,0,有设计储能设备的控制芯片之类的吗？紫光国微：目前没有涉及这类产品,"/news,002049,1077773253.html",紫光国微资讯,08-29 04:06
1159,1,紫光国微：今年公司不计划进行中期利润分派,"/news,002049,1077768892.html",紫光国微资讯,08-29 04:06
931,0,紫光国微：公司可以享受高新技术企业、集成电路设计企业等方面的税收优惠政策,"/news,002049,1077768575.html",紫光国微资讯,08-29 04:06
1353,2,紫光国微：公司正在开发中的车载控制芯片后续还需要进行较长时间的考核、测试工作,"/news,002049,1077770993.html",紫光国微资讯,08-29 04:03
754,0,紫光国微：公司集成电路业务主要为芯片设计 制造环节采用外委代工的方式,"/news,002049,1077770959.html",紫光国微资讯,08-29 04:03
1185,4,紫光国微：公司的创新产品超级SIM卡正在市场推广过程中 目前已经实现了小批量出货,"/news,002049,1077768091.html",紫光国微资讯,08-29 04:03
923,1,公司做精微酿酒设备吗？紫光国微：没有这类设备,"/news,002049,1077767547.html",紫光国微资讯,08-29 03:59
1014,0,紫光国微：目前在推广发行的电子驾驶证在网上发放 不是实体卡证,"/news,002049,1077764701.html",紫光国微资讯,08-29 03:35
802,0,紫光国微本周融资净买入5.59亿元，两市排名第七,"/news,002049,1077759956.html",大眼看两融,08-29 03:04
5316,10,紫光国微：创新产品超级SIM卡已经实现了小批量出货,"/news,002049,1077755004.html",紫光国微资讯,08-29 02:14
628,0,紫光国微：目前超级SIM卡已实现小批量出货,"/news,002049,1077762775.html",紫光国微资讯,08-29 02:14
899,1,紫光国微本周深股通持股市值增加2.23亿元，居电子元件板块第四,"/news,002049,1077752536.html",胖猫周周见,08-29 02:03
1258,1,紫光国微08月27日获深股通增持79.89万股,"/news,002049,1077494986.html",紫光国微资讯,08-28 07:39
487,0,国海证券维持紫光国微买入评级 中报点评：2021H1 业绩超预期 持续受益特种集成高景气度,"/news,002049,1077516525.html",紫光国微资讯,08-27 10:34
5293,17,北京一中院裁定对紫光集团等七家公司实质合并重整,"/news,002049,1077411251.html",紫光国微资讯,08-27 09:42
920,0,国海证券维持紫光国微买入评级 预计2021年净利润同比增长115.27%,"/news,002049,1077405197.html",紫光国微资讯,08-27 09:29
914,1,光大证券维持紫光国微买入评级 预计2021年净利润同比增长120.85%,"/news,002049,1077317343.html",紫光国微资讯,08-27 05:04
993,4,长江证券维持紫光国微买入评级 预计2021年净利润同比增长118.25%,"/news,002049,1077230287.html",紫光国微资讯,08-27 02:34
1212,4,中国银河首次给予紫光国微推荐评级 预计2021年净利润同比增长92.48%,"/news,002049,1077087004.html",紫光国微资讯,08-27 11:47
623,0,紫光国微：连续5日融资净买入累计8.85亿元（08-26）,"/news,002049,1076861350.html",紫光国微资讯,08-27 08:46
831,1,紫光国微08月26日获深股通增持76.21万股,"/news,002049,1076845822.html",紫光国微资讯,08-27 07:33
1089,5,中航证券给予紫光国微买入评级 目标价280元,"/news,002049,1076818191.html",紫光国微资讯,08-27 12:19
435,0,西南证券给予紫光国微买入评级：特种集成电路业务增速亮眼，国产化空间广阔，目标价284.30元,"/news,002049,1076936389.html",紫光国微资讯,08-26 09:59
1136,6,西南证券首次给予紫光国微买入评级 目标价284.3元,"/news,002049,1076769371.html",紫光国微资讯,08-26 09:23
980,0,受益于芯片国产化 紫光国微上半年净利润同比增长一倍以上,"/news,002049,1076715378.html",紫光国微资讯,08-26 05:03
2438,32,中信证券给予紫光国微买入评级 紫光国微（002049）：特种业务高景气持续 成本费用摊薄盈利能力提升 目标价至265元,"/news,002049,1076585352.html",紫光国微资讯,08-26 02:23
603,0,紫光国微：融资净买入1.28亿元，两市排名第15（08-25）,"/news,002049,1076233166.html",紫光国微资讯,08-26 08:49
1084,11,广发证券维持紫光国微买入评级 目标价248.16元,"/news,002049,1076168680.html",紫光国微资讯,08-25 10:14
1543,5,太平洋维持紫光国微买入评级：业绩超预期 “三牛票”后劲十足 目标价格为296元,"/news,002049,1076134128.html",紫光国微资讯,08-25 07:57
1308,11,太平洋维持紫光国微买入评级 目标价296元,"/news,002049,1076115324.html",紫光国微资讯,08-25 07:37
1133,25,中信证券维持紫光国微买入评级 目标价265元,"/news,002049,1076108858.html",紫光国微资讯,08-25 07:14
781,1,天风证券维持紫光国微买入评级 预计2021年净利润同比增长121.18%,"/news,002049,1076064375.html",紫光国微资讯,08-25 04:44
1116,1,天风证券维持紫光国微买入评级：业绩大超预期 IC设计平台型公司有望戴维斯双击,"/news,002049,1076067810.html",紫光国微资讯,08-25 04:41
1156,6,华泰证券维持紫光国微买入评级 目标价266.5元,"/news,002049,1076056412.html",紫光国微资讯,08-25 04:22
676,0,紫光国微：上半年实现净利润8.76亿元 同比增长117.84%,"/news,002049,1076067183.html",紫光国微资讯,08-25 04:07
785,1,德邦证券维持紫光国微买入评级 预计2021年净利润同比增长112.17%,"/news,002049,1076047862.html",紫光国微资讯,08-25 03:59
1309,8,德邦证券给予紫光国微买入评级 中报业绩表现亮眼 主营业务前景可期,"/news,002049,1076044944.html",紫光国微资讯,08-25 03:50
588,0,紫光国微一度涨停，中报业绩同比增加117.84%,"/news,002049,1076040275.html",股友3N02501R26,08-25 03:40
872,2,平安证券维持紫光国微推荐评级 预计2021年净利润同比增长116.51%,"/news,002049,1076009225.html",紫光国微资讯,08-25 02:51
821,0,国盛证券维持紫光国微买入评级 预计2021年净利润同比增长116.76%,"/news,002049,1075918077.html",紫光国微资讯,08-25 01:35
