read amount,comments,title,content link,author,create time
659,2,紫光国微股东户数下降7.75%，户均持股341.5万元,"/news,002049,1216576440.html",紫光国微资讯,08-12 09:43
285,0,紫光国微：融资净偿还1327.86万元，融资余额16.03亿元（08-11）,"/news,002049,1216534319.html",紫光国微资讯,08-12 09:00
347,0,紫光国微08月11日获深股通增持34.49万股,"/news,002049,1216522780.html",紫光国微资讯,08-12 07:34
996,1,东北证券维持紫光国微买入评级 目标价281元,"/news,002049,1216334226.html",公司研报提示,08-11 02:12
366,0,紫光国微：融资净买入1.16亿元，两市排名第六（08-10）,"/news,002049,1216058506.html",紫光国微资讯,08-11 08:44
345,0,紫光国微08月10日获深股通增持3.75万股,"/news,002049,1216049032.html",紫光国微资讯,08-11 07:32
1145,0,紫光国微盘中最高250.5元创历史新高，总市值1463.02亿元,"/news,002049,1215929655.html",新高个股聚焦,08-10 03:35
1354,6,紫光国微股价创新高 最新筹码趋向集中,"/news,002049,1215766985.html",紫光国微资讯,08-10 11:13
444,1,紫光国微：融资净偿还4625.06万元，两市排名第20（08-09）,"/news,002049,1215602453.html",紫光国微资讯,08-10 08:40
328,0,紫光国微08月09日被深股通减持53.96万股,"/news,002049,1215594032.html",紫光国微资讯,08-10 07:31
282,0,紫光国微：融资净买入3128.01万元，融资余额15.47亿元（08-08）,"/news,002049,1215169976.html",紫光国微资讯,08-09 08:38
494,1,紫光国微：融资净买入326.97万元，融资余额15.16亿元（08-05）,"/news,002049,1214770124.html",紫光国微资讯,08-08 08:40
356,0,紫光国微本周融资净偿还3.62亿元，两市排名第三,"/news,002049,1214710188.html",大眼看两融,08-07 03:05
535,0,紫光国微本周深股通持股市值增加1.45亿元，居半导体板块第二,"/news,002049,1214704678.html",胖猫周周见,08-07 02:04
623,1,紫光国微：融资净偿还2.2亿元，两市排名第一（08-04）,"/news,002049,1214215874.html",紫光国微资讯,08-05 08:41
364,0,紫光国微08月04日获深股通增持51.33万股,"/news,002049,1214211822.html",紫光国微资讯,08-05 08:15
368,0,紫光国微：融资净偿还9917.41万元，两市排名第12（08-03）,"/news,002049,1213793091.html",紫光国微资讯,08-04 08:45
357,0,紫光国微08月03日被深股通减持1.87万股,"/news,002049,1213786043.html",紫光国微资讯,08-04 07:41
320,0,紫光国微：连续11日融资净偿还累计3.94亿元（08-02）,"/news,002049,1213307933.html",紫光国微资讯,08-03 08:42
346,0,紫光国微08月02日获深股通增持5.72万股,"/news,002049,1213299353.html",紫光国微资讯,08-03 07:34
1181,4,紫光国微：公司产品可应用于人工智能相关领域,"/news,002049,1213237104.html",紫光国微资讯,08-02 09:41
574,0,紫光国微股东户数下降8.10%，户均持股275.68万元,"/news,002049,1213210664.html",紫光国微资讯,08-02 07:51
281,0,紫光国微：连续10日融资净偿还累计3.79亿元（08-01）,"/news,002049,1212775193.html",紫光国微资讯,08-02 08:42
323,0,紫光国微08月01日被深股通减持15.41万股,"/news,002049,1212767392.html",紫光国微资讯,08-02 07:53
334,0,紫光国微：连续9日融资净偿还累计3.51亿元（07-29）,"/news,002049,1212266139.html",紫光国微资讯,08-01 08:43
406,0,紫光国微本周融资净偿还2.02亿元，两市排名第七,"/news,002049,1212194129.html",大眼看两融,07-31 03:05
529,0,紫光国微本周深股通持股市值增加2.3亿元，居半导体板块第一,"/news,002049,1212188795.html",胖猫周周见,07-31 02:05
1122,1,紫光国微07月29日获深股通增持8.92万股,"/news,002049,1212097140.html",紫光国微资讯,07-30 07:35
328,0,紫光国微：连续8日融资净偿还累计3.45亿元（07-28）,"/news,002049,1211622582.html",紫光国微资讯,07-29 08:42
394,0,紫光国微07月28日获深股通增持43.31万股,"/news,002049,1211616317.html",紫光国微资讯,07-29 08:00
1587,11,紫光国微：董事会决定不提前赎回“国微转债”,"/news,002049,1211523599.html",紫光国微资讯,07-28 06:28
1093,2,注意！紫光国微将于8月15日召开股东大会,"/news,002049,1211523594.html",紫光国微资讯,07-28 06:28
285,0,紫光国微：连续7日融资净偿还累计3.14亿元（07-27）,"/news,002049,1211141008.html",紫光国微资讯,07-28 09:20
361,0,紫光国微07月27日获深股通增持46.93万股,"/news,002049,1211136171.html",紫光国微资讯,07-28 09:05
375,0,紫光国微：融资净偿还8391.62万元，两市排名第七（07-26）,"/news,002049,1210674089.html",紫光国微资讯,07-27 09:20
386,0,紫光国微07月26日获深股通增持6.71万股,"/news,002049,1210658447.html",紫光国微资讯,07-27 07:53
5011,33,紫光集团原董事长被传带走调查？相关上市公司表示“不了解情况”,"/news,002049,1210558423.html",紫光国微资讯,07-26 05:11
362,0,紫光国微：融资净偿还6337.1万元，两市排名第19（07-25）,"/news,002049,1210219106.html",紫光国微资讯,07-26 09:10
398,0,紫光国微：连续4日融资净偿还累计1.43亿元（07-22）,"/news,002049,1209751128.html",紫光国微资讯,07-25 08:54
424,0,紫光国微本周融资净偿还7118.9万元，居半导体板块第三,"/news,002049,1209683689.html",大眼看两融,07-24 03:05
526,0,紫光国微本周深股通持股市值减少2.52亿元，居半导体板块第一,"/news,002049,1209677345.html",胖猫周周见,07-24 02:04
997,1,紫光国微07月22日被深股通减持32.21万股,"/news,002049,1209589309.html",紫光国微资讯,07-23 08:01
1065,0,（7-22）紫光国微连续三日收于年线之上,"/news,002049,1209473677.html",股友00703zn610,07-22 03:24
332,0,紫光国微：融资净偿还6966.15万元，两市排名第20（07-21）,"/news,002049,1209133313.html",紫光国微资讯,07-22 09:23
371,0,紫光国微07月21日被深股通减持4.04万股,"/news,002049,1209114042.html",紫光国微资讯,07-22 07:49
963,5,紫光国微股东户数下降3.16%，户均持股247.38万元,"/news,002049,1209027144.html",紫光国微资讯,07-21 07:06
306,0,紫光国微：融资净偿还2127.3万元，融资余额21.82亿元（07-20）,"/news,002049,1208624870.html",紫光国微资讯,07-21 09:28
465,1,紫光国微07月20日被深股通减持25.15万股,"/news,002049,1208601058.html",紫光国微资讯,07-21 08:19
295,0,紫光国微：融资净偿还2229.18万元，融资余额22.03亿元（07-19）,"/news,002049,1208125368.html",紫光国微资讯,07-20 09:26
390,0,紫光国微07月19日被深股通减持40.94万股,"/news,002049,1208102933.html",紫光国微资讯,07-20 08:12
346,0,紫光国微：融资净买入4203.73万元，融资余额22.26亿元（07-18）,"/news,002049,1207650774.html",紫光国微资讯,07-19 09:24
385,0,紫光国微07月18日被深股通减持19.39万股,"/news,002049,1207641065.html",紫光国微资讯,07-19 08:53
383,0,紫光国微：连续3日融资净偿还累计7974.11万元（07-15）,"/news,002049,1207177268.html",紫光国微资讯,07-18 08:54
406,0,紫光国微本周融资净偿还6417.5万元，居半导体板块第五,"/news,002049,1207109345.html",大眼看两融,07-17 03:05
428,0,紫光国微本周深股通持股市值减少2.55亿元，居半导体板块第二,"/news,002049,1207103297.html",胖猫周周见,07-17 02:04
569,0,紫光国微07月15日被深股通减持28.64万股,"/news,002049,1207017696.html",紫光国微资讯,07-16 08:05
373,0,紫光国微：融资净偿还6900.47万元，两市排名第19（07-14）,"/news,002049,1206523731.html",紫光国微资讯,07-15 09:23
380,0,紫光国微07月14日被深股通减持3.89万股,"/news,002049,1206506741.html",紫光国微资讯,07-15 08:21
3384,10,紫光集团重整尘埃落定 旗下紫光国微等公司迎“新东家”,"/news,002049,1206483914.html",紫光国微资讯,07-15 01:03
776,0,方正证券维持紫光国微强烈推荐评级 预计2022年净利润同比增长50.37%,"/news,002049,1206342811.html",公司研报提示,07-14 04:01
323,0,紫光国微：融资净偿还637.75万元，融资余额22.57亿元（07-13）,"/news,002049,1205963306.html",紫光国微资讯,07-14 09:01
361,0,紫光国微07月13日被深股通减持30.93万股,"/news,002049,1205957935.html",紫光国微资讯,07-14 08:31
1339,4,紫光国微股东户数下降19.35%，户均持股239.81万元,"/news,002049,1205902661.html",紫光国微资讯,07-13 09:56
300,0,紫光国微：融资净买入1106.67万元，融资余额22.63亿元（07-12）,"/news,002049,1205466387.html",紫光国微资讯,07-13 09:23
506,0,紫光国微07月12日被深股通减持47.18万股,"/news,002049,1205449154.html",紫光国微资讯,07-13 08:11
1750,5,坎坷历尽坦途至？紫光集团千亿重整落地   新掌舵者曾主导多起半导体并购,"/news,002049,1205424315.html",紫光国微资讯,07-12 11:21
1003,3,中信证券维持紫光国微买入评级 目标价220元,"/news,002049,1205340053.html",公司研报提示,07-12 05:20
357,0,紫光国微：融资净买入14.06万元，融资余额22.52亿元（07-11）,"/news,002049,1204975402.html",紫光国微资讯,07-12 09:20
332,0,紫光国微07月11日被深股通减持15.55万股,"/news,002049,1204963642.html",紫光国微资讯,07-12 08:31
3612,16,官宣！紫光集团完成股权变更登记 董事长、总经理等变动,"/news,002049,1204935260.html",紫光国微资讯,07-11 11:14
2343,2,紫光集团千亿重整获批   旗下上市公司变更为无实控人,"/news,002049,1204928616.html",紫光国微资讯,07-11 10:13
333,0,紫光国微：融资净偿还233.31万元，融资余额22.52亿元（07-08）,"/news,002049,1204497071.html",紫光国微资讯,07-11 08:52
458,0,紫光国微本周融资净买入1.44亿元，居半导体板块第二,"/news,002049,1204428897.html",大眼看两融,07-10 03:05
400,0,紫光国微本周被深股通减持14.37万股 最新持股量1763.39万股,"/news,002049,1204424000.html",胖猫周周见,07-10 02:05
552,0,紫光国微07月08日获深股通增持14.84万股,"/news,002049,1204341435.html",紫光国微资讯,07-09 08:48
1783,7,紫光国微：产品还处于供不应求状态 预计下半年产能明显改善,"/news,002049,1204257648.html",紫光国微资讯,07-08 04:39
374,0,紫光国微：连续3日融资净买入累计1.67亿元（07-07）,"/news,002049,1203908246.html",紫光国微资讯,07-08 09:25
372,0,紫光国微07月07日获深股通增持27.28万股,"/news,002049,1203896098.html",紫光国微资讯,07-08 09:00
376,0,紫光国微：融资净买入9940.89万元，两市排名第20（07-06）,"/news,002049,1203403315.html",紫光国微资讯,07-07 09:36
472,1,紫光国微07月06日被深股通减持22.49万股,"/news,002049,1203364344.html",紫光国微资讯,07-07 08:19
317,0,紫光国微：融资净买入5003.97万元，融资余额21.37亿元（07-05）,"/news,002049,1202880116.html",紫光国微资讯,07-06 09:24
383,0,紫光国微07月05日被深股通减持37.17万股,"/news,002049,1202859936.html",紫光国微资讯,07-06 07:50
1018,2,（7-5）紫光国微连续三日收于年线之上，为近一年首次,"/news,002049,1202665991.html",股友00703zn610,07-05 03:26
316,0,紫光国微：融资净偿还2355.23万元，融资余额20.87亿元（07-04）,"/news,002049,1202312685.html",紫光国微资讯,07-05 09:24
525,3,紫光国微07月04日获深股通增持3.17万股,"/news,002049,1202292231.html",紫光国微资讯,07-05 08:20
700,1,紫光国微股东户数增加5.92%，户均持股177.93万元,"/news,002049,1202169964.html",紫光国微资讯,07-04 08:11
755,1,紫光国微：融资净偿还2.32亿元，两市排名第二（07-01）,"/news,002049,1201710342.html",紫光国微资讯,07-04 08:51
493,0,紫光国微本周融资净买入2.71亿元，两市排名第20,"/news,002049,1201554410.html",大眼看两融,07-03 03:05
1223,3,紫光国微：“国微转债”第二季度转股3417股,"/news,002049,1201306323.html",紫光国微资讯,07-01 07:54
541,0,中信证券维持紫光国微买入评级 目标价220元,"/news,002049,1200919115.html",公司研报提示,07-01 10:08
362,0,紫光国微：融资余额23.43亿元，创近一年新高（06-30）,"/news,002049,1200826721.html",紫光国微资讯,07-01 08:53
353,0,紫光国微：连续4日融资净买入累计4.59亿元（06-29）,"/news,002049,1200158524.html",紫光国微资讯,06-30 09:25
335,0,紫光国微：连续3日融资净买入累计4.2亿元（06-28）,"/news,002049,1199468974.html",紫光国微资讯,06-29 09:21
382,0,紫光国微06月28日获深股通增持28.57万股,"/news,002049,1199452629.html",紫光国微资讯,06-29 08:22
308,0,紫光国微：融资净买入1.32亿元，两市排名第19（06-27）,"/news,002049,1198823147.html",紫光国微资讯,06-28 09:22
495,0,紫光国微06月27日获深股通增持70.91万股,"/news,002049,1198805449.html",紫光国微资讯,06-28 08:09
1618,5,紫光国微：子公司同芯微向国家开发银行北京市分行申请不超过 2 亿元人民币额度的贷款 公司为其提供连带责任保证担保,"/news,002049,1198692051.html",紫光国微资讯,06-27 08:42
1001,5,紫光国微：融资净买入2.2亿元，两市排名第一（06-24）,"/news,002049,1198194341.html",紫光国微资讯,06-27 08:55
467,0,紫光国微本周融资净偿还3327.23万元，居半导体板块第二,"/news,002049,1198064922.html",大眼看两融,06-26 03:06
528,0,紫光国微本周深股通持股市值减少1.31亿元，居半导体板块第三,"/news,002049,1198055539.html",胖猫周周见,06-26 02:04
1323,4,紫光国微06月24日被深股通减持87.24万股,"/news,002049,1197904690.html",紫光国微资讯,06-25 08:06
353,0,紫光国微：融资净偿还4441.49万元，融资余额18.52亿元（06-23）,"/news,002049,1197342576.html",紫光国微资讯,06-24 09:12
446,0,紫光国微06月23日获深股通增持3.32万股,"/news,002049,1197329352.html",紫光国微资讯,06-24 08:12
495,2,紫光国微：融资净偿还9851.62万元，两市排名第九（06-22）,"/news,002049,1196732975.html",紫光国微资讯,06-23 09:02
538,1,紫光国微06月22日获深股通增持14.12万股,"/news,002049,1196725045.html",紫光国微资讯,06-23 08:26
1744,14,紫光国微股东户数增加21.99%，户均持股191.82万元,"/news,002049,1196631831.html",紫光国微资讯,06-22 09:03
632,1,紫光国微：连续10日融资净买入累计6.47亿元（06-21）,"/news,002049,1196162120.html",紫光国微资讯,06-22 09:20
420,0,紫光国微06月21日被深股通减持18.03万股,"/news,002049,1196151130.html",紫光国微资讯,06-22 08:42
587,1,紫光国微本周融资净买入2.76亿元，两市排名第十,"/news,002049,1194916409.html",大眼看两融,06-19 03:04
362,0,紫光国微本周被深股通减持4.08亿元，周内减持市值两市排名第14,"/news,002049,1194909029.html",胖猫周周见,06-19 02:04
1102,3,紫光国微06月17日被深股通减持23万股,"/news,002049,1194771721.html",紫光国微资讯,06-18 08:14
356,0,紫光国微：连续7日融资净买入累计5.13亿元（06-16）,"/news,002049,1194254515.html",紫光国微资讯,06-17 09:17
500,2,紫光国微06月16日被深股通减持36.57万股,"/news,002049,1194240497.html",紫光国微资讯,06-17 08:25
357,0,紫光国微：融资净买入1.32亿元，两市排名第15（06-15）,"/news,002049,1193696290.html",紫光国微资讯,06-16 09:13
368,0,紫光国微06月15日被深股通减持58.52万股,"/news,002049,1193685202.html",紫光国微资讯,06-16 08:23
874,3,大宗交易：紫光国微成交294万元，溢价1.02%（06-15）,"/news,002049,1193531392.html",紫光国微资讯,06-15 06:01
313,0,紫光国微：连续5日融资净买入累计3.66亿元（06-14）,"/news,002049,1193072070.html",紫光国微资讯,06-15 09:18
374,0,紫光国微06月14日被深股通减持72.47万股,"/news,002049,1193057770.html",紫光国微资讯,06-15 08:17
986,4,紫光国微股东户数下降15.51%，户均持股245.28万元,"/news,002049,1192939102.html",紫光国微资讯,06-14 07:50
356,0,紫光国微：连续4日融资净买入累计2.87亿元（06-13）,"/news,002049,1192516288.html",紫光国微资讯,06-14 09:00
402,0,紫光国微06月13日被深股通减持17.85万股,"/news,002049,1192506250.html",紫光国微资讯,06-14 08:13
965,1,上海证券首予紫光国微买入评级：特种集成电路领跑者 品类扩张推动新成长,"/news,002049,1192257757.html",紫光国微资讯,06-13 02:20
420,0,上海证券首次给予紫光国微买入评级 预计2022年净利润同比增长51.96%,"/news,002049,1192246976.html",公司研报提示,06-13 02:10
1092,0,东吴证券首予紫光国微买入评级：国内芯片设计龙头 持续受益于下游放量和国产替代,"/news,002049,1192172942.html",紫光国微资讯,06-13 12:41
337,0,东吴证券首次给予紫光国微买入评级 预计2022年净利润同比增长48.12%,"/news,002049,1192170980.html",公司研报提示,06-13 12:38
1758,5,贵州茅台、紫光国微等59股获北向资金增持额超亿元,"/news,002049,1191984842.html",紫光国微资讯,06-13 09:28
340,0,紫光国微：融资净买入2.26亿元，两市排名第三（06-10）,"/news,002049,1191964397.html",紫光国微资讯,06-13 09:04
686,1,紫光国微本周融资净买入6574.64万元，居半导体板块第六,"/news,002049,1191841822.html",大眼看两融,06-12 03:07
457,0,紫光国微本周获深股通增持5.3亿元，周内增持市值两市排名第20,"/news,002049,1191832205.html",胖猫周周见,06-12 02:03
520,0,紫光国微06月10日获深股通增持212.25万股,"/news,002049,1191688682.html",紫光国微资讯,06-11 08:15
1319,4,再破200元大关 紫光国微放量涨停 机构博弈激烈,"/news,002049,1191590912.html",紫光国微资讯,06-10 07:12
867,0,龙虎榜：机构今日买入这12股 抛售紫光国微4.99亿元,"/news,002049,1191568898.html",紫光国微资讯,06-10 05:45
872,3,紫光国微放量涨停 机构博弈激烈,"/news,002049,1191556668.html",紫光国微资讯,06-10 04:53
447,0,紫光国微放量涨停 机构博弈激烈,"/news,002049,1191548385.html",紫光国微资讯,06-10 04:33
604,0,多主力现身龙虎榜，紫光国微涨停（06-10）,"/news,002049,1191545908.html",紫光国微资讯,06-10 04:28
1754,4,紫光国微放量涨停 两机构买入4.65亿元,"/news,002049,1191545615.html",紫光国微资讯,06-10 04:27
2473,11,紫光国微(002049)龙虎榜数据(06-10),"/news,002049,1191558871.html",紫光国微资讯,06-10 04:26
540,0,紫光国微放量涨停 机构资金现分歧,"/news,002049,1191543777.html",一句话龙虎榜,06-10 04:21
273,0,紫光国微：融资净买入585.21万元，融资余额13.59亿元（06-09）,"/news,002049,1191146600.html",紫光国微资讯,06-10 09:17
447,1,紫光国微06月09日被深股通减持7.89万股,"/news,002049,1191137890.html",紫光国微资讯,06-10 08:46
1122,4,紫光国微：公司车载控制芯片正在进行相关测试工作,"/news,002049,1191066345.html",紫光国微资讯,06-09 10:04
829,3,大宗交易：机构账户买入紫光国微368万元（06-09）,"/news,002049,1190994131.html",紫光国微资讯,06-09 06:00
300,0,紫光国微：融资净买入531.84万元，融资余额13.53亿元（06-08）,"/news,002049,1190576184.html",紫光国微资讯,06-09 09:13
332,0,紫光国微06月08日被深股通减持2.8万股,"/news,002049,1190568070.html",紫光国微资讯,06-09 08:40
310,0,紫光国微：融资净偿还281.07万元，融资余额13.48亿元（06-07）,"/news,002049,1189990466.html",紫光国微资讯,06-08 09:17
567,1,紫光国微06月07日获深股通增持69.06万股,"/news,002049,1189978838.html",紫光国微资讯,06-08 08:28
384,0,紫光国微：融资净买入5738.66万元，融资余额13.51亿元（06-06）,"/news,002049,1189469411.html",紫光国微资讯,06-07 09:15
388,0,紫光国微06月06日获深股通增持3.96万股,"/news,002049,1189457400.html",紫光国微资讯,06-07 08:16
334,0,紫光国微：融资净偿还4133.79万元，融资余额12.93亿元（06-02）,"/news,002049,1188918195.html",紫光国微资讯,06-06 08:56
434,0,紫光国微本周融资净买入8476.29万元，居半导体板块第一,"/news,002049,1188811086.html",大眼看两融,06-05 03:05
465,0,紫光国微本周深股通持股市值增加2.14亿元，居半导体板块第一,"/news,002049,1188803729.html",胖猫周周见,06-05 02:04
571,0,紫光国微06月02日获深股通增持63.25万股,"/news,002049,1188575838.html",紫光国微资讯,06-03 08:46
1247,2,紫光国微股东户数增加7.49%，户均持股181.63万元,"/news,002049,1188483881.html",紫光国微资讯,06-02 06:53
309,0,紫光国微：连续3日融资净买入累计8476.29万元（06-01）,"/news,002049,1188053103.html",紫光国微资讯,06-02 09:10
356,0,紫光国微06月01日获深股通增持1.92万股,"/news,002049,1188041862.html",紫光国微资讯,06-02 08:21
523,3,紫光国微：融资净买入5463.92万元，融资余额13.25亿元（05-31）,"/news,002049,1187514432.html",紫光国微资讯,06-01 09:14
523,2,紫光国微05月31日获深股通增持49.71万股,"/news,002049,1187505375.html",紫光国微资讯,06-01 08:35
358,0,紫光国微：融资净买入2036.5万元，融资余额12.7亿元（05-30）,"/news,002049,1186910500.html",紫光国微资讯,05-31 09:15
369,0,紫光国微05月30日获深股通增持4.14万股,"/news,002049,1186897427.html",紫光国微资讯,05-31 08:17
378,0,紫光国微：连续3日融资净偿还累计4664.28万元（05-27）,"/news,002049,1186342599.html",紫光国微资讯,05-30 08:44
379,0,紫光国微本周融资净偿还1794.8万元，居半导体板块第三,"/news,002049,1186220083.html",大眼看两融,05-29 03:04
443,0,深股通连续5周净卖出紫光国微 累计净卖出4.93亿元,"/news,002049,1186211438.html",胖猫周周见,05-29 02:04
523,0,紫光国微05月27日获深股通增持9.69万股,"/news,002049,1186060994.html",紫光国微资讯,05-28 08:40
409,0,紫光国微：融资净偿还1954.33万元，融资余额12.72亿元（05-26）,"/news,002049,1185526500.html",紫光国微资讯,05-27 09:09
406,0,紫光国微05月26日被深股通减持7.05万股,"/news,002049,1185514592.html",紫光国微资讯,05-27 08:18
569,1,紫光国微5月26日快速上涨,"/news,002049,1185090309.html",紫光国微资讯,05-26 10:40
323,0,紫光国微5月26日快速反弹,"/news,002049,1185089750.html",紫光国微资讯,05-26 10:40
358,0,紫光国微：融资净偿还477.36万元，融资余额12.92亿元（05-25）,"/news,002049,1184962024.html",紫光国微资讯,05-26 09:09
397,0,紫光国微05月25日获深股通增持12.57万股,"/news,002049,1184952943.html",紫光国微资讯,05-26 08:28
398,0,紫光国微5月25日快速反弹,"/news,002049,1184573691.html",紫光国微资讯,05-25 11:10
386,0,紫光国微：融资净买入2184.86万元，融资余额12.97亿元（05-24）,"/news,002049,1184421673.html",紫光国微资讯,05-25 09:06
374,0,紫光国微05月24日被深股通减持27.54万股,"/news,002049,1184412372.html",紫光国微资讯,05-25 08:25
322,0,紫光国微：融资净偿还1547.97万元，融资余额12.75亿元（05-23）,"/news,002049,1183816226.html",紫光国微资讯,05-24 08:43
372,2,紫光国微05月23日被深股通减持3.89万股,"/news,002049,1183804758.html",紫光国微资讯,05-24 07:31
754,1,紫光国微股东户数增加5.96%，户均持股204.81万元,"/news,002049,1183642638.html",紫光国微资讯,05-23 05:34
348,0,紫光国微：融资净买入3176.07万元，融资余额12.9亿元（05-20）,"/news,002049,1183260827.html",紫光国微资讯,05-23 08:45
953,3,紫光国微本周融资净买入4302.23万元，居半导体板块第二,"/news,002049,1183124783.html",大眼看两融,05-22 03:08
615,1,紫光国微本周深股通持股市值减少3301.89万元，居半导体板块第九,"/news,002049,1183114931.html",胖猫周周见,05-22 02:05
1006,3,紫光国微05月20日被深股通减持22.26万股,"/news,002049,1182940584.html",紫光国微资讯,05-21 07:33
1592,7,紫光国微：子公司拟参与联合竞买及合作建设一地块,"/news,002049,1182847928.html",紫光国微资讯,05-20 08:32
347,0,紫光国微：融资净买入1553.03万元，融资余额12.59亿元（05-19）,"/news,002049,1182402616.html",紫光国微资讯,05-20 08:43
396,0,紫光国微05月19日获深股通增持17.84万股,"/news,002049,1182391098.html",紫光国微资讯,05-20 07:34
432,0,紫光国微：融资净偿还302.91万元，融资余额12.43亿元（05-18）,"/news,002049,1181844984.html",紫光国微资讯,05-19 08:46
489,0,紫光国微05月18日获深股通增持9.59万股,"/news,002049,1181830626.html",紫光国微资讯,05-19 07:35
459,0,紫光国微：融资净买入1761.71万元，融资余额12.46亿元（05-17）,"/news,002049,1181266937.html",紫光国微资讯,05-18 08:47
474,0,紫光国微05月17日被深股通减持8.68万股,"/news,002049,1181258898.html",紫光国微资讯,05-18 08:08
515,0,紫光国微：融资净买入1290.41万元，融资余额12.28亿元（05-16）,"/news,002049,1180708958.html",紫光国微资讯,05-17 08:44
509,0,紫光国微05月16日被深股通减持14.23万股,"/news,002049,1180696927.html",紫光国微资讯,05-17 07:34
482,0,紫光国微：融资净偿还748.29万元，融资余额12.16亿元（05-13）,"/news,002049,1180257400.html",紫光国微资讯,05-16 09:56
618,0,紫光国微本周融资净买入7951.17万元，居半导体板块第一,"/news,002049,1180062241.html",大眼看两融,05-15 03:04
559,0,深股通连续3周净卖出紫光国微 累计净卖出4.3亿元,"/news,002049,1180054729.html",胖猫周周见,05-15 02:05
742,0,紫光国微05月13日获深股通增持10.13万股,"/news,002049,1179874099.html",紫光国微资讯,05-14 07:40
399,0,紫光国微：融资净偿还2359.35万元，融资余额12.23亿元（05-12）,"/news,002049,1179361140.html",紫光国微资讯,05-13 08:47
