read amount,comments,title,content link,author,create time
1689,16,通威股份：发行可转债申请获证监会审核通过,"/news,600438,1115631634.html",通威股份资讯,12-06 04:37
3179,43,通威股份：公开发行可转债申请获审核通过,"/news,600438,1115629924.html",通威股份资讯,12-06 04:32
652,3,通威股份12月6日快速上涨,"/news,600438,1115301759.html",通威股份资讯,12-06 09:45
752,1,通威股份本周融资净偿还1.55亿元，居光伏设备板块第二,"/news,600438,1115164801.html",大眼看两融,12-05 03:05
546,0,通威股份本周被沪股通减持7.95亿元，周内减持市值两市排名第五,"/news,600438,1115157662.html",胖猫周周见,12-05 02:04
664,2,通威股份：连续3日融资净偿还累计1.52亿元（12-03）,"/news,600438,1115031749.html",通威股份资讯,12-04 07:52
786,2,通威股份12月03日被沪股通减持511.3万股,"/news,600438,1115029445.html",通威股份资讯,12-04 07:37
13495,57,通威股份跌3.7% 招商证券10月末发研报强烈推荐,"/news,600438,1114922410.html",通威股份资讯,12-03 04:43
690,2,通威股份12月3日盘中跌幅达5%,"/news,600438,1114640530.html",通威股份资讯,12-03 10:22
331,0,通威股份：融资净偿还5350.65万元，融资余额68.2亿元（12-02）,"/news,600438,1114516301.html",通威股份资讯,12-03 07:49
808,3,通威股份12月02日被沪股通减持613.01万股,"/news,600438,1114515078.html",通威股份资讯,12-03 07:43
3952,42,通威股份：本次发行的可转债给予原A股股东优先配售权,"/news,600438,1114211968.html",通威股份资讯,12-02 11:49
342,0,通威股份：融资净偿还3582.73万元，融资余额68.77亿元（12-01）,"/news,600438,1114005331.html",通威股份资讯,12-02 09:19
3167,34,光伏业务获佳绩 通威股份旗下高纯晶硅正品出炉,"/news,600438,1113934205.html",通威股份资讯,12-01 09:33
2832,39,通威股份永祥新能源二期首批高纯晶硅正品成功出炉,"/news,600438,1113924095.html",通威股份资讯,12-01 08:35
351,0,通威股份：融资净买入2515.11万元，融资余额69.13亿元（11-30）,"/news,600438,1113481609.html",通威股份资讯,12-01 07:50
761,4,通威股份11月30日被沪股通减持435.98万股,"/news,600438,1113477883.html",通威股份资讯,12-01 07:33
2444,81,珠海海壹违法被交通运输局处罚 为通威股份全资子公司,"/news,600438,1113474815.html",通威股份资讯,12-01 06:51
390,0,通威股份：连续6日融资净偿还累计2.76亿元（11-29）,"/news,600438,1112952117.html",通威股份资讯,11-30 07:52
722,1,通威股份11月29日获沪股通增持80.96万股,"/news,600438,1112950732.html",通威股份资讯,11-30 07:46
3516,22,通威股份：公司多晶硅主要原料为硅粉 可就近采购,"/news,600438,1112445438.html",通威股份资讯,11-29 09:00
2814,29,通威股份：目前所建光伏电站均为公司控股 且大部分由公司100%拥有,"/news,600438,1112445437.html",通威股份资讯,11-29 09:00
2044,12,通威股份：公司210电池片生产线均可生产210及以下尺寸产品 公司将根据下游客户采购需求综合决策产品组合,"/news,600438,1112442869.html",通威股份资讯,11-29 08:50
2703,34,通威股份：公司电池质量和成本行业领先 具备较强的产品竞争力 多年来公司电池产销两旺 产品客户覆盖全球排名前十组件企业,"/news,600438,1112440437.html",通威股份资讯,11-29 08:36
344,0,通威股份本周融资净偿还2.48亿元，两市排名第七,"/news,600438,1112344710.html",大眼看两融,11-28 03:05
941,2,通威股份本周获沪股通增持4.19亿元，周内增持市值两市排名第17,"/news,600438,1112337661.html",胖猫周周见,11-28 02:04
595,0,通威股份：融资净偿还7923.53万元，两市排名第13（11-26）,"/news,600438,1112205033.html",通威股份资讯,11-27 07:56
734,1,通威股份11月26日获沪股通增持174.45万股,"/news,600438,1112201689.html",通威股份资讯,11-27 07:36
4436,17,通威股份：公司硅料采用的工艺技术路线与大全新能源同为改良西门子法,"/news,600438,1112117304.html",通威股份资讯,11-26 06:30
398,0,通威股份：融资净偿还8979.04万元，两市排名第六（11-25）,"/news,600438,1111694659.html",通威股份资讯,11-26 07:51
571,0,通威股份11月25日获沪股通增持601.5万股,"/news,600438,1111691301.html",通威股份资讯,11-26 07:34
524,0,通威股份：连续3日融资净偿还累计7912.8万元（11-24）,"/news,600438,1111176421.html",通威股份资讯,11-25 07:51
619,0,通威股份11月24日盘中跌幅达5%,"/news,600438,1111072809.html",通威股份资讯,11-24 11:07
294,1,通威股份：融资净偿还803.02万元，融资余额71.52亿元（11-23）,"/news,600438,1111062216.html",通威股份资讯,11-24 07:47
410,1,通威股份11月23日被沪股通减持173.68万股,"/news,600438,1111058155.html",通威股份资讯,11-24 07:32
360,0,通威股份：融资净偿还360.19万元，融资余额71.59亿元（11-22）,"/news,600438,1110152471.html",通威股份资讯,11-23 07:48
511,0,通威股份11月22日获沪股通增持297.01万股,"/news,600438,1110150454.html",通威股份资讯,11-23 07:36
2470,31,通威股份：多晶硅项目投产后行业产能爬坡期一般为3-6月,"/news,600438,1109840151.html",通威股份资讯,11-22 11:37
1634,8,通威股份：新增建设的1GW异质结中试线处于产能爬坡阶段,"/news,600438,1109837909.html",通威股份资讯,11-22 11:34
2033,34,通威股份：2021年公司新增建设了1GW异质结中试线 目前产线处于产能爬坡阶段,"/news,600438,1109819078.html",通威股份资讯,11-22 11:14
509,0,通威股份本周融资净买入1.69亿元，两市排名第17,"/news,600438,1109564686.html",大眼看两融,11-21 03:05
829,4,通威股份本周被沪股通减持2.54亿元，周内减持市值两市排名第19,"/news,600438,1109557461.html",胖猫周周见,11-21 02:04
548,0,通威股份：融资净买入6074.02万元，融资余额71.63亿元（11-19）,"/news,600438,1109429018.html",通威股份资讯,11-20 07:50
689,1,通威股份11月19日获沪股通增持33.97万股,"/news,600438,1109426780.html",通威股份资讯,11-20 07:35
375,0,通威股份：融资净偿还4309.05万元，融资余额71.02亿元（11-18）,"/news,600438,1108927733.html",通威股份资讯,11-19 07:51
590,1,通威股份11月18日被沪股通减持104.98万股,"/news,600438,1108926780.html",通威股份资讯,11-19 07:46
421,0,通威股份：融资净买入8909.1万元，两市排名第17（11-17）,"/news,600438,1108400135.html",通威股份资讯,11-18 07:48
577,1,通威股份11月17日被沪股通减持212.68万股,"/news,600438,1108399420.html",通威股份资讯,11-18 07:45
340,0,通威股份：融资净买入5099.77万元，融资余额70.56亿元（11-16）,"/news,600438,1107905648.html",通威股份资讯,11-17 07:50
398,0,通威股份11月16日被沪股通减持56.82万股,"/news,600438,1107904111.html",通威股份资讯,11-17 07:42
393,0,通威股份：融资净买入1130.61万元，融资余额70.05亿元（11-15）,"/news,600438,1107384718.html",通威股份资讯,11-16 07:46
445,0,通威股份11月15日被沪股通减持177.04万股,"/news,600438,1107383331.html",通威股份资讯,11-16 07:40
884,1,通威股份本周融资净买入1.79亿元，居综合行业板块第一,"/news,600438,1106824811.html",大眼看两融,11-14 03:06
564,0,通威股份本周沪股通持股市值减少1.89亿元，居综合行业板块第三,"/news,600438,1106817885.html",胖猫周周见,11-14 02:04
2499,33,通威股份陈星宇：未来可再生能源会扮演重要角色,"/news,600438,1106740889.html",通威股份资讯,11-13 04:53
537,0,通威股份：融资净偿还1038.75万元，融资余额69.94亿元（11-12）,"/news,600438,1106692690.html",通威股份资讯,11-13 07:49
762,2,通威股份11月12日被沪股通减持143.79万股,"/news,600438,1106689852.html",通威股份资讯,11-13 07:33
385,1,通威股份：融资净偿还3926.59万元，融资余额70.04亿元（11-11）,"/news,600438,1105576801.html",通威股份资讯,11-12 07:47
481,1,通威股份11月11日获沪股通增持203.34万股,"/news,600438,1105574799.html",通威股份资讯,11-12 07:39
501,0,通威股份：连续8日融资净买入累计11亿元（11-10）,"/news,600438,1105062694.html",通威股份资讯,11-11 07:50
574,0,通威股份11月10日被沪股通减持571.86万股,"/news,600438,1105060643.html",通威股份资讯,11-11 07:41
613,0,通威股份11月10日盘中跌幅达5%,"/news,600438,1104723896.html",通威股份资讯,11-10 10:56
822,2,通威股份：连续7日融资净买入累计10.25亿元（11-09）,"/news,600438,1104560698.html",通威股份资讯,11-10 07:49
1693,27,浙商证券给予通威股份买入评级：硅料电池巨头 先发扩产量利齐升,"/news,600438,1104322404.html",通威股份资讯,11-09 01:34
1128,6,浙商证券首次给予通威股份买入评级 预计2021年净利润同比增长127.64%,"/news,600438,1104312969.html",通威股份资讯,11-09 01:24
1397,11,通威股份：公司生产的高纯晶硅主要供给下游硅片厂商,"/news,600438,1104113506.html",通威股份资讯,11-09 09:26
449,0,通威股份：融资净买入1.22亿元，两市排名第16（11-08）,"/news,600438,1104082812.html",通威股份资讯,11-09 07:53
633,1,通威股份11月08日获沪股通增持114.91万股,"/news,600438,1104080389.html",通威股份资讯,11-09 07:41
993,3,通威股份本周融资净买入8.71亿元，两市排名第一,"/news,600438,1103536289.html",大眼看两融,11-07 03:05
721,0,通威股份本周沪股通持股市值减少1680.8万元，居综合行业板块第四,"/news,600438,1103529854.html",胖猫周周见,11-07 02:05
625,0,通威股份：融资净买入9207.99万元，两市排名第八（11-05）,"/news,600438,1103397521.html",通威股份资讯,11-06 07:35
2991,34,广发证券维持通威股份买入评级 目标价73.13元,"/news,600438,1103056623.html",通威股份资讯,11-05 11:16
2262,47,时报观察丨“双碳”目标下光伏龙头须更关注供应链管控,"/news,600438,1102865664.html",通威股份资讯,11-05 07:58
411,0,通威股份：融资净买入2.76亿元，两市排名第四（11-04）,"/news,600438,1102861304.html",通威股份资讯,11-05 07:49
587,1,通威股份11月04日被沪股通减持77.84万股,"/news,600438,1102858163.html",通威股份资讯,11-05 07:35
1736,8,“双碳”目标下光伏龙头须更关注供应链管控,"/news,600438,1102841469.html",通威股份资讯,11-05 02:47
1497,22,华创证券维持通威股份强推评级 目标价60元,"/news,600438,1102764164.html",通威股份资讯,11-04 07:25
2617,54,通威股份：截止2021年6月30日 公司建成以“渔光一体”为主的光伏电站46座 累计装机并网规模超过2.4GW,"/news,600438,1102713760.html",通威股份资讯,11-04 03:51
2688,15,强强联手！通威与京运通、晶科能源签署增资扩股协议,"/news,600438,1102639295.html",通威股份资讯,11-04 02:12
1954,18,通威股份：2020年11月公司与天合光能签订了战略合作协议,"/news,600438,1102554067.html",通威股份资讯,11-04 12:42
418,0,通威股份：连续3日融资净买入累计5.03亿元（11-03）,"/news,600438,1102336920.html",通威股份资讯,11-04 07:49
385,0,通威股份11月03日获沪股通增持144.57万股,"/news,600438,1102333850.html",通威股份资讯,11-04 07:33
2010,10,通威与京运通、晶科能源签署增资扩股协议 强化多晶硅产能的股权合作,"/news,600438,1102280443.html",通威股份资讯,11-03 09:33
1231,10,通威股份10万吨硅料项目引入战投 京运通、晶科能源拟合计出资14.7亿,"/news,600438,1102258569.html",通威股份资讯,11-03 07:53
3426,45,通威股份拟与京运通、晶科能源共同对10万吨高纯晶硅项目公司进行注资,"/news,600438,1102239367.html",通威股份资讯,11-03 06:20
2258,21,通威与晶科、京运通强强联合 共同增资10万吨多晶硅项目,"/news,600438,1102228779.html",通威股份资讯,11-03 05:27
2245,62,通威股份与京运通、晶科能源就10万吨高纯晶硅项目实施主体增资扩股签署协议,"/news,600438,1102223883.html",通威股份资讯,11-03 05:05
1789,8,通威股份：与京运通、晶科能源就共同向一期10万吨高纯晶硅项目实施主体增资扩股及开展相关合作,"/news,600438,1102206193.html",通威股份资讯,11-03 03:47
1752,21,通威股份：乐山二期已于2021年11月2日投产 保山一期预计2021年底前投产,"/news,600438,1102075830.html",通威股份资讯,11-03 12:45
403,0,通威股份：融资净买入1.32亿元，两市排名第四（11-02）,"/news,600438,1101864131.html",通威股份资讯,11-03 07:50
2038,43,通威股份产能扩张 5.1万吨高纯晶硅项目启动生产,"/news,600438,1101797466.html",通威股份资讯,11-02 09:03
1493,23,永祥新能源二期5.1万吨高纯晶硅项目启动生产 成本有望突破历史新低,"/news,600438,1101774113.html",通威股份资讯,11-02 07:32
2530,48,永祥新能源二期全面启动生产 成本有望再破新低,"/news,600438,1101769949.html",通威股份资讯,11-02 06:58
2950,27,通威股份跌6.69% 招商证券上周五发研报强烈推荐,"/news,600438,1101759698.html",通威股份资讯,11-02 06:27
2708,51,通威股份硅料赛道再加码：旗下5.1万吨高纯晶硅项目投产运行,"/news,600438,1101754701.html",通威股份资讯,11-02 06:02
2817,59,通威股份：在新能源方面 公司以高纯晶硅、太阳能电池等产品的研发、生产、销售为主,"/news,600438,1101513393.html",通威股份资讯,11-02 11:16
548,0,通威股份：融资净买入3.52亿元，两市排名第五（11-01）,"/news,600438,1101325962.html",通威股份资讯,11-02 07:49
653,2,通威股份11月01日被沪股通减持85.61万股,"/news,600438,1101324983.html",通威股份资讯,11-02 07:43
2636,40,通威股份：公司农业方面以水产饲料、畜禽饲料等产品的研究、生产和销售为主,"/news,600438,1101203499.html",通威股份资讯,11-01 04:45
419,0,通威股份本周融资净偿还3.09亿元，两市排名第五,"/news,600438,1100753285.html",大眼看两融,10-31 03:05
473,0,通威股份本周沪股通持股市值减少2808.67万元，居综合行业板块第二,"/news,600438,1100746587.html",胖猫周周见,10-31 02:04
578,0,通威股份：连续3日融资净偿还累计2.52亿元（10-29）,"/news,600438,1100606373.html",通威股份资讯,10-30 07:40
763,1,通威股份10月29日被沪股通减持75.95万股,"/news,600438,1100605093.html",通威股份资讯,10-30 07:34
2835,33,通威股份：在高纯晶硅业务方面 公司与隆基股份、天合光能建立了股权合作关系,"/news,600438,1100454325.html",通威股份资讯,10-29 03:30
850,0,万联证券维持通威股份买入评级 点评报告：三季度业绩出色 硅料新产能投产在即,"/news,600438,1100184960.html",通威股份资讯,10-29 10:03
1191,6,财信证券维持通威股份推荐评级 目标价57.6~61.2元,"/news,600438,1100087209.html",通威股份资讯,10-29 08:48
700,0,财信证券维持通威股份推荐评级：硅料价格持续坚挺 待新增产能落地,"/news,600438,1100086922.html",通威股份资讯,10-29 08:45
434,1,通威股份：融资净偿还1.11亿元，融资余额59.95亿元（10-28）,"/news,600438,1100074928.html",通威股份资讯,10-29 07:53
562,3,通威股份10月28日获沪股通增持92.81万股,"/news,600438,1100071267.html",通威股份资讯,10-29 07:36
1125,14,开源证券维持通威股份买入评级 近期获16份券商研报关注 目标均价涨幅20.69%,"/news,600438,1099497558.html",通威股份资讯,10-28 09:25
388,0,通威股份：融资净偿还8934.69万元，两市排名第20（10-27）,"/news,600438,1099462382.html",通威股份资讯,10-28 07:51
445,0,通威股份10月27日获沪股通增持144.48万股,"/news,600438,1099460136.html",通威股份资讯,10-28 07:40
652,1,开源证券维持通威股份买入(Buy)评级 预计2021年净利润同比增长119.93%,"/news,600438,1099431989.html",通威股份资讯,10-28 12:07
1336,42,群益证券给予通威股份买进(Buy)评级 目标价55元,"/news,600438,1099338425.html",通威股份资讯,10-27 06:14
514,2,国泰君安维持通威股份增持评级 目标价64.75元,"/news,600438,1099337553.html",通威股份资讯,10-27 06:11
643,2,中银证券维持通威股份买入评级：硅料景气持续，研发投入提升,"/news,600438,1099206265.html",通威股份资讯,10-27 02:04
395,1,中银证券维持通威股份买入评级 预计2021年净利润同比增长129.36%,"/news,600438,1099195480.html",通威股份资讯,10-27 01:57
550,3,中泰证券维持通威股份买入评级：硅料盈利高增 业绩符合预期,"/news,600438,1099196598.html",通威股份资讯,10-27 01:57
364,1,中泰证券维持通威股份买入评级 预计2021年净利润同比增长141.36%,"/news,600438,1099189003.html",通威股份资讯,10-27 01:50
471,1,华金证券维持通威股份买入评级：业绩符合预期 硅料贡献主要利润,"/news,600438,1098894581.html",通威股份资讯,10-27 08:44
695,30,华金证券维持通威股份买入评级 预计2021年净利润同比增长137.37%,"/news,600438,1098890450.html",通威股份资讯,10-27 08:37
582,4,国盛证券给予通威股份增持评级：业绩符合预期 硅料龙头加速扩张,"/news,600438,1098889755.html",通威股份资讯,10-27 08:30
442,1,国盛证券维持通威股份增持评级 预计2021年净利润同比增长137.12%,"/news,600438,1098888313.html",通威股份资讯,10-27 08:24
294,0,通威股份：融资净买入6184.48万元，融资余额61.95亿元（10-26）,"/news,600438,1098881996.html",通威股份资讯,10-27 07:51
444,1,通威股份10月26日被沪股通减持424.46万股,"/news,600438,1098880668.html",通威股份资讯,10-27 07:44
1163,6,东吴证券给予通威股份买入评级：业绩偏预告上限，硅料龙头持续扩产巩固龙头地位加强,"/news,600438,1098820143.html",通威股份资讯,10-26 09:33
1270,32,东吴证券维持通威股份买入评级 目标价80.1元,"/news,600438,1098816274.html",通威股份资讯,10-26 09:28
805,10,广发证券维持通威股份买入评级 目标价73.13元,"/news,600438,1098771302.html",通威股份资讯,10-26 06:44
780,2,西部证券维持通威股份买入评级 2021年三季报点评：硅料业务持续满产满销 盈利能力大幅提升,"/news,600438,1098767015.html",通威股份资讯,10-26 06:26
443,1,西部证券维持通威股份买入评级 预计2021年净利润同比增长143.96%,"/news,600438,1098765540.html",通威股份资讯,10-26 06:21
860,6,山西证券给予通威股份买入评级 多晶硅盈利高企 电池及饲料齐头并进,"/news,600438,1098746434.html",通威股份资讯,10-26 05:10
310,0,山西证券维持通威股份买入评级 预计2021年净利润同比增长131.48%,"/news,600438,1098744027.html",通威股份资讯,10-26 05:04
1271,7,通威股份前三季赚近60亿 创单季最高盈利额,"/news,600438,1098710002.html",通威股份资讯,10-26 03:17
895,9,国金证券维持通威股份买入评级：工业硅价格如期回落 明年硅料高盈利可期,"/news,600438,1098637365.html",通威股份资讯,10-26 01:54
766,6,国金证券维持通威股份买入评级 目标价75元,"/news,600438,1098630862.html",通威股份资讯,10-26 01:47
968,20,是否有收购电力公司相关计划？通威股份：公司目前无此计划,"/news,600438,1098558070.html",通威股份资讯,10-26 11:29
494,0,华安证券维持通威股份买入评级：硅料业务保持高盈利 电池片盈利有望触底回升,"/news,600438,1098542035.html",通威股份资讯,10-26 10:51
314,0,华安证券维持通威股份买入评级 预计2021年净利润同比增长126.89%,"/news,600438,1098509926.html",通威股份资讯,10-26 10:46
439,0,经营规模扩大产品价格提升 通威股份前三季度净利润同比增长78%,"/news,600438,1098491876.html",通威股份资讯,10-26 10:18
1369,8,有农业有光伏 通威股份前三季净赚近60亿 股东户数持续缩减,"/news,600438,1098371229.html",通威股份资讯,10-26 08:35
323,0,通威股份：融资净偿还1.18亿元，两市排名第三（10-25）,"/news,600438,1098363943.html",通威股份资讯,10-26 07:51
334,0,通威股份10月25日获沪股通增持209.08万股,"/news,600438,1098360948.html",通威股份资讯,10-26 07:35
879,9,通威股份前三季度实现净利近60亿元  创同期业绩新高,"/news,600438,1098325379.html",通威股份资讯,10-25 09:41
409,0,【图解季报】通威股份：2021年前三季度归母净利润同比大增78.4%，约为59.4亿元,"/news,600438,1098297876.html",通威股份资讯,10-25 08:27
2343,37,通威股份第三季度扣非净利润同比增长207.91%,"/news,600438,1098280375.html",通威股份资讯,10-25 07:49
2416,0,财报快评：通威股份2021年三季度实现归母净利润59.4亿，同比上升78.4%,"/news,600438,1098261359.html",机智柯基,10-25 06:22
553,1,读财报系列3——一文看懂21年三季度通威股份现金流量表,"/news,600438,1098261233.html",股友5p203r0103,10-25 06:21
9639,52,åè¥¿è¡ä»½(000936)é¾èæ¦æ°æ®(07-12),"/news,000936,1330095511.html",åè¥¿è¡ä»½èµè®¯,07-12 04:44
716,4,åè¥¿è¡ä»½è·å æºæåååº8447ä¸å,"/news,000936,1330107587.html",åè¥¿è¡ä»½èµè®¯,07-12 05:35
552,6,2æ14æ¥äºå¨åå¤ï¼å¬å¸åè¡å¬å¸ç´¢å°æåçµæ¯ä¸å®¶å¨çé¢åãæä¾åæ°ä¸å¯é çåéä¿¡,"/news,000936,1313303374.html",åè¥¿è¡ä»½è¡å,05-25 03:13
259,2,ä¸»åæç»­éä»ï¼å®å¾å³å°å¤§å±ï¼,//caifuhao.eastmoney.com/news/20230712141927578627280,ä¸æ¹å¨è¡å¸AAA,07-12 02:19
146,4,ä»æåé¢,"/news,000936,1330119720.html",åå®çæå®¹æ¢¦å¨2,07-12 06:32
479,10,åè¥¿è¡ä»½ï¼å½èµé´æ¥æ§è¡ æ½ä¼ç§æå¤§ç ä¸­å½ç¬¬ä¸æå¾å´èµ·,//caifuhao.eastmoney.com/news/20230712004717216368000,æ¤æAè¡,07-12 12:47
7179,43,ç­¹ç åä¸åºæ¬é¢åä¸è®¸å¤äººè¯´è¿æ¯åºè´§ï¼ä»åå²å¤©éé£å¤©èµ·å°æ¨å¤©13ä¸ªäº¤ææ¥å¤§æ¦æäº¤äº,//caifuhao.eastmoney.com/news/20230711061157710710630,é²äººæè·¯,07-11 06:11
693,16,åå¼ä»¬ç½åï¼,"/news,000936,1329820871.html",è¿å¤§çæ±æ2,07-12 10:08
5043,45,åè¥¿ï¼ç´¢å°æ.çºµæ§è¯å.GTâ .æ¾å¯ç§æ 4å¬å¸è¡æ_åé£é£30å,//caifuhao.eastmoney.com/news/20230707033712281218000,è®ºè¡æµæ°´,07-07 03:37
4009,16,é«é¸¿ï¼çµä¿¡ç§å­¦é¢å®æ§ åè¯ç/é«ééä¿¡æ¨¡ç»/å¤§æ°æ®/äººå·¥æºè½,//caifuhao.eastmoney.com/news/20230706125721775023680,å©·å©·çç«618,07-06 12:57
1611,12,åè¥¿è¡ä»½ä¸ä¸èµ°å¿åå»ºè®®ï¼,"/news,000936,1330099331.html",å¥åµ1è°è¡,07-12 05:12
1,0,æä¸ç¥éä¸ç´è¯´æå¤©å¼çè·åçäººä»ä¹å¿æåè¥¿ä½å¼æ¯å¾æ­£å¸¸ä½æ¯ä»å¤©è¿æ¥ä¸¤ä¸ªæå­ååä¹,"/news,000936,1330126378.html",å®æ³¢ç¬¬ä¸æ·±ç¦½,07-12 06:59
1,0,å¬å¸,"/news,000936,1330126098.html",è¡åYKOsog,07-12 06:58
6,0,æå¤©å°±ç30æ¥åçº¿è½ä¸è½æ¯æä½ï¼æ¯æä¸ä½ï¼å°±å¾ç60æ¥åçº¿ãä¸ªäººè§ç¹,"/news,000936,1330126074.html",æ åå¤ªé³2349,07-12 06:58
8,0,æ­»åå½¢æï¼çå°10ä»¥ä¸ï¼ç¶åå¯ä»¥åæ¹ä¹°å¥,"/news,000936,1330125874.html",æ£é±ä¹°å¥å¥,07-12 06:57
10,0,ä¸è¦æï¼ä¸è¦æï¼æå¤©è¦åå¤§èäº[å²ç],"/news,000936,1330125615.html",å¤©å¤©è¢«å²å°é­è11,07-12 06:56
635,9,å¼çåæçï¼æ²¡æ³åå¸ï¼ççå¯¹ä¸ä½å¤§å®¶ï¼[å­],"/news,000936,1329959796.html",ç¹ç³æéææ,07-12 01:30
239,1,åè¥¿è¡ä»½ãä¸­å½é¿åè·åï¼ååºç§æè·è¶10%ï¼é¸¿åè¡ä»½è·³æ°´è·è¶7%ï¼æµªæ½®ä¿¡æ¯ãå·¥ä¸,"/news,000936,1330101420.html",å¿é£ç¬,07-12 05:19
65,0,ä¸ä¸ªå°æ£çåè¥¿ä¸å¹´,//caifuhao.eastmoney.com/news/20230712185446402918620,é²é±èµç¹éé±,07-12 06:54
106,4,6æ29å·å²é«åºæ¥äºï¼ç¬¬äºå¤©æ¶¨ä¹æ²¡æè¿å»ãå½æ¶å°±æè§è¿ä¸ªè¡åä¸å²ä¸çªï¼éåºä¸äºã,"/news,000936,1330110010.html",å¡è¶å¶ååä»·éå®,07-12 05:51
1272,10,åè¥¿è¡ä»½ï¼23å¹´å¨çé¢ååæ¨¡åï¼ç´¢å°æï¼å¤§æ¦çå¹¶è¡¨ï½çæ¶¨30å,"/news,000936,1328252492.html",å©·å©·çç«618,07-06 06:24
2323,17,èµ°ä¸çï¼æ¬è¯·æå¾äº,//caifuhao.eastmoney.com/news/20230712105202411119200,éæ¥ææ¶¨é£,07-12 10:52
