read amount,comments,title,content link,author,create time
204,0,通威股份07月12日被沪股通减持89.05万股,"/news,600438,1330233360.html",通威股份资讯,07-13 08:38
165,2,通威股份：融资净买入4339.82万元，融资余额57.69亿元（07-12）,"/news,600438,1330222371.html",通威股份资讯,07-13 07:32
309,3,通威股份07月11日获沪股通增持207.46万股,"/news,600438,1329736407.html",通威股份资讯,07-12 08:29
238,3,通威股份：融资余额57.26亿元，创近一年新低（07-11）,"/news,600438,1329728051.html",通威股份资讯,07-12 07:27
354,1,通威股份07月10日获沪股通增持1372.82万股,"/news,600438,1329300775.html",通威股份资讯,07-11 08:08
235,2,通威股份：融资余额57.46亿元，创近一年新低（07-10）,"/news,600438,1329295276.html",通威股份资讯,07-11 07:30
220,4,通威股份7月10日盘中涨幅达5%,"/news,600438,1328970250.html",通威股份资讯,07-10 10:01
110,0,通威股份本周融资净买入894.51万元，居光伏设备板块第十八,"/news,600438,1328841768.html",大眼看两融,07-09 03:06
151,0,通威股份本周沪股通持股市值增加8434.35万元，居光伏设备板块第六,"/news,600438,1328836629.html",胖猫周周见,07-09 02:13
528,3,通威股份07月07日获沪股通增持40.8万股,"/news,600438,1328765069.html",通威股份资讯,07-08 09:04
223,2,通威股份：融资净偿还1243.52万元，融资余额57.83亿元（07-07）,"/news,600438,1328758794.html",通威股份资讯,07-08 07:34
166,0,通威股份07月06日被沪股通减持39.89万股,"/news,600438,1328374138.html",通威股份资讯,07-07 08:44
139,0,通威股份：融资净偿还1492.82万元，融资余额57.95亿元（07-06）,"/news,600438,1328364000.html",通威股份资讯,07-07 07:30
5716,2,通威股份07月05日获沪股通增持120.22万股,"/news,600438,1327920587.html",通威股份资讯,07-06 09:07
232,1,通威股份：连续3日融资净买入累计3630.85万元（07-05）,"/news,600438,1327903841.html",通威股份资讯,07-06 07:28
290,3,通威股份07月04日获沪股通增持171.94万股,"/news,600438,1327463099.html",通威股份资讯,07-05 09:00
159,0,通威股份：融资净买入84.22万元，融资余额58.02亿元（07-04）,"/news,600438,1327448183.html",通威股份资讯,07-05 07:30
22124,30,通威股份：第二季度“通22转债”转股约1.20万股，累计转股约41.96万股,"/news,600438,1327301800.html",通威股份资讯,07-04 04:01
205,1,通威股份07月03日被沪股通减持38.6万股,"/news,600438,1327003025.html",通威股份资讯,07-04 08:44
172,0,通威股份：融资净买入2676.06万元，融资余额58.01亿元（07-03）,"/news,600438,1326992381.html",通威股份资讯,07-04 07:31
249,0,通威股份本周融资净偿还1.07亿元，居光伏设备板块第一,"/news,600438,1326464573.html",大眼看两融,07-02 03:06
3175,0,通威股份本周被沪股通减持15.4万股 最新持股量1.81亿股,"/news,600438,1326459138.html",胖猫周周见,07-02 02:13
35597,113,硅料价格高位狂泻80%！个别厂商亏损停产 光伏通吃的通威肚子里还有多少“料”？,"/news,600438,1326378090.html",通威股份资讯,07-01 09:51
346,0,通威股份06月30日获沪股通增持305.55万股,"/news,600438,1326370484.html",通威股份资讯,07-01 07:58
189,0,通威股份：连续21日融资净偿还累计9.93亿元（06-30）,"/news,600438,1326366820.html",通威股份资讯,07-01 07:30
2258,14,大宗交易：通威股份成交302.18万元，折价0.03%（06-30）,"/news,600438,1326277278.html",通威股份资讯,06-30 05:17
267,2,通威股份06月29日被沪股通减持172.54万股,"/news,600438,1325938722.html",通威股份资讯,06-30 08:04
151,0,通威股份：连续20日融资净偿还累计9.52亿元（06-29）,"/news,600438,1325933084.html",通威股份资讯,06-30 07:31
167,0,通威股份：连续19日融资净偿还累计9.45亿元（06-28）,"/news,600438,1325477157.html",通威股份资讯,06-29 07:29
4207,31,通威股份：公司有充足信心能够有效应对产业链价格波动,"/news,600438,1325347963.html",通威股份资讯,06-28 04:44
1695,10,通威股份：有充足信心能够有效应对产业链价格波动,"/news,600438,1325293261.html",通威股份资讯,06-28 02:31
2828,34,通威股份：公司有充足信心能够有效应对产业链价格波动,"/news,600438,1325291614.html",通威股份资讯,06-28 02:29
367,2,通威股份06月27日被沪股通减持235.33万股,"/news,600438,1325007552.html",通威股份资讯,06-28 07:59
166,0,通威股份：连续18日融资净偿还累计9.33亿元（06-27）,"/news,600438,1325003189.html",通威股份资讯,06-28 07:33
280,1,通威股份06月26日获沪股通增持103.69万股,"/news,600438,1324572723.html",通威股份资讯,06-27 07:52
142,0,通威股份：连续17日融资净偿还累计9.05亿元（06-26）,"/news,600438,1324569377.html",通威股份资讯,06-27 07:30
3325,16,西南首家GW级光伏组件工厂首件下线 通威股份推进一体化布局,"/news,600438,1324490196.html",通威股份资讯,06-26 08:13
5030,22,通威集团：西南首家GW级光伏组件工厂首件下线,"/news,600438,1324059608.html",通威股份资讯,06-25 10:23
310,1,通威股份本周融资净偿还5621.01万元，居光伏设备板块第二,"/news,600438,1323974154.html",大眼看两融,06-25 03:04
269,1,通威股份：连续16日融资净偿还累计8.85亿元（06-21）,"/news,600438,1323734322.html",通威股份资讯,06-22 08:03
912,7,通威股份06月21日获沪股通增持568.71万股,"/news,600438,1323731633.html",通威股份资讯,06-22 07:42
204,1,通威股份06月20日获沪股通增持86.48万股,"/news,600438,1323261508.html",通威股份资讯,06-21 08:02
112,0,通威股份：连续15日融资净偿还累计8.59亿元（06-20）,"/news,600438,1323254216.html",通威股份资讯,06-21 07:28
2718,13,两大光伏龙头专利诉讼引关注 通威股份称无法表明公司侵权,"/news,600438,1323242999.html",通威股份资讯,06-21 04:04
1456,6,叠瓦专利再起争端 通威股份否认子公司产品侵权,"/news,600438,1323202168.html",通威股份资讯,06-20 10:09
1026,1,通威股份回应子公司被诉专利侵权：尚无法表明相关产品侵犯Maxeon方专利,"/news,600438,1323174194.html",通威股份资讯,06-20 08:25
13985,21,两大光伏龙头专利诉讼最新进展来了！通威股份：目前资料尚无法表明公司产品侵权,"/news,600438,1323164769.html",通威股份资讯,06-20 07:49
1581,11,通威股份针对子公司收到专利侵权诉讼发布声明,"/news,600438,1323155277.html",通威股份资讯,06-20 07:09
3022,19,子公司相关产品侵犯Maxeon方相关欧洲专利？通威股份：目前资料不支持 公司已积极应诉,"/news,600438,1323155603.html",通威股份资讯,06-20 07:08
504,2,通威股份：目前暂无证据表明公司侵犯了Maxeon方有关专利,"/news,600438,1323151964.html",通威股份资讯,06-20 06:56
3678,18,被TCL中环参股公司起诉 通威股份发长文回应：目前资料尚无法表明公司产品侵权,"/news,600438,1323148445.html",通威股份资讯,06-20 06:38
4612,58,通威股份发布关于子公司收到专利侵权诉讼的声明,"/news,600438,1323142933.html",通威股份资讯,06-20 06:16
529,4,通威股份：目前资料尚无法表明公司相关产品侵犯Maxeon方相关欧洲专利,"/news,600438,1323138959.html",通威股份资讯,06-20 06:05
1068,1,通威股份发布声明：目前资料尚无法表明公司相关产品侵犯Maxeon方欧洲专利,"/news,600438,1323138261.html",通威股份资讯,06-20 06:02
360,1,通威股份：目前资料尚无法表明公司相关产品侵犯Maxeon方欧洲专利,"/news,600438,1323137506.html",通威股份资讯,06-20 06:00
4857,15,通威股份：2022年公司饲料总销量719.40万吨 同比增长30.42%,"/news,600438,1323116676.html",通威股份资讯,06-20 04:37
7039,17,通威股份：公司已分别在云南保山市龙陵县和包头达尔罕茂明安联合旗各规划30万吨工业硅项目,"/news,600438,1323110559.html",通威股份资讯,06-20 04:17
260,1,通威股份06月19日获沪股通增持59.31万股,"/news,600438,1322759798.html",通威股份资讯,06-20 08:04
183,1,通威股份：连续14日融资净偿还累计8.42亿元（06-19）,"/news,600438,1322754283.html",通威股份资讯,06-20 07:30
283,1,通威股份本周融资净偿还2.85亿元，两市排名第六,"/news,600438,1322206829.html",大眼看两融,06-18 03:07
263,0,通威股份本周获沪股通增持3.72亿元，周内增持市值两市排名第20,"/news,600438,1322201186.html",胖猫周周见,06-18 02:08
462,1,通威股份06月16日获沪股通增持583.97万股,"/news,600438,1322100045.html",通威股份资讯,06-17 08:03
256,0,通威股份：融资净偿还1.28亿元，两市排名第一（06-16）,"/news,600438,1322095498.html",通威股份资讯,06-17 07:29
9676,69,2013.76亿元！通威品牌价值再创新高 让世界看见中国光伏品牌力量,"/news,600438,1321968067.html",通威股份资讯,06-16 03:31
2266,8,被诉侵权？通威股份：暂无证据表明公司存在侵犯有关专利的情形,"/news,600438,1321964946.html",通威股份资讯,06-16 03:23
2842,16,通威股份回应TCL中环就组件专利起诉事项：对公司影响有限 尚未达到披露标准,"/news,600438,1321827317.html",通威股份资讯,06-16 12:26
6218,70,通威股份回应叠瓦组件专利涉诉事项：对公司影响很小 已聘请当地律师积极应诉,"/news,600438,1321766929.html",通威股份资讯,06-16 10:47
275,1,通威股份06月15日获沪股通增持574.32万股,"/news,600438,1321625871.html",通威股份资讯,06-16 07:58
127,0,通威股份：连续12日融资净偿还累计7.02亿元（06-15）,"/news,600438,1321620745.html",通威股份资讯,06-16 07:31
13388,79,两大光伏巨头“打起来了”！到底什么情况？,"/news,600438,1321603032.html",通威股份资讯,06-16 12:07
87443,113,两大光伏巨头突然“开战” 影响多大？新能源久违大反弹 能否逆转？,"/news,600438,1321578858.html",通威股份资讯,06-15 10:21
4444,44,TCL中环参股公司对通威太阳能提起专利侵权诉讼,"/news,600438,1321573955.html",通威股份资讯,06-15 10:07
7263,43,通威股份：去年以来小尺寸电池片市场份额缩小 盈利能力持续下降,"/news,600438,1321509629.html",通威股份资讯,06-15 06:09
2096,15,通威股份：暂未开展“晶体生长研发”相关项目,"/news,600438,1321435935.html",通威股份资讯,06-15 02:43
1415,5,通威股份：公司暂未开展“晶体生长研发”相关项目,"/news,600438,1321408609.html",通威股份资讯,06-15 02:11
2328,29,通威股份：公司暂未开展“晶体生长研发”相关项目,"/news,600438,1321393830.html",通威股份资讯,06-15 02:01
101,0,通威股份6月15日盘中涨幅达5%,"/news,600438,1321377936.html",通威股份资讯,06-15 01:49
181,0,通威股份06月14日被沪股通减持110.13万股,"/news,600438,1321109692.html",通威股份资讯,06-15 08:01
3171,16,通威股份：截至目前暂未出口美国,"/news,600438,1321108222.html",通威股份资讯,06-15 07:50
137,1,通威股份：连续11日融资净偿还累计6.61亿元（06-14）,"/news,600438,1321104374.html",通威股份资讯,06-15 07:32
282,1,通威股份06月13日获沪股通增持21.94万股,"/news,600438,1320600875.html",通威股份资讯,06-14 07:58
155,0,通威股份：连续10日融资净偿还累计6.42亿元（06-13）,"/news,600438,1320596132.html",通威股份资讯,06-14 07:31
330,0,通威股份06月12日获沪股通增持44.98万股,"/news,600438,1320119202.html",通威股份资讯,06-13 07:56
252,2,通威股份：融资净偿还7467.63万元，两市排名第12（06-12）,"/news,600438,1320114857.html",通威股份资讯,06-13 07:31
197,1,通威股份本周融资净偿还1.68亿元，两市排名第16,"/news,600438,1319570718.html",大眼看两融,06-11 03:06
170,0,通威股份本周沪股通持股市值增加1.8亿元，居光伏设备板块第三,"/news,600438,1319564449.html",胖猫周周见,06-11 02:06
462,3,通威股份06月09日获沪股通增持399.14万股,"/news,600438,1319468000.html",通威股份资讯,06-10 07:55
232,2,通威股份：连续8日融资净偿还累计5.44亿元（06-09）,"/news,600438,1319464360.html",通威股份资讯,06-10 07:31
4334,48,通威股份：公司目前高效太阳能电池产能超过70GW,"/news,600438,1319356359.html",通威股份资讯,06-09 04:26
6339,48,通威股份：公司硅料成交价处于行业上游水平 正通过一体化布局提升盈利能,"/news,600438,1319225032.html",通威股份资讯,06-09 01:22
160,0,通威股份06月08日被沪股通减持74.88万股,"/news,600438,1318978735.html",通威股份资讯,06-09 07:43
182,2,通威股份：融资净偿还7250.22万元，两市排名第15（06-08）,"/news,600438,1318976082.html",通威股份资讯,06-09 07:28
48440,175,重回低位！光伏多晶硅均价跌破10万元,"/news,600438,1318900292.html",通威股份资讯,06-08 07:42
245,4,通威股份06月07日被沪股通减持23.83万股,"/news,600438,1318483272.html",通威股份资讯,06-08 07:54
1019,5,华福证券维持通威股份买入评级 目标价52.36元,"/news,600438,1318480092.html",公司研报提示,06-08 07:37
123,1,通威股份：连续6日融资净偿还累计4.43亿元（06-07）,"/news,600438,1318479057.html",通威股份资讯,06-08 07:30
2556,6,光伏巨头开启新一轮产能“竞赛” 通威股份超百亿投建25GW光伏电池暨20GW光伏组件项目,"/news,600438,1318445410.html",通威股份资讯,06-07 10:05
8231,44,一边产能过剩一边大规模扩产 通威、隆基两大龙头同日宣布继续扩产,"/news,600438,1318414006.html",通威股份资讯,06-07 08:00
18261,52,产能过剩风雨欲来 四大千亿光伏龙头却集体执意扩产 有何动机？,"/news,600438,1318334651.html",通威股份资讯,06-07 02:58
274,3,通威股份06月06日获沪股通增持399.88万股,"/news,600438,1318010285.html",通威股份资讯,06-07 07:52
175,2,通威股份：连续5日融资净偿还累计4.29亿元（06-06）,"/news,600438,1318006195.html",通威股份资讯,06-07 07:32
3357,48,通威股份：拟105亿投建太阳能电池暨光伏组件项目,"/news,600438,1318002849.html",通威股份资讯,06-07 06:57
79119,196,狂砸百亿扩产！两大千亿光伏龙头同日宣布,"/news,600438,1317980830.html",通威股份资讯,06-06 11:30
55060,244,什么信号？又有两家千亿光伏巨头同时掷出百亿投资计划,"/news,600438,1317959144.html",通威股份资讯,06-06 10:01
5981,54,光伏重磅！千亿龙头大手笔扩产 A股开盘见,"/news,600438,1317940171.html",通威股份资讯,06-06 08:50
4993,41,豪掷超百亿！1500亿全球硅料龙头加码太阳能电池与组件项目 全年盈利预测却遭机构下修,"/news,600438,1317937395.html",通威股份资讯,06-06 08:26
2019,13,百亿投向中下游！通威股份进军组件不到一年 规划产能已达100GW,"/news,600438,1317922190.html",通威股份资讯,06-06 07:58
1863,11,105亿元！通威股份宣布拟投建年产25GW电池和20GW光伏组件项目,"/news,600438,1317904899.html",通威股份资讯,06-06 07:10
2062,28,通威股份：拟105亿元投建年产25GW太阳能电池暨20GW光伏组件项目,"/news,600438,1317868419.html",通威股份资讯,06-06 05:07
3689,56,通威股份：拟105亿元在成都投建年产25GW太阳能电池暨20GW光伏组件项目,"/news,600438,1317867316.html",通威股份资讯,06-06 05:04
50889,277,通威股份：拟投建年产25GW太阳能电池暨20GW光伏组件项目,"/news,600438,1317865414.html",通威股份资讯,06-06 04:56
324,0,通威股份06月05日被沪股通减持132.31万股,"/news,600438,1317487026.html",通威股份资讯,06-06 08:02
207,0,通威股份：连续4日融资净偿还累计3.87亿元（06-05）,"/news,600438,1317481758.html",通威股份资讯,06-06 07:34
358,2,通威股份股价创逾13个月新低,"/news,600438,1317343903.html",数据快报,06-05 03:36
185,0,通威股份本周融资净偿还3.44亿元，两市排名第二,"/news,600438,1316969697.html",大眼看两融,06-04 03:07
273,2,通威股份本周沪股通持股市值减少1.21亿元，居光伏设备板块第三,"/news,600438,1316963874.html",胖猫周周见,06-04 02:08
503,2,通威股份06月02日获沪股通增持185.8万股,"/news,600438,1316879931.html",通威股份资讯,06-03 07:55
328,3,通威股份：连续3日融资净偿还累计3.76亿元（06-02）,"/news,600438,1316876169.html",通威股份资讯,06-03 07:28
265,0,通威股份06月01日获沪股通增持32.73万股,"/news,600438,1316371742.html",通威股份资讯,06-02 08:00
256,1,通威股份：融资净偿还9531.36万元，两市排名第五（06-01）,"/news,600438,1316365316.html",通威股份资讯,06-02 07:26
8373,16,通威股份大宗交易成交1788.41万元,"/news,600438,1316274645.html",通威股份资讯,06-01 08:13
3544,9,大宗交易：通威股份成交1788.41万元，成交价33.68元（06-01）,"/news,600438,1316225520.html",通威股份资讯,06-01 05:25
516,5,XD通威股：融资净偿还2.3亿元，两市排名第一（05-31）,"/news,600438,1315801572.html",通威股份资讯,06-01 07:32
387,0,通威股份05月30日被沪股通减持297.31万股,"/news,600438,1315117314.html",通威股份资讯,05-31 07:56
297,2,通威股份：融资净买入579.41万元，融资余额67.67亿元（05-30）,"/news,600438,1315112357.html",通威股份资讯,05-31 07:29
677,0,通威股份股价创近1年新低,"/news,600438,1314978964.html",数据快报,05-30 03:38
455,0,通威股份05月29日被沪股通减持216.38万股,"/news,600438,1314617197.html",通威股份资讯,05-30 08:01
290,0,通威股份：融资净买入2651.27万元，融资余额67.61亿元（05-29）,"/news,600438,1314611583.html",通威股份资讯,05-30 07:28
5528,18,上市公司高管薪酬榜出炉！第一名是他…,"/news,600438,1314418351.html",通威股份资讯,05-29 02:25
13670,33,董事长年薪，最高4236万元！最新排行来了,"/news,600438,1314210189.html",通威股份资讯,05-29 10:06
6741,17,通威股份、三一重能……年薪八千万的上市公司薪酬王出自哪家,"/news,600438,1314103723.html",通威股份资讯,05-28 11:13
3698,32,通威集团董事局主席刘汉元：一体化是行业发展方向 仍重视专业化分工,"/news,600438,1314082459.html",通威股份资讯,05-28 06:52
300,0,通威股份本周融资净偿还4655.53万元，居光伏设备板块第五,"/news,600438,1314051559.html",大眼看两融,05-28 03:07
425,1,通威股份本周沪股通持股市值增加1.61亿元，居光伏设备板块第五,"/news,600438,1314045291.html",胖猫周周见,05-28 02:08
32104,77,SNEC光伏展网络被挤爆！龙头新品“掰手腕”、储能同场竞技 盛况能持续多久？,"/news,600438,1313969678.html",通威股份资讯,05-27 03:33
6108,62,通威太阳能盐城基地25GW光伏首件组件顺利下线,"/news,600438,1313952616.html",通威股份资讯,05-27 10:19
355,0,通威股份：连续3日融资净偿还累计7362.82万元（05-26）,"/news,600438,1313941565.html",通威股份资讯,05-27 07:28
5613,37,持续“出海” 通威股份获颁首张海上光伏组件认证证书,"/news,600438,1313818533.html",通威股份资讯,05-26 03:30
332,1,通威股份05月25日获沪股通增持39.78万股,"/news,600438,1313464793.html",通威股份资讯,05-26 08:00
7449,61,通威与中国电建集团国际工程等公司签订战略合作协议,"/news,600438,1313474875.html",通威股份资讯,05-26 07:47
7734,37,通威与海兴电力签署500MW框架协议,"/news,600438,1313462905.html",通威股份资讯,05-26 07:47
310,3,通威股份：融资净偿还4270.57万元，融资余额67.46亿元（05-25）,"/news,600438,1313458741.html",通威股份资讯,05-26 07:28
3836,12,对话通威集团董事局主席刘汉元：一体化是趋势 仍强调专业化分工,"/news,600438,1313349739.html",通威股份资讯,05-25 05:47
25357,46,通威组件开始猛发力 创始人刘汉元谈光伏一体化趋势,"/news,600438,1313181026.html",通威股份资讯,05-25 12:38
419,2,通威股份05月24日获沪股通增持165.51万股,"/news,600438,1312950975.html",通威股份资讯,05-25 07:56
269,3,通威股份：融资净偿还1953.96万元，融资余额67.88亿元（05-24）,"/news,600438,1312945925.html",通威股份资讯,05-25 07:29
311,0,通威股份05月23日获沪股通增持44.1万股,"/news,600438,1312467308.html",通威股份资讯,05-24 08:03
235,0,通威股份：融资净买入3894.05万元，融资余额68.08亿元（05-23）,"/news,600438,1312459115.html",通威股份资讯,05-24 07:25
555,4,通威股份05月22日获沪股通增持168.46万股,"/news,600438,1311989441.html",通威股份资讯,05-23 07:57
293,3,通威股份：融资净偿还1186.76万元，融资余额67.69亿元（05-22）,"/news,600438,1311984499.html",通威股份资讯,05-23 07:33
8906,35,通威THC组件功率今年第三次刷新纪录,"/news,600438,1311961086.html",通威股份资讯,05-22 11:07
317,0,通威股份本周融资净偿还6969.04万元，居光伏设备板块第二,"/news,600438,1311447137.html",大眼看两融,05-21 03:05
408,0,通威股份本周沪股通持股市值减少3793.75万元，居光伏设备板块第四,"/news,600438,1311441934.html",胖猫周周见,05-21 02:08
476,0,通威股份05月19日被沪股通减持26.69万股,"/news,600438,1311349796.html",通威股份资讯,05-20 07:56
402,0,通威股份：融资净买入255.79万元，融资余额67.81亿元（05-19）,"/news,600438,1311345826.html",通威股份资讯,05-20 07:34
267,1,通威股份05月18日被沪股通减持219.82万股,"/news,600438,1310873914.html",通威股份资讯,05-19 08:02
329,4,通威股份：融资净买入4623.83万元，融资余额67.78亿元（05-18）,"/news,600438,1310866443.html",通威股份资讯,05-19 07:27
376,1,通威股份05月17日被沪股通减持141.82万股,"/news,600438,1310366376.html",通威股份资讯,05-18 07:52
270,0,通威股份：融资净偿还5659.47万元，两市排名第16（05-17）,"/news,600438,1310361768.html",通威股份资讯,05-18 07:27
328,0,通威股份05月16日获沪股通增持41.1万股,"/news,600438,1309901339.html",通威股份资讯,05-17 07:58
243,0,通威股份：连续4日融资净偿还累计9188.76万元（05-16）,"/news,600438,1309893402.html",通威股份资讯,05-17 07:26
466,0,通威股份05月15日获沪股通增持245.54万股,"/news,600438,1309431130.html",通威股份资讯,05-16 08:02
335,0,通威股份：连续3日融资净偿还累计6539.77万元（05-15）,"/news,600438,1309423844.html",通威股份资讯,05-16 07:26
337,0,通威股份本周融资净买入575.58万元，居光伏设备板块第十,"/news,600438,1308872740.html",大眼看两融,05-14 03:06
378,0,通威股份本周沪股通持股市值减少1.07亿元，居光伏设备板块第四,"/news,600438,1308866162.html",胖猫周周见,05-14 02:06
6842,22,肇庆市人民政府副市长刘泾波一行莅临通威考察交流,"/news,600438,1308844290.html",通威股份资讯,05-14 07:53
619,3,通威股份05月12日被沪股通减持38.81万股,"/news,600438,1308746233.html",通威股份资讯,05-13 08:04
403,0,通威股份：融资净偿还1408.75万元，融资余额68.5亿元（05-12）,"/news,600438,1308741787.html",通威股份资讯,05-13 07:32
321,4,通威股份：融资净偿还1590.82万元，融资余额68.65亿元（05-11）,"/news,600438,1308266185.html",通威股份资讯,05-12 07:26
704,2,浙商证券维持通威股份买入评级 预计2023年净利润同比减少21.19%,"/news,600438,1308162258.html",公司研报提示,05-11 06:45
635,7,通威股份05月10日被沪股通减持267.59万股,"/news,600438,1307773761.html",通威股份资讯,05-11 07:52
318,0,通威股份：融资净买入4184.51万元，融资余额68.8亿元（05-10）,"/news,600438,1307767670.html",通威股份资讯,05-11 07:26
490,0,通威股份05月09日获沪股通增持94.51万股,"/news,600438,1307266921.html",通威股份资讯,05-10 08:03
288,0,通威股份：融资净偿还4115.25万元，融资余额68.39亿元（05-09）,"/news,600438,1307260171.html",通威股份资讯,05-10 07:28
431,1,通威股份05月08日被沪股通减持62.78万股,"/news,600438,1306714741.html",通威股份资讯,05-09 07:51
276,0,通威股份：融资净买入3505.88万元，融资余额68.8亿元（05-08）,"/news,600438,1306708620.html",通威股份资讯,05-09 07:26
342,0,中银证券维持通威股份买入评级 预计2023年净利润同比减少22.63%,"/news,600438,1306446620.html",公司研报提示,05-08 01:12
523,2,通威股份05月05日被沪股通减持118.57万股,"/news,600438,1305995075.html",通威股份资讯,05-06 07:53
322,0,通威股份：融资净买入2643.81万元，融资余额68.45亿元（05-05）,"/news,600438,1305991509.html",通威股份资讯,05-06 07:28
6799,25,摸底上市公司高管薪酬：通威股份“最壕” 部分房企年薪砍半,"/news,600438,1305944325.html",通威股份资讯,05-05 09:45
799,2,长城证券维持通威股份买入评级 预计2023年净利润同比减少12.44%,"/news,600438,1305879759.html",公司研报提示,05-05 05:18
595,4,招商证券维持通威股份强烈推荐评级 预计2023年净利润同比减少16.48%,"/news,600438,1305757569.html",公司研报提示,05-05 01:26
371,0,通威股份05月04日被沪股通减持207.63万股,"/news,600438,1305509826.html",通威股份资讯,05-05 07:57
214,0,通威股份：融资净偿还455.36万元，融资余额68.18亿元（05-04）,"/news,600438,1305504147.html",通威股份资讯,05-05 07:28
568,4,国盛证券维持通威股份增持评级 预计2023年净利润同比减少13.21%,"/news,600438,1305367971.html",公司研报提示,05-04 05:45
8618,39,通威股份于内蒙古投资设立绿色基材新公司,"/news,600438,1305287806.html",通威股份资讯,05-04 02:21
