read amount,comments,title,content link,author,create time
77,0,大全能源07月12日被沪股通减持12.16万股,"/news,688303,1330245630.html",大全能源资讯,07-13 09:21
79,0,大全能源：融资余额10.71亿元，创近一年新低（07-12）,"/news,688303,1330225148.html",大全能源资讯,07-13 07:47
139,2,大全能源07月11日被沪股通减持45.68万股,"/news,688303,1329760653.html",大全能源资讯,07-12 09:31
98,0,大全能源：融资余额10.75亿元，创近一年新低（07-11）,"/news,688303,1329729880.html",大全能源资讯,07-12 07:38
153,1,大全能源07月10日获沪股通增持26.83万股,"/news,688303,1329315738.html",大全能源资讯,07-11 09:22
112,0,大全能源：融资余额10.79亿元，创近一年新低（07-10）,"/news,688303,1329296753.html",大全能源资讯,07-11 07:41
128,0,大全能源本周融资净偿还1783.05万元，居光伏设备板块第七,"/news,688303,1328840826.html",大眼看两融,07-09 03:04
124,0,大全能源本周获沪股通增持22.05万股 最新持股量2099.99万股,"/news,688303,1328835877.html",胖猫周周见,07-09 02:11
174,0,大全能源07月07日被沪股通减持29.84万股,"/news,688303,1328767386.html",大全能源资讯,07-08 09:34
91,0,大全能源：连续4日融资净偿还累计1834.99万元（07-07）,"/news,688303,1328760331.html",大全能源资讯,07-08 07:47
123,1,大全能源07月06日被沪股通减持15.8万股,"/news,688303,1328410568.html",大全能源资讯,07-07 09:39
88,0,大全能源：连续3日融资净偿还累计811.03万元（07-06）,"/news,688303,1328365407.html",大全能源资讯,07-07 07:39
215,0,大全能源07月05日获沪股通增持73.79万股,"/news,688303,1327951211.html",大全能源资讯,07-06 09:38
81,0,大全能源：融资净偿还185.45万元，融资余额11.01亿元（07-05）,"/news,688303,1327907219.html",大全能源资讯,07-06 07:46
99,1,大全能源07月04日被沪股通减持7.68万股,"/news,688303,1327476631.html",大全能源资讯,07-05 09:29
74,0,大全能源：融资净偿还316.16万元，融资余额11.03亿元（07-04）,"/news,688303,1327450479.html",大全能源资讯,07-05 07:42
97,0,大全能源：融资净买入51.93万元，融资余额11.06亿元（07-03）,"/news,688303,1326993477.html",大全能源资讯,07-04 07:38
96,0,大全能源本周融资净偿还675.23万元，居光伏设备板块第十三,"/news,688303,1326463578.html",大眼看两融,07-02 03:04
75,0,大全能源本周沪股通持股市值减少3806.46万元，居光伏设备板块第十,"/news,688303,1326458567.html",胖猫周周见,07-02 02:11
230,0,大全能源06月30日获沪股通增持10.88万股,"/news,688303,1326372696.html",大全能源资讯,07-01 08:14
100,0,大全能源：融资净偿还1011.92万元，融资余额11.05亿元（06-30）,"/news,688303,1326368660.html",大全能源资讯,07-01 07:44
114,0,大全能源06月29日被沪股通减持27.28万股,"/news,688303,1325941199.html",大全能源资讯,06-30 08:16
70,0,大全能源：融资净买入616.08万元，融资余额11.15亿元（06-29）,"/news,688303,1325934891.html",大全能源资讯,06-30 07:42
131,0,大全能源06月28日获沪股通增持2.23万股,"/news,688303,1325483675.html",大全能源资讯,06-29 08:09
64,0,大全能源：融资净偿还189.75万元，融资余额11.09亿元（06-28）,"/news,688303,1325479623.html",大全能源资讯,06-29 07:45
145,1,大全能源06月27日被沪股通减持57.74万股,"/news,688303,1325009815.html",大全能源资讯,06-28 08:11
54,0,大全能源：融资净买入28.33万元，融资余额11.11亿元（06-27）,"/news,688303,1325004300.html",大全能源资讯,06-28 07:40
141,2,大全能源06月26日被沪股通减持22.51万股,"/news,688303,1324575962.html",大全能源资讯,06-27 08:11
80,0,大全能源：融资净偿还117.98万元，融资余额11.11亿元（06-26）,"/news,688303,1324574739.html",大全能源资讯,06-27 08:04
124,0,大全能源本周融资净偿还1096.26万元，居光伏设备板块第九,"/news,688303,1323973342.html",大眼看两融,06-25 03:03
118,1,大全能源：融资净买入117.97万元，融资余额11.12亿元（06-21）,"/news,688303,1323735890.html",大全能源资讯,06-22 08:14
235,1,大全能源06月21日获沪股通增持13.47万股,"/news,688303,1323733825.html",大全能源资讯,06-22 07:59
153,0,大全能源06月20日获沪股通增持17.78万股,"/news,688303,1323263636.html",大全能源资讯,06-21 08:11
80,0,大全能源：融资净买入210.01万元，融资余额11.11亿元（06-20）,"/news,688303,1323256863.html",大全能源资讯,06-21 07:40
172,0,大全能源06月19日被沪股通减持12.04万股,"/news,688303,1322761787.html",大全能源资讯,06-20 08:14
84,0,大全能源：融资净偿还1424.24万元，融资余额11.09亿元（06-19）,"/news,688303,1322758230.html",大全能源资讯,06-20 07:54
88,0,大全能源本周融资净偿还3624.39万元，居光伏设备板块第十三,"/news,688303,1322205201.html",大眼看两融,06-18 03:04
139,1,大全能源本周沪股通持股市值减少6943.52万元，居光伏设备板块第三,"/news,688303,1322200204.html",胖猫周周见,06-18 02:05
246,0,大全能源06月16日获沪股通增持34.04万股,"/news,688303,1322101055.html",大全能源资讯,06-17 08:10
96,0,大全能源：融资净偿还1023.86万元，融资余额11.23亿元（06-16）,"/news,688303,1322097333.html",大全能源资讯,06-17 07:43
140,0,大全能源06月15日被沪股通减持26.97万股,"/news,688303,1321626837.html",大全能源资讯,06-16 08:03
84,0,大全能源：融资净买入490.05万元，融资余额11.33亿元（06-15）,"/news,688303,1321624845.html",大全能源资讯,06-16 07:53
150,0,大全能源06月14日获沪股通增持4.34万股,"/news,688303,1321111150.html",大全能源资讯,06-15 08:08
84,0,大全能源：连续33日融资净偿还累计4.18亿元（06-14）,"/news,688303,1321106192.html",大全能源资讯,06-15 07:42
1630,6,大宗交易：机构账户买入大全能源1389.76万元（06-14）,"/news,688303,1320988712.html",大全能源资讯,06-14 05:17
163,0,大全能源06月13日获沪股通增持24.29万股,"/news,688303,1320602529.html",大全能源资讯,06-14 08:05
105,1,大全能源：连续32日融资净偿还累计4.05亿元（06-13）,"/news,688303,1320599014.html",大全能源资讯,06-14 07:47
1406,9,大宗交易：大全能源成交2000.17万元，折价0.60%（06-13）,"/news,688303,1320479252.html",大全能源资讯,06-13 05:17
236,1,大全能源06月12日被沪股通减持190.29万股,"/news,688303,1320120069.html",大全能源资讯,06-13 08:01
76,0,大全能源：连续31日融资净偿还累计3.98亿元（06-12）,"/news,688303,1320116518.html",大全能源资讯,06-13 07:41
1290,5,大宗交易：大全能源成交2946.55万元，折价0.70%（06-12）,"/news,688303,1319996850.html",大全能源资讯,06-12 05:17
128,0,大全能源本周融资净偿还6462.61万元，居光伏设备板块第三,"/news,688303,1319569764.html",大眼看两融,06-11 03:04
301,2,大全能源本周被沪股通减持4.22亿元，周内减持市值两市排名第十,"/news,688303,1319564009.html",胖猫周周见,06-11 02:05
973,6,大全能源06月09日被沪股通减持1067.49万股,"/news,688303,1319469840.html",大全能源资讯,06-10 08:07
130,0,大全能源：连续30日融资净偿还累计3.87亿元（06-09）,"/news,688303,1319465059.html",大全能源资讯,06-10 07:36
80,0,大全能源：连续29日融资净偿还累计3.47亿元（06-08）,"/news,688303,1318983347.html",大全能源资讯,06-09 08:07
152,0,大全能源06月08日被沪股通减持32.95万股,"/news,688303,1318980591.html",大全能源资讯,06-09 07:54
1867,9,大宗交易：机构账户买入大全能源2994.36万元（06-08）,"/news,688303,1318863783.html",大全能源资讯,06-08 05:22
109,0,大全能源：连续28日融资净偿还累计3.41亿元（06-07）,"/news,688303,1318481000.html",大全能源资讯,06-08 07:41
343,3,大全能源06月06日获沪股通增持74.34万股,"/news,688303,1318012885.html",大全能源资讯,06-07 08:05
101,0,大全能源：连续27日融资净偿还累计3.31亿元（06-06）,"/news,688303,1318007630.html",大全能源资讯,06-07 07:38
664,4,大全能源06月05日获沪股通增持77.83万股,"/news,688303,1317487001.html",大全能源资讯,06-06 08:02
109,1,大全能源：连续26日融资净偿还累计3.25亿元（06-05）,"/news,688303,1317483106.html",大全能源资讯,06-06 07:41
152,0,大全能源本周融资净偿还1.06亿元，居光伏设备板块第三,"/news,688303,1316968785.html",大眼看两融,06-04 03:05
233,0,大全能源本周获沪股通增持7.49亿元，周内增持市值两市排名第二,"/news,688303,1316962816.html",胖猫周周见,06-04 02:05
849,10,大全能源06月02日获沪股通增持287.74万股,"/news,688303,1316880914.html",大全能源资讯,06-03 08:02
257,1,大全能源：连续25日融资净偿还累计3.23亿元（06-02）,"/news,688303,1316878504.html",大全能源资讯,06-03 07:45
711,10,大全能源06月01日获沪股通增持271.73万股,"/news,688303,1316373271.html",大全能源资讯,06-02 08:07
264,0,大全能源：连续24日融资净偿还累计3.1亿元（06-01）,"/news,688303,1316367711.html",大全能源资讯,06-02 07:39
679,5,大全能源05月31日获沪股通增持683.49万股,"/news,688303,1315811677.html",大全能源资讯,06-01 08:06
278,0,大全能源：连续23日融资净偿还累计2.92亿元（05-31）,"/news,688303,1315803787.html",大全能源资讯,06-01 07:40
6339,24,新能源出现抗跌情绪，科华数据、大全能源升超2%,"/news,688303,1315247165.html",大全能源资讯,05-31 10:28
651,0,大全能源05月30日获沪股通增持325.3万股,"/news,688303,1315119698.html",大全能源资讯,05-31 08:09
211,1,大全能源：连续22日融资净偿还累计2.69亿元（05-30）,"/news,688303,1315114460.html",大全能源资讯,05-31 07:40
1802,5,大全能源05月29日获沪股通增持244.31万股,"/news,688303,1314619422.html",大全能源资讯,05-30 08:13
220,2,大全能源：连续21日融资净偿还累计2.38亿元（05-29）,"/news,688303,1314614587.html",大全能源资讯,05-30 07:46
43458,0,大全能源本周融资净偿还4804.93万元，居光伏设备板块第四,"/news,688303,1314050065.html",大眼看两融,05-28 03:04
364,0,大全能源本周获沪股通增持2.48亿元，周内增持市值两市排名第19,"/news,688303,1314044372.html",胖猫周周见,05-28 02:05
336,0,大全能源：连续20日融资净偿还累计2.16亿元（05-26）,"/news,688303,1313943537.html",大全能源资讯,05-27 07:43
643,6,大全能源05月25日获沪股通增持107.34万股,"/news,688303,1313466423.html",大全能源资讯,05-26 08:09
247,0,大全能源：连续19日融资净偿还累计2.09亿元（05-25）,"/news,688303,1313461599.html",大全能源资讯,05-26 07:43
450,5,大全能源05月24日获沪股通增持273.28万股,"/news,688303,1312953071.html",大全能源资讯,05-25 08:07
347,3,大全能源：连续18日融资净偿还累计1.97亿元（05-24）,"/news,688303,1312948256.html",大全能源资讯,05-25 07:41
544,5,大全能源05月23日获沪股通增持122.76万股,"/news,688303,1312468416.html",大全能源资讯,05-24 08:08
214,0,大全能源：连续17日融资净偿还累计1.75亿元（05-23）,"/news,688303,1312462266.html",大全能源资讯,05-24 07:41
499,3,大全能源05月22日获沪股通增持112.18万股,"/news,688303,1311991352.html",大全能源资讯,05-23 08:07
231,0,大全能源：连续16日融资净偿还累计1.74亿元（05-22）,"/news,688303,1311986590.html",大全能源资讯,05-23 07:43
481,3,大全能源本周融资净偿还3421.14万元，居光伏设备板块第四,"/news,688303,1311446450.html",大眼看两融,05-21 03:04
386,0,大全能源本周沪股通持股市值增加7602.38万元，居光伏设备板块第八,"/news,688303,1311440738.html",胖猫周周见,05-21 02:04
616,2,大全能源05月19日获沪股通增持78.86万股,"/news,688303,1311352324.html",大全能源资讯,05-20 08:10
348,1,大全能源：连续15日融资净偿还累计1.68亿元（05-19）,"/news,688303,1311347213.html",大全能源资讯,05-20 07:42
528,5,大全能源05月18日获沪股通增持33.24万股,"/news,688303,1310876718.html",大全能源资讯,05-19 08:13
213,0,大全能源：连续14日融资净偿还累计1.6亿元（05-18）,"/news,688303,1310870624.html",大全能源资讯,05-19 07:46
361,1,大全能源05月17日获沪股通增持47.2万股,"/news,688303,1310370229.html",大全能源资讯,05-18 08:10
226,0,大全能源：连续13日融资净偿还累计1.55亿元（05-17）,"/news,688303,1310364805.html",大全能源资讯,05-18 07:43
322,0,大全能源05月16日获沪股通增持5.5万股,"/news,688303,1309904183.html",大全能源资讯,05-17 08:13
219,0,大全能源：连续12日融资净偿还累计1.51亿元（05-16）,"/news,688303,1309897137.html",大全能源资讯,05-17 07:41
272,0,大全能源05月15日获沪股通增持27.37万股,"/news,688303,1309432134.html",大全能源资讯,05-16 08:08
4032,12,大全能源：内蒙古一期1000吨半导体级硅料正在建设中，预计3季度左右投产,"/news,688303,1309431034.html",大全能源资讯,05-16 08:00
207,0,大全能源：连续11日融资净偿还累计1.49亿元（05-15）,"/news,688303,1309426819.html",大全能源资讯,05-16 07:41
2876,4,大全能源：公司内蒙古一期10万吨多晶硅产能可以100%生产N型产品,"/news,688303,1309385632.html",大全能源资讯,05-15 10:12
1307,0,【调研快报】大全能源接待盈方得(平潭)私募基金管理有限公司等多家机构调研,"/news,688303,1309365593.html",大全能源资讯,05-15 08:54
3104,20,大全能源：一季度为稳定毛利率水平 牺牲了部分销量,"/news,688303,1309364523.html",大全能源资讯,05-15 08:46
2262,6,踊跃“追光”也要直面挑战,"/news,688303,1308931360.html",大全能源资讯,05-15 12:29
288,0,大全能源本周融资净偿还4698.83万元，居光伏设备板块第四,"/news,688303,1308872238.html",大眼看两融,05-14 03:05
312,0,大全能源本周沪股通持股市值增加5634.73万元，居光伏设备板块第五,"/news,688303,1308865864.html",胖猫周周见,05-14 02:05
544,2,大全能源05月12日获沪股通增持71.94万股,"/news,688303,1308746945.html",大全能源资讯,05-13 08:08
323,0,大全能源：连续10日融资净偿还累计1.34亿元（05-12）,"/news,688303,1308743306.html",大全能源资讯,05-13 07:43
185956,269,重大调整！MSCI宣布：京沪高铁、大全能源等A股被纳入 5月31日盘后生效,"/news,688303,1308481967.html",大全能源资讯,05-12 12:48
247,0,大全能源05月11日获沪股通增持24.64万股,"/news,688303,1308274344.html",大全能源资讯,05-12 08:01
223,0,大全能源：连续9日融资净偿还累计1.25亿元（05-11）,"/news,688303,1308268563.html",大全能源资讯,05-12 07:36
285,0,大全能源05月10日获沪股通增持5.67万股,"/news,688303,1307776686.html",大全能源资讯,05-11 08:06
264,0,大全能源：连续8日融资净偿还累计1.19亿元（05-10）,"/news,688303,1307771619.html",大全能源资讯,05-11 07:43
206,0,大全能源股价连续2日创历史新低,"/news,688303,1307625007.html",数据快报,05-10 03:45
399,3,大全能源05月09日获沪股通增持61.33万股,"/news,688303,1307267648.html",大全能源资讯,05-10 08:06
234,0,大全能源：连续7日融资净偿还累计1.12亿元（05-09）,"/news,688303,1307261639.html",大全能源资讯,05-10 07:36
317,2,大全能源05月08日被沪股通减持18.62万股,"/news,688303,1306716837.html",大全能源资讯,05-09 07:59
298,2,大全能源：连续6日融资净偿还累计9163.2万元（05-08）,"/news,688303,1306711856.html",大全能源资讯,05-09 07:40
7232,25,硅料龙头大全能源一季度盈利增长熄火 毛利率仍高达72%,"/news,688303,1306077024.html",大全能源资讯,05-06 08:42
410,0,大全能源05月05日获沪股通增持83.03万股,"/news,688303,1305997009.html",大全能源资讯,05-06 08:05
273,0,大全能源：连续5日融资净偿还累计8695.43万元（05-05）,"/news,688303,1305992892.html",大全能源资讯,05-06 07:37
322,1,大全能源股价创历史新低,"/news,688303,1305853783.html",数据快报,05-05 03:40
223,0,大全能源05月04日被沪股通减持12.22万股,"/news,688303,1305511500.html",大全能源资讯,05-05 08:07
168,0,大全能源：连续4日融资净偿还累计8693.79万元（05-04）,"/news,688303,1305505075.html",大全能源资讯,05-05 07:32
197,0,大全能源本周融资净偿还5757.21万元，居光伏设备板块第四,"/news,688303,1304902783.html",大眼看两融,05-03 03:04
206,0,大全能源本周沪股通持股市值减少1.23亿元，居光伏设备板块第三,"/news,688303,1304897000.html",胖猫周周见,05-03 02:05
465,3,大全能源04月28日获沪股通增持51.62万股,"/news,688303,1304692697.html",大全能源资讯,04-29 08:07
262,0,大全能源：连续3日融资净偿还累计8548.63万元（04-28）,"/news,688303,1304688035.html",大全能源资讯,04-29 07:39
1262,6,中金公司维持大全能源跑赢行业评级 目标价60.29元,"/news,688303,1304616406.html",公司研报提示,04-28 09:13
191,0,大全能源04月27日被沪股通减持2.56万股,"/news,688303,1304097059.html",大全能源资讯,04-28 08:12
151,0,大全能源：融资净偿还1965.13万元，融资余额14.84亿元（04-27）,"/news,688303,1304089458.html",大全能源资讯,04-28 07:39
1424,2,大全能源股东户数增加5.33%，户均持股36.28万元,"/news,688303,1303959575.html",大全能源资讯,04-27 06:51
1166,4,大全能源：2023年一季度净利润同比下降32.49%,"/news,688303,1303952750.html",一句话财报,04-27 06:34
237,0,大全能源04月26日被沪股通减持43.47万股,"/news,688303,1303511530.html",大全能源资讯,04-27 08:09
213,1,XD大全能：融资净偿还4327.5万元，融资余额15.03亿元（04-26）,"/news,688303,1303504179.html",大全能源资讯,04-27 07:41
295,1,大全能源04月25日被沪股通减持88.98万股,"/news,688303,1302934470.html",大全能源资讯,04-26 08:13
234,0,大全能源：融资余额15.46亿元，创历史新高（04-25）,"/news,688303,1302925415.html",大全能源资讯,04-26 07:35
229,0,大全能源04月24日被沪股通减持160.01万股,"/news,688303,1302319786.html",大全能源资讯,04-25 08:09
164,0,大全能源：融资净买入334.44万元，融资余额15.21亿元（04-24）,"/news,688303,1302314549.html",大全能源资讯,04-25 07:44
6424,33,大全能源发生大宗交易 成交折价率19.12%,"/news,688303,1302243155.html",大全能源资讯,04-24 09:03
3771,41,大宗交易：大全能源成交799.82万元，折价19.12%（04-24）,"/news,688303,1302170735.html",大全能源资讯,04-24 05:19
260,0,大全能源本周融资净买入1203.04万元，居光伏设备板块第八,"/news,688303,1301646916.html",大眼看两融,04-23 03:04
496,1,大全能源本周沪股通持股市值增加1.25亿元，居光伏设备板块第四,"/news,688303,1301638880.html",胖猫周周见,04-23 02:05
462,1,大全能源04月21日获沪股通增持119.28万股,"/news,688303,1301509410.html",大全能源资讯,04-22 08:15
221,0,大全能源：融资净偿还844.84万元，融资余额15.18亿元（04-21）,"/news,688303,1301505066.html",大全能源资讯,04-22 07:46
237,0,大全能源04月20日获沪股通增持82.79万股,"/news,688303,1300923852.html",大全能源资讯,04-21 08:11
154,0,大全能源：融资净偿还805.04万元，融资余额15.27亿元（04-20）,"/news,688303,1300917574.html",大全能源资讯,04-21 07:42
246,0,大全能源04月19日获沪股通增持36.17万股,"/news,688303,1300324650.html",大全能源资讯,04-20 08:05
197,0,大全能源：连续4日融资净买入累计4780.95万元（04-19）,"/news,688303,1300318953.html",大全能源资讯,04-20 07:40
195,1,大全能源04月18日被沪股通减持17.35万股,"/news,688303,1299775041.html",大全能源资讯,04-19 08:12
151,1,大全能源：连续3日融资净买入累计4763.24万元（04-18）,"/news,688303,1299768300.html",大全能源资讯,04-19 07:36
3221,8,大全能源定增募投项目“年产10万吨高纯硅基材料项目”投产,"/news,688303,1299714770.html",大全能源资讯,04-18 09:24
3857,10,大全能源2022年度10派36元,"/news,688303,1299648595.html",大全能源资讯,04-18 05:49
2523,13,大全能源：年产10万吨高纯硅基材料项目部分项目投产,"/news,688303,1299641809.html",大全能源资讯,04-18 05:25
271,0,大全能源04月17日获沪股通增持27.99万股,"/news,688303,1299224731.html",大全能源资讯,04-18 08:10
199,0,大全能源：融资净买入1275.57万元，融资余额15.19亿元（04-17）,"/news,688303,1299219086.html",大全能源资讯,04-18 07:43
358,1,大全能源本周融资净买入2096.27万元，居光伏设备板块第十一,"/news,688303,1298568701.html",大眼看两融,04-16 03:04
296,1,大全能源本周获沪股通增持64.32万股 最新持股量414.09万股,"/news,688303,1298561467.html",胖猫周周见,04-16 02:04
495,2,大全能源04月14日获沪股通增持44.52万股,"/news,688303,1298436929.html",大全能源资讯,04-15 08:11
310,0,大全能源：融资净买入1928.02万元，融资余额15.06亿元（04-14）,"/news,688303,1298432647.html",大全能源资讯,04-15 07:40
301,0,大全能源04月13日获沪股通增持10.04万股,"/news,688303,1297883555.html",大全能源资讯,04-14 08:10
229,0,大全能源：融资净偿还1437.74万元，融资余额14.87亿元（04-13）,"/news,688303,1297877932.html",大全能源资讯,04-14 07:43
272,1,大全能源04月12日被沪股通减持5.29万股,"/news,688303,1297293409.html",大全能源资讯,04-13 08:10
215,0,大全能源：融资净买入2129.88万元，融资余额15.01亿元（04-12）,"/news,688303,1297285543.html",大全能源资讯,04-13 07:32
328,1,大全能源04月11日获沪股通增持15.05万股,"/news,688303,1296726595.html",大全能源资讯,04-12 08:14
241,0,大全能源：融资净偿还1266.37万元，融资余额14.8亿元（04-11）,"/news,688303,1296719284.html",大全能源资讯,04-12 07:41
2717,15,大宗交易：机构账户卖出大全能源945.74万元（04-11）,"/news,688303,1296578693.html",大全能源资讯,04-11 05:18
229,0,大全能源：融资净买入742.48万元，融资余额14.92亿元（04-10）,"/news,688303,1296187413.html",大全能源资讯,04-11 07:41
355,0,大全能源：融资净偿还494.97万元，融资余额14.85亿元（04-07）,"/news,688303,1295408883.html",大全能源资讯,04-08 07:38
284,0,大全能源：融资净买入1228.61万元，融资余额14.9亿元（04-06）,"/news,688303,1294931253.html",大全能源资讯,04-07 07:39
361,0,大全能源04月04日被沪股通减持38.57万股,"/news,688303,1294271448.html",大全能源资讯,04-05 08:13
301,0,大全能源：连续3日融资净偿还累计2665.39万元（04-04）,"/news,688303,1294266897.html",大全能源资讯,04-05 07:39
4974,18,大全能源：内蒙基地一期项目已建成投产 预计将于6月达产,"/news,688303,1294174624.html",大全能源资讯,04-04 05:25
3274,11,【调研快报】大全能源接待山西资管等多家机构调研,"/news,688303,1294171181.html",大全能源资讯,04-04 05:11
261,0,大全能源：融资净偿还1186.16万元，融资余额14.84亿元（04-03）,"/news,688303,1293753716.html",大全能源资讯,04-04 07:42
294,1,大全能源本周融资净买入2495.71万元，居光伏设备板块第六,"/news,688303,1293155392.html",大眼看两融,04-02 03:05
481,1,沪股通连续3周净买入大全能源 累计净买入1.23亿元,"/news,688303,1293148905.html",胖猫周周见,04-02 02:05
355,0,大全能源：融资净偿还891.23万元，融资余额14.95亿元（03-31）,"/news,688303,1293065302.html",大全能源资讯,04-01 10:29
434,2,大全能源03月30日获沪股通增持32.13万股,"/news,688303,1292581546.html",大全能源资讯,03-31 08:12
239,0,大全能源：连续4日融资净买入累计3386.94万元（03-30）,"/news,688303,1292575775.html",大全能源资讯,03-31 07:40
6570,17,硅料价五连降！新产能持续释放 二季度继续下探？,"/news,688303,1292208052.html",大全能源资讯,03-30 10:40
281,2,大全能源03月29日被沪股通减持5.12万股,"/news,688303,1292066685.html",大全能源资讯,03-30 08:15
261,0,大全能源：连续3日融资净买入累计1314.46万元（03-29）,"/news,688303,1292060326.html",大全能源资讯,03-30 07:43
1983,4,直击业绩会|大全能源：募投项目进展顺利 硅料价格稳步回落利于行业健康发展,"/news,688303,1291488818.html",大全能源资讯,03-29 09:21
268,0,大全能源03月28日被沪股通减持9.63万股,"/news,688303,1291464673.html",大全能源资讯,03-29 08:04
220,0,大全能源：融资净买入183.55万元，融资余额14.75亿元（03-28）,"/news,688303,1291454881.html",大全能源资讯,03-29 07:42
2396,4,大全能源：硅料价格稳步回落有利于整个行业健康发展,"/news,688303,1291341492.html",大全能源资讯,03-28 08:43
2832,5,大全能源：公司战略是向上整合制造工业硅 横向发展光伏级硅料等,"/news,688303,1291341491.html",大全能源资讯,03-28 08:43
355,1,大全能源03月27日被沪股通减持24.6万股,"/news,688303,1290861136.html",大全能源资讯,03-28 07:58
216,0,大全能源：融资净买入259.58万元，融资余额14.73亿元（03-27）,"/news,688303,1290855483.html",大全能源资讯,03-28 07:34
262,0,大全能源本周融资净偿还664.79万元，居光伏设备板块第十一,"/news,688303,1290275820.html",大眼看两融,03-26 03:04
348,0,大全能源：本周沪股通持股量环比增加42%，周内增仓幅度居光伏设备板块第九,"/news,688303,1290269458.html",胖猫周周见,03-26 02:04
